JobDesc,JobTitle
"who we are aunalytics provides a leading-edge cloud platform, where businesses run their core applications on secure, high performance computing infrastructure, create integrated data-marts using enterprise analytics software, and gain on-demand access to technology and data science experts to develop algorithms that drive digital transformation. position overview as a member of the data science team, you will help client companies leverage massive amounts of disparate data to solve their toughest problems and arrive at data-driven answers with greater speed and accuracy. you will work with clients to develop customized algorithms that are used to answer their most pressing business questions—providing insights that increase their roi. essential duties & responsibilities: use machine learning and ai to model complex problems, discover insights, and identify opportunities integrate and prepare large, varied datasets; architect specialized database and computing environments; and communicate results develop experimental design approaches to validate finding or test hypotheses solve client analytics’ problems and communicates results and methodologies in an easy to understandable manner research new approaches/methods to improve, optimize, and test targeted questions work closely with business analysts to gain an understanding of client business and problems additional duties as assigned to ensure client and company success required skills: m.s., or phd in a quantitative discipline: computer science, statistics, operations research, applied mathematics, engineering, mathematics or related quantitative fields proficient in programming environment and languages such as: node.js, python, r, javascript, sql, and deep knowledge of analytic packages available for above languages prior research or development experience working with data, solving problems with data, and experience building advanced analytic models strong working knowledge of machine learning and statistics ability to communicate your ideas (verbal and written) so that team members and clients can understand them ability to defend your professional decisions and organize proof that your ideas and processes are correct resourceful in getting things done, self-starter, productive working independently or collaboratively – ours is a fast-pace entrepreneurial environment with performance expectations and deadlines inquisitiveness and an eagerness to learn new technologies and apply concepts to real world problems share our values: growth, relationships, integrity, and true grit what's in it for you? opportunity to work with a rapidly expanding tech company in the booming field of data science and cloud computing, alongside some of the brightest minds in the industry opportunity to work with cutting-edge technology in a casual, fun environment opportunity to be a part of a local company committed to making a difference in our community chance to work with a rapidly expanding tech company flexible schedule and paid time off free snacks and an unlimited supply of coffee social events such as happy hours, game nights, holiday parties, birthday celebrations, movie days, ice cream sundae bars, fancy coffee carts, company softball team, etc. competitive salary and benefits package including health, vision, dental, and life insurance job type: full-time benefits: 401(k) dental insurance disability insurance employee assistance program flexible schedule health insurance life insurance paid time off referral program vision insurance schedule: monday to friday supplemental pay: bonus pay work location: one location company's website: https://www.aunalytics.com/ benefit conditions: waiting period may apply work remotely: temporarily due to covid-19 covid-19 precaution(s): remote interview process social distancing guidelines in place virtual meetings",data scientist
"who we are aunalytics provides a leading-edge cloud platform, where businesses run their core applications on secure, high performance computing infrastructure, create integrated data-marts using enterprise analytics software, and gain on-demand access to technology and data science experts to develop algorithms that drive digital transformation. position overview as a member of the data science team, you will help client companies leverage massive amounts of disparate data to solve their toughest problems and arrive at data-driven answers with greater speed and accuracy. you will work with clients to develop customized algorithms that are used to answer their most pressing business questions—providing insights that increase their roi. essential duties & responsibilities: use machine learning and ai to model complex problems, discover insights, and identify opportunities integrate and prepare large, varied datasets; architect specialized database and computing environments; and communicate results develop experimental design approaches to validate finding or test hypotheses solve client analytics’ problems and communicates results and methodologies in an easy to understandable manner research new approaches/methods to improve, optimize, and test targeted questions work closely with business analysts to gain an understanding of client business and problems additional duties as assigned to ensure client and company success required skills: m.s., or phd in a quantitative discipline: computer science, statistics, operations research, applied mathematics, engineering, mathematics or related quantitative fields proficient in programming environment and languages such as: node.js, python, r, javascript, sql, and deep knowledge of analytic packages available for above languages prior research or development experience working with data, solving problems with data, and experience building advanced analytic models strong working knowledge of machine learning and statistics ability to communicate your ideas (verbal and written) so that team members and clients can understand them ability to defend your professional decisions and organize proof that your ideas and processes are correct resourceful in getting things done, self-starter, productive working independently or collaboratively – ours is a fast-pace entrepreneurial environment with performance expectations and deadlines inquisitiveness and an eagerness to learn new technologies and apply concepts to real world problems share our values: growth, relationships, integrity, and true grit what's in it for you? opportunity to work with a rapidly expanding tech company in the booming field of data science and cloud computing, alongside some of the brightest minds in the industry opportunity to work with cutting-edge technology in a casual, fun environment opportunity to be a part of a local company committed to making a difference in our community chance to work with a rapidly expanding tech company flexible schedule and paid time off free snacks and an unlimited supply of coffee social events such as happy hours, game nights, holiday parties, birthday celebrations, movie days, ice cream sundae bars, fancy coffee carts, company softball team, etc. competitive salary and benefits package including health, vision, dental, and life insurance job type: full-time benefits: 401(k) dental insurance disability insurance employee assistance program flexible schedule health insurance life insurance paid time off referral program vision insurance schedule: monday to friday supplemental pay: bonus pay work location: one location company's website: https://www.aunalytics.com/ benefit conditions: waiting period may apply work remotely: temporarily due to covid-19 covid-19 precaution(s): remote interview process social distancing guidelines in place virtual meetings",data scientist
"meet medpro group. we’re an industry-leading berkshire hathaway insurance company with a passion for our clients and our team. we are hundreds of professionals with varied backgrounds and experience levels who came together to achieve one goal: protecting those who have made it their mission to serve and care for others. never considered the insurance industry before? we think you should.  in this role you will…  translate business needs, processes and procedures into a workable system, and articulate on specific data science requirements by communicating about these requirements with technology experts. participate in developing functional requirements, testing, training and implementing data science solutions. develop detailed system requirements based on business needs, utilizing standard documentation guidelines and coordinating with technical resources throughout project cycle. participate in reviewing, analyzing, and evaluating underwriting and claims' user needs. participate in project meetings, project tracking, analysis, and reporting. provide reporting analysis on key projects and delivery outcomes with the business clients. develop documents for data science applications, system specifications and test plans, according to existing standards and methodologies. support implementation of high impact, cross-functional projects aligned with strategic business initiatives under the direction of a project manager or data scientist. support small to medium size projects including project planning, requirements definition and documentation, test case definition, execution of testing, and project implementation. assist in handling post-production issues until project has been approved for release to the business. perform other duties as assigned.  we are looking for candidates with…  bachelor’s degree or equivalent project/insurance experience. 3 or more years of related project or insurance experience. strong analytical skills. ability to resolve problematic issues in an efficient manner. excellent organizational and communication skills, demonstrated ability to work across technical and non-technical resources. understanding of systems and technical design. strong pc skills including word, excel, powerpoint, and visio. demonstrated ability to work independently and as a team member. ability to handle multiple, changing priorities, and deadlines in a very fast paced working environment.  why medpro?  medpro group’s mission is built on a century-old legacy of protecting those who protect others. from our roots in our hometown of fort wayne, indiana, we've worked diligently to become the nation's premier healthcare liability coverage provider, currently insuring more than 300,000 customers. with that growth, we've built a significant presence in all 50 states. our team works across the country to provide the best strategies to mitigate risk and preserve the reputations of those who have entrusted their good name to us. that passion – built on a foundation of a culture that values uncompromised integrity, obsessive client focus, great teamwork, and a long-term mindset – makes medpro a preferred employer that many call their career home.  general: medpro group is an equal opportunity employer.",data scientist
"bairesdev is proud to be one of the fastest-growing companies in latin america and a welcoming, highly rated employer (glassdoor employee score: 4.3). with more than 2,200 employees in 27 countries and world-class clients from start-ups to fortune 500 companies, we’re only as strong as the multicultural teams at the heart of our business. bairesdev runs on talent. to consistently deliver the highest quality solutions to our clients, we only hire the top 1% of it talent and nurture their professional growth on exciting projects for companies like google, pinterest, and udemy. we are looking for machine learning developers to work from home and join our development team and participate in different projects made up of multicultural teams distributed throughout the world. we are looking for proactive people, team players passionate about programming in this language and oriented to provide the best experience to the end user. this is an excellent opportunity for those professionals looking to develop in one of the fastest growing companies in the industry! these engineers will face numerous technical challenges, so they must use current technologies, get involved in the mobile world, web applications, devices, etc. what you’ll do: collaborate with data science and engineering teams to build machine learning solutions. create end to end workflows that perform feature extraction, label generation, model development and retraining and deployment of said models. research and implement cutting edge deep learning architecture. work with product team to code and deploy machine learning systems. design, develop and test tools and frameworks to improve data science teams productivity speeding up the development cycle. you must have: 5+ years of experience in machine learning. strong coding skills in python and spark. hands-on experience in both designing and implementing large scale ml applications. experience with the full product lifecycle, from requirements to production. advanced english level. bairesdev offers: 100% remote work. - flexible hours - make your own schedule! diverse and multicultural work environment. paid parental leave, vacation & holidays. hardware setup for you to work from home. excellent compensation — well above the market average. extensive opportunities for growth and professional development thanks to our mentoring system.  at bairesdev, remote work is at our core. enjoy the opportunity to have a dynamic lifestyle, better health, and wellness. find renewed passion in your job, improve your productivity, and benefit from attractive growth opportunities for your career. if you are interested in being part of a team composed of the best professionals and working 100% goal-oriented in an innovative environment, but with the structure and resources of a multinational market leader, do not hesitate to apply!",data scientist
"overview: cook research incorporated is currently accepting applications for a statistician to become a part of our growing biostatistics team. responsibilities: support the statistical needs of global projects on behalf of the organization apply statistical and research methodological principles to the design, execution, analysis, and interpretation of clinical studies, as well as assist in defining the strategy for clinical studies ensure that data and statistical activities comply with regulatory and company standards author and provide input on relevant sections of clinical research protocols along with the content and format of data collection activities advise on safety monitoring of clinical studies, including the development of appropriate study monitoring criteria provide statistical support on the design and execution of bench and animal testing protocols and in the development of quality systems related to the manufacturing of medical devices maintain familiarity with company statistical software and provide custom programming for data reporting and statistical analysis qualifications: master’s degree or phd in statistics education and/or experience must include: using sas programming language for import/export, transformation, statistical analysis and visualization of clinical data; experimental design; generalized linear regression; survival analysis; longitudinal data; mixed effect models; statistical/machine learning; statistical software tool (e.g. r, spss, and/or m-plus); clinical studies; and fda and other regulatory requirements ability to program in the sas language prior experience in the conduct of clinical studies, preferably in the medical device industry working knowledge of fda and other regulatory requirements that may impact global clinical studies",data scientist
"in this role, you will make an impact in the following ways: global data analytics/reporting: eeec, sustainability metrics, and charitable spend; will use analytical/reporting tools to bring value to stakeholders: power bi, excel, and related technologies . responsible for managing business intelligence ( bi ) in the corporate responsibility teams space will take ownership of corporate responsibility power business intelligence ( bi ) workspace database/information management; will u se database management/cleansing tools: visual studio (ssas and ssis), ssms, power bi, power query, excel to insure data quality and organization global customer service & system management; will be business owner for my community sharepoint site and responsible for continuously improving site and customer experience ad hoc reporting and analytics projects and requests; will work with partners completing donation processing, collection, and matching, leadership scorecard surveys, sustainability metrics qualifications to be successful in this role you will need the following : intermediate experience in a relevant discipline is required, 3-6 years’ experience knowledge of the latest technologies and trends in data science is highly preferred and includes: sql query language execution on nosql and sql sources, data profiling tools, technologies and coding, data catalog tools and technologies, business intelligence tools and technologies, power bi intermediate experiences in the following are preferred: exposure to big data open source, clustered compute cloud-based implementation experience college, university, or equivalent degree in information technology, business or a related subject required compensation and benefits base salary rate commensurate with experience. additional benefits vary between locations and include options such as our 401(k) retirement savings plan, cash balance pension plan, medical/dental/life insurance, health savings account, domestic partners coverage and a full complement of personal and professional benefits. cummins and e-verify at cummins, we are an equal opportunity and affirmative action employer dedicated to diversity in the workplace. our policy is to provide equal employment opportunities to all qualified persons without regard to race, gender, color, disability, national origin, age, religion, union affiliation, sexual orientation, veteran status, citizenship, gender identity and/or expression, or other status protected by law. cummins validates right to work using e-verify. cummins will provide the social security administration (ssa) and, if necessary, the department of homeland security (dhs), with information from each new employee’s form i-9 to confirm work authorization. ready to think beyond your desk? apply for this opportunity to start your career with cummins today.careers.cummins.com not ready to apply but want to learn more? join our talent community to get the inside track on great jobs and confidentially connect to our recruiting team: https://www.cumminstalentcommunity.com/profile/join/ job systems/information technology primary location united states-indiana-columbus-us, in, columbus, commons office building job type experienced - exempt / office recruitment job type exempt - experienced job posting feb 28, 2021, 8:15:24 pm unposting date ongoing",data scientist
"a career at our company is an ongoing journey of discovery: our 58,000 people are shaping how the world lives, works and plays through next generation advancements in healthcare, life science and electronics. for more than 350 years and across the world we have passionately pursued our curiosity to find novel and vibrant ways of enhancing the lives of others.  job location: electronic city, bangalore  responsibilities  as text analytics expert, he/she will investigate and implement text mining and natural language processing-based solutions for solving real world business problems, he/she will focus on building information extraction, information retrieval, predictive models. at the project level, he/she will need to identify the appropriate techniques, develop new data sets and models, define and monitor success, and communicate with technical and non-technical partners within the team  skills degree in computer science, information science, data mining, bioinformatics, or similar fields a min of 4 years' experience in text mining, natural language processing, machine learning applied to text data, information extraction and information retrieval experience developing and applying nlp and machine learning methods in java, python, or scala experience in python libraries for text data analyses and machine learning such as nltk, spacy, scikitlearn, tensorflow, word2vec, bert experience in document indexing systems such as elasticsearch, solr or lucene experience with apache open-source text mining frameworks such as uima or gate is a plus experience working with biomedical open-source ontologies and terminologies such as mesh, meddra, umls, snomed etc. is a plus experience with publication databases such as pubmed, pubmedcentral, clinicaltrials.gov, patbase, freepatentsonline is a plus experience working with open-source lexicons such as dbpedia, wordnet is a plus experience developing or applying text analytics solutions in hadoop data lake environment is an added asset excellent written and verbal communication skills, with ability to communicate effectively within the team progressive thinker and problem solver, with a strong ability to manage ambiguity/complexity.   what we offer: with us, there are always opportunities to break new ground. we empower you to fulfil your ambitions, and our diverse businesses offer various career moves to seek new horizons. we trust you with responsibility early on and support you to draw your own career map that is responsive to your aspirations and priorities in life. join us and bring your curiosity to life!  curious? apply and find more information at https://jobs.vibrantm.com  job requisition id: 220304  location: bangalore  career level: d - professional (4-9 years)  working time model: full-time  careers during covid-19 thank you for visiting our careers website, we are always looking for curious minds to join our teams. we understand how much the world is being impacted by the covid-19 crisis and we want to assure you that your safety is very important to us. to ensure that everyone's health is protected, instead of a standard face-to-face interview, it is likely that you will be offered alternative digital interview options.  us disclosure the company is an equal employment opportunity employer. no employee or applicant for employment will be discriminated against on the basis of race, color, religion, age, sex, sexual orientation, national origin, ancestry, disability, military or veteran status, genetic information, gender identity, transgender status, marital status, or any other classification protected by applicable federal, state, or local law. this policy of equal employment opportunity applies to all policies and programs relating to recruitment and hiring, promotion, compensation, benefits, discipline, termination, and all other terms and conditions of employment. any applicant or employee who believes they have been discriminated against by the company or anyone acting on behalf of the company must report any concerns to their human resources business partner, legal, or compliance immediately. the company will not retaliate against any individual because they made a good faith report of discrimination.  north america disclosure the company is committed to accessibility in its workplaces, including during the job application process. applicants who may require accommodation during the application process should speak with our hr services team at 855 444 5678 from 8:00am to 5:30pm et monday through friday.  job segment: biotech, computer science, developer, java, learning, science, technology, human resources",data scientist
