JobDesc,JobTitle
"About AbbVie AbbVie’s mission is to discover and deliver innovative medicines that solve serious health issues today and address the medical challenges of tomorrow. We strive to have a remarkable impact on people’s lives across several key therapeutic areas: immunology, oncology, neuroscience, eye care, virology, women’s health and gastroenterology, in addition to products and services across its Allergan Aesthetics portfolio. For more information about AbbVie, please visit us at www.abbvie.com. Follow @abbvie on Twitter, Facebook, Instagram, YouTube and LinkedIn. Independently translate and implement algorithms and protocols in a high performance computing environment. Apply bioinformatics algorithms and prepare reports of results in a reproducible manner. Provide statistical programming support for multiple clinical projects or therapeutic areas &amp; performance management for statistical programmers. Optimize existing pipelines and workflows, as well as help establish new pipelines and workflows. Retrieve and organize complex data types and structures as needed. Responsible for compliance with applicable Corporate and Divisional Policies and procedures Ensure internal consistency of output and assess consistency with other activities for the project, as applicable. Leads effort to determine project standards related to output design and statistical programming conventions and independently ensure they are appropriate to support project objectives Responsible for monitoring regulatory guidance and industry best practices to formulate proposals for new functional standards; the accuracy of SAS programs by reviewing output, reviewing code, reviewing log files and running all checking utilities; determining the scope of the peer review and for ensuring peer review has been completed for all activities for the assigned projects Ensure all SAS programs are imported into the archive system prior to the creation of final output; all programs are formally archived after the completion of the regulated activity; clarity, accuracy and consistency of case report forms (CRFs), database definitions, and specifications for analysis data sets for individual studies Develop database checks for routine and non-routine situations. Design and develop various software and systems to effectively generalize programming effort across projects. Participate in the development of standard data quality assurance tools Responsible for the creation and accuracy of derivation programs for routine and non-routine situations, submission data sets and analysis programs, and data definition documents and TOCs; ensuring peer review has been completed for all derivation programs for assigned projects; monitoring regulatory guidance and industry best practices to formulate proposals for new functional standards for submission data sets &amp; programs. Responsible for formulating proposals for new utilities, as well as, presenting information on existing utilities and identifying opportunities for productivity improvements and formulating implementation plans Provide accurate and timely responses to routine requests from clients. Guide clients on possible options for deliverables for non-routine requests. Responsible for developing and maintaining good client relationships. Ensures that self and staff are compliant with training requirements. Effectively mentor statistical programming and non-statistical programming peers with regard to functional operations.  Qualifications Master’s degree in Computer Science, Bioinformatics, Biostatistics, or related field, with at least 8 years of relevant experience, or Bachelor’s degree with at least 10 years of relevant experience. MS in Statistics, Computer Science or a related field with 8+ years of relevant experience or BS in Statistics, Computer Science or a related field with 10+ years of relevant experience High degree of technical competency and strong communication ability, as well as fluency in 2 or more or relevant programming languages, such as R, Python, Perl, Ruby, Java, or C++. Competent in SAS programming and Macro development. Demonstrated proficiency in a Linux environment and high performance distributed computing with system administration experience is desired. Experience handling and managing data/software associated with high-throughput instruments for genetics and/or genomics. SAS Macros expertise. GPU programming skills. Experience with cloud computing, version control, and Docker or similar technologies Experience with SQL or other languages used for managing relational databasesFluency with genomic databases (such as those relating to genome annotation, genetic variants, public data repositories). Pharmaceutical experience with clinical trials, including familiarity with expectations of regulatory agencies, especially FDA and EMEA. NDA/BLA or other regulatory filing experience, including ISS or ISE experience Thorough understanding of ICH Guidelines and relevant regulatory requirementsProject lead experience required. Management experience not required. Strong communication skills in a collaborative environment  Significant Work Activities Continuous sitting for prolonged periods (more than 2 consecutive hours in an 8 hour day) Travel No Job Type Experienced Schedule Full-time Job Level Code M Equal Employment Opportunity At AbbVie, we value bringing together individuals from diverse backgrounds to develop new and innovative solutions for patients. As an equal opportunity employer we do not discriminate on the basis of race, color, religion, national origin, age, sex (including pregnancy), physical or mental disability, medical condition, genetic information gender identity or expression, sexual orientation, marital status, protected veteran status, or any other legally protected characteristic.",Data Scientist
"Team Name: Global Insights Job Title: Senior Data Analyst, Game Analytics Requisition ID: R006342 Job Description: Blizzard Entertainment games don’t just begin with game ideas, or end once those games are released. A lot more goes into the creation of a Blizzard product than the work of developers—and we support our games for years after they’re in the hands of gamers world-wide. Blizzard Entertainment is seeking a Senior Data Analyst, Game Analytics to drive strategic analysis focused on identification, evaluation, and execution of opportunities to drive growth and operational excellence for our games. Covid-19 Hiring Update: We’ve transitioned to a work-from-home model and we’re continuing to interview and hire during this time. This role is expected to begin as a remote position. We understand each person’s circumstances may be unique and will work with you to explore possible interim options. RESPONSIBILITY Construct the vision for product-wide analysis from beginning to end. Address high level strategic questions through a holistic planning including clarifying on the question, developing hypotheses, building analytic structure to address the hypotheses. Write effective queries that return results accurately, maximize database efficiency, and are ready to scale for the future. Develop telemetry messaging for multiple features with scalability in mind. Collaborate with Game Designers, Product Managers, Engineers, and co-developer partners to deliver business impact, effectively communicate findings to both technical and non-technical audiences and translate recommendations into efficient action plans for senior management and department leaders MINIMUM QUALIFICATIONS Analytical orientation and strong problem-solving skills, demonstrated by the ability to structure an issue and analyze alternative solutions. Curious, internally-motivated self-starter with ability to plan, organize, and establish priorities to manage multiple projects and achieve results. Have the ability to structure a concise, clear presentation of findings, based on large sets of complex data, and effectively present this to any level in the organization with appropriate visualizations. Strong quantitative skills with a penchant for analytical query writing. PREFERRD QUALIFICATIONS 5+ years of work experience in Gaming, Management Consulting, Data Analytics, Data Science, or Product Management roles Experience communicating and advocating with analytical insights to executive-level audiences to inform decision making Familiarity with AB Testing/personalization process including test design, execution, analysis and develop actionable recommendation Demonstrated experience with some or all of the following: data modeling, data visualization, statistics, experimental design, predictive modeling Experience guiding and managing others to solve broad, impactful analytical problems Proficient in SQL; Adept in at least one visualization tool such as Tableau; R or Python knowledge is a plus Masters, MBA, or PhD preferred Application Materials Resume Cover Letter preferred Blizzard Entertainment is a global company committed to growing our employees along with the business. We offer generous benefits and perks with an eye on providing true work / life balance. We’ve worked hard to foster an intensely collaborative and creative environment, a diverse and inclusive employee culture, and training and opportunity for professional growth. Our people are everything. Our core values are real, and our mission has never changed. We are dedicated to creating the most epic entertainment experiences…ever. Join us! We are an Equal Opportunity Employer. All qualified applicants will receive consideration for employment without regard to race, color, religion, sex, sexual orientation, gender identity, gender expression, national origin, protected veteran status, or any other basis protected by applicable law, and will not be discriminated against on the basis of disability.",Data Scientist
"Provide expertise in the algorithm generation and data evaluation using Machine Learning and Data Science.  Key Responsibilities: Use complex modeling to generate algorithms to understand clinical data and patient characteristics Generated and update algorithm for optimization of the clinical trial processes and procedures Conduct ad hoc analysis and exploratory analysis Test and train algorithm based on machine learning models in real time Provide input in processing of structured and unstructured data Identify opportunities to leverage various sources of data to drive enhanced solutions Other incidental duties  Education and Experience: Bachelor's Degree in in Data Science, Computer Science, Statistics, Biostatistics, Bioinformatics or related scientific field, and 6 years of experience including either industry or industry/education or Master's Degree or equivalent in in Data Science, Computer Science, Statistics, Biostatistics, Bioinformatics or related scientific field, and 5 years of experience including either industry or industry/education or Ph.D. or equivalent in Data Science, Computer Science, Statistics, Biostatistics, Bioinformatics or related scientific field, and 2 years of experience including either industry or industry/education  Additional Skills: Extensive knowledge and understanding of principles, theories, and concepts relevant to Artificial Intelligence (AI) and/or Machine Learning model development, and/or Control Systems Experience with machine learning techniques (e.g., clustering, decision tree learning, artificial neural networks, etc.) Experience using statistical computer languages (e.g, R, Python, SQL, etc.) to manipulate large data sets Experience in data visualization tools (i.e. Qlikview, Tableau, etc.) Proven expertise in statistical techniques (e.g. distributions, statistical testing, regression, etc.) Experience with using web services (e.g., Redshift, S3, Spark, etc.) Proven expertise on MS Office Suite (e.g., Microsoft Office Excel, PowerPoint, Word, and Access) Working knowledge in related tools and applications (e.g., Oracle, JDE, Concur, Salesforce.com) preferred Excellent documentation and communication skills Excellent interpersonal relationship skills including negotiating and relationship management skills Represents organization in providing solutions to difficult technical issues associated with specific projects Adhere to all EHS rules and requirements and take adequate control measures in preventing injuries to themselves and others as well as to the protection of environment and prevention of pollution under their span of influence/control E dwards is an Equal Opportunity/Affirmative Action employer including protected Veterans and individuals with disabilities.",Data Scientist
"Job description Job Summary: Reporting to the Manager, Business Intelligence & Data, the Data Architect defines all aspects of data management, including storage, consumption access, governance and integrity and establishes, promotes and trains a network of key users that are data fluent with a culture of self-reliant, quick and effective data-driven decision support. Summary of Duties:  Inventories all data content (External, sensors, factory, product, business and design) Gathers and interprets data expectations from internal stakeholders Defines and implements Data Architecture that responds to expectations Works with Data specialists to implement data flows and data flows lifecycle Defines how data is processed, stored, and utilized Provides criteria for data processing operations Establishes data flows across systems for data integration and archiving purposes Owns, publishes and validates all reference data Establishes and updates a Business Data Framework in coordination with key Business Stakeholders Designs and implements security in a manner that enables effective and governed access to data Job requirements Education and Experience: Bachelor's degree, or equivalent, in computer science plus 8 years' experience in Data Science or related field; or 10 years' related experience and/or training; or equivalent combination of education and experience. Computer Skills:  Database Administration Data Structures Business systems design Management and manipulation of unstructured data Other Skills:  Data Quality Data Governance Cloud and Hybrid architecture Master and Business-Referential data management Data Exchange and processing (one or more of the following: EDI, API, ETL, MapReduce, Pig, Spark, Storm, NoSQL, MongoBD, etc) Additional Preferred Skills:  Experience with presentation of insights to business or functional users at all/any level of the organization Data science and advanced Analytics, Prescriptive Analytics, Artificial Intelligence, and Machine Learning Ability to effectively communicate in French Description: Senior-level position within field EEO Statement It is the policy of Safran to provide equal employment opportunity to all individuals regardless of their race, color, religion, sex, sexual preference, gender identity, pregnancy, age, national origin, disability, military or veteran status, citizenship status, genetics, or any other characteristic protected by applicable federal, state, and local laws. #LI-1KO1 Specificity of the job Working Conditions: 1. Does require fluent communication in English language. 2. Employment Status may be part-time, full-time, or temporary. 3. Traveling may be required. 4. Protracted or irregular hours may be required. 5. Relocation to another Safran facility may be required. Company information Safran is an international high-technology group, operating in the aviation (propulsion, equipment and interiors), defense and space markets. Its core purpose is to contribute to a safer, more sustainable world, where air transport is more environmentally friendly, comfortable and accessible. Safran has a global presence, with 79,000 employees and sales of 16.5 billion euros in 2020 and holds, alone or in partnership, world or regional leadership positions in its core markets. Safran undertakes research and development programs to maintain the environmental priorities of its R&T and Innovation roadmap. Safran ranks first in Forbes's 2020 list of the World's Best Employers for its sector. Safran Cabin is a world leader in fully integrated Cabin Interiors, Catering Systems and Cargo Equipment.",Data Scientist
"Primary Location: 195 Technology Dr, Irvine, CA, USA Division: Cox Automotive Job Level: Individual Contributor Travel: No Schedule: Full-time Shift: Day Job Requisition Number: 202101477 Position Summary: The Senior Data Analyst, International Business Development will be responsible for supporting Kelley Blue Book businesses in multiple international markets. Senior Data Analyst will analyze datasets for use in current products as well as future products. Products include internal vehicle valuation software, ETL processes, dealer and consumer products. The Senior Data Analyst will be responsible for analysis, insights, and recommendations for data quality and dataset use based on market requirements. Insights will be shared with cross-functional teams and stakeholders. Clear and concise communication is required as well as the ability to create technical documents and business requirements. The selected candidate will be a strategic thinker with technical expertise around data, reporting, and analytical approaches. This is a hands-on analytical role in a fast-paced environment.  Position responsibilities: Complete detailed dataset summary analyses that include, field density, unique values, counts, and data consistency scoring Run analyses on medium to large datasets, datasets can range from a minimum of 2,000 records to over 2 million records. Communicate dataset summaries with multiple internal/external stakeholders Communicate and establish relationships with third party data vendors regarding dataset questions and/or data quality feedback Create technical business requirements for software developers based on a complete understanding of business needs and data summary results Clearly define scope of work and deliverables in the business requirements Test thoroughly and validate development teams output based on business requirements Facilitate discussions of relevant data topics to share updates with various stakeholders Communicate task progress status and any potential delays that will have impact on the larger project Be the subject matter expert for current dataset as well as internally developed software products Work as a liaison between data end users and the software development team to troubleshoot any potential data issues that may arise Support 3 different business market needs regarding software platform or data questions Qualifications: Essential skills, knowledge and abilities: Bachelors degree (B.A. / B.S.) from four-year college or university; or a masters degree with 2+ years of experience. Minimum 5 years experience in a Data Analyst role or equivalent technical role A major in economics, mathematics, statistics, business, or similar quantitative field is preferred Automotive industry and automotive data experience is highly desired. (Vehicle configuration information, Model Year / Make / Model / Trim or Version) Acute analytical abilities and attention to detail are essential for this position Ability to work independently and formulate analysis plans with minimal supervision Ability to plan small to large scale projects and meet project deadlines Desire to work in a fast-paced environment where information must be digested quickly and decisions made immediately after Strong written, verbal, and listening skills Must be able to define problems, collect data, establish facts, and draw valid conclusions Experience working with cross functional teams to deliver on large scale projects Intermediate to Advanced SQL skills (Understanding of relational database theory and ability to write and understand complex SQL code) Intermediate to Advanced Microsoft Excel skills (Vlookups, Pivots, Macros, VBA, External data import/exports) Proficiency in additional Microsoft Office products including Outlook, Word, and PowerPoint: Non-essential skills, knowledge and abilities Experience working with International teams outside of the US is a plus Software UAT testing is a plus Experience with Business Intelligence software is a plus, ex. Microstrategy, Tableau, etc. Understanding of Software Development Lifecycles including Agile methodologies is a plus  Who We Are About Cox Automotive Theres nothing ordinary about Cox Automotive. We are people of every background driven by our passion for mobility, innovation, client success and community outreach. We make buying, selling and owning (or simply using) cars easier for everyone. Touching more than 40,000 clients across five continents, we bring together the best brands and the best teams to propel the automotive industry forward. Some of those team members work for our iconic consumer brands like Autotrader and Kelley Blue Book, while others are creating the future of automotive at industry-facing brands like Dealer.com, Manheim and vAuto. About Cox We are the Cox family of businesses. Weve been making our mark since 1898 by building and evolving world-class businesses, staying true to our values, and encouraging top talent to always look for growth and impact while building a career with us. Our primary divisions - Cox Communications and Cox Automotive - are driving a new wave of innovation, powering smart cities with powerhouse broadband communications and pioneering greener, more progressive transportation alternatives for individuals and fleet operators. Were also expanding into new spaces like cleantech and healthcare to rev up our momentum toward building a better future for the next generation. Were looking for the talent today who will be our leaders tomorrow. Sound intriguing? Learn more about where we are today, where we hope youll be going with us, and the common purpose that unites us at coxenterprises.com. Cox is an Equal Employment Opportunity employer - All qualified applicants/employees will receive consideration for employment without regard to that individuals age, race, color, religion or creed, national origin or ancestry, sex (including pregnancy), sexual orientation, gender, gender identity, physical or mental disability, veteran status, genetic information, ethnicity, citizenship, or any other characteristic protected by law. Statement to ALL Third-Party Agencies and Similar Organizations: Cox accepts resumes only from agencies with which we formally engage their services. Please do not forward resumes to our applicant tracking system, Cox employees, Cox hiring manager, or send to any Cox facility. Cox is not responsible for any fees or charges associated with unsolicited resumes.",Data Scientist
"One of the fastest growing startups is seeking a Data Scientist. They build a product that integrates Salesforce with Google.  If you are a Data Scientist with Python experience, please read on!  What You Will Be Doing  – Deal with with unstructured text, structured business data, and semi-structured relationship data. – Work on a Big Data platform – Work with a team of highly intelligent engineers that have a proven track record of success. – Transform sales from being driven by intuition to driven by science and data  Company: Unknown company  Qualifications: What You Need for this Position  – Master’s or PhD in Computer Science, Data Science, Business Analytics, Applied Mathematics, Physics – Python – R – NLP (natural language processing) – Machine learning techniques (regression, classifiers, clustering)  Bonus Points for: – Experience developing and shipping a data science product. – Experience with graph algorithms and network analysis  Specific requirements: Applicants must be authorized to work in the U.S.  Educational level: Master Degree",Data Scientist
