JobDesc,JobTitle
"Why choose between doing meaningful work and having a fulfilling life? At MITRE, you can have both. That's because MITRE people are committed to tackling our nation's toughest challenges—and we're committed to the long-term well-being of our employees. MITRE is different from most technology companies. We are a not-for-profit corporation chartered to work for the public interest, with no commercial conflicts to influence what we do. The R&D centers we operate for the government create lasting impact in fields as diverse as cybersecurity, healthcare, aviation, defense, and enterprise transformation. We're making a difference every day—working for a safer, healthier, and more secure nation and world. Our workplace reflects our values. We offer competitive benefits, exceptional professional development opportunities, and a culture of innovation that embraces diversity, inclusion, flexibility, collaboration, and career growth. If this sounds like the choice you want to make, then choose MITRE—and make a difference with us. The Aviation Safety & Analysis department is individuals with interest in applying their data science skills to deep and challenging problems in the aviation domain. We have a treasure trove of data including time series, text and sensor data and challenging problems to solve. We are seeking skills in machine learning, deep learning, text mining, big data and software/application development. If Sklearn, pyTorch, Keras,TensorFlow, LSTM, LDA, anomaly detection, entity extraction, summarization mean something to you, we want to talk to you. You are not required to have skills in all of these but should have hands-on skill in at least one area and the ability to dive deep in the data, and learn the necessary skills to get the job done. The candidate will work with the FAA and international customers, leveraging one of the largest repositories of aviation data to improve the capabilities, safety, and efficiency of the aviation system. The candidate will be responsible for supporting a team of more senior AI/ML staff and Data Scientists in the following tasks: Leveraging AI/ML techniques and solutions to identify complex patterns for predicting safety hazards Increasing the efficiency and quality of the vulnerability discovery process by tightly integrating automated processes, AI/ML techniques and human SME/analyst expertise Develop and prototype AI algorithms and software tools. Enhance and maintain current analysis tools, including automation of current processes using AI/ML algorithms. Conduct quantitative data analysis using a variety of datasets, including developing retrieval, processing, fusion, analysis, and visualization of various datasets Develop techniques that make use of both digital flight data, text-based safety reporting, and a variety of other aviation data sets both in a silo and in a fused environment to identify potential safety vulnerabilities Basic Qualifications: Bachelor’s Degree in Computer Science, Mathematics, Statistics, Physics, Electrical Engineering, Computer Engineering or related fields Hands-on Software Development Skills (Python-Preferred) Experience or educational courses/projects in Machine Learning, and/or Text Mining Algorithms. Ability to work closely with Domain experts to develop tools/algorithms needed to answer research questions in their studies Excellent Communication Skills (with the abilty to explain developed tools and ML algorithms to a non-technical audience) Ability to formulate operational problems in aviation domain as technical problems that allows for reuse of leading research in the area. Proven ability to work independently to learn new technologies, techniques, processes, languages, platforms, systems Strong analytic, inferencing, critical thinking, and creative problem-solving skills Self-starter with ability to work both independently and with a team Preferred Qualifications: 1 to 2 years of relevant experience Experience with Deep Learning Frameworks such as Keras, Tensorflow, PyTorch,Mxnet etc. Ability to apply these frameworks to real problems in the ‘time -series’ domain Experience with interpretability of deep learning models Big Data Skills (Hadoop, Spark, recent deep learning platforms) Visualizations/Web Development Skills (e.g. Tableau, MEAN stack - MongoDB, ExpressJS, AngularJS, NodeJS). Practical experience with statistical analysis Experience with text mining tools and techniques including in areas of summarization , search (e.g. ELK Stack) , entity extraction, training set generation (e.g. Snorkel) and anomaly detection Expert software development skills lifecycle including developing and maintain good production quality code This requisition requires the following clearance(s): Suitability - FAA MITRE is proud to be an equal opportunity employer. MITRE recruits, employs, trains, compensates, and promotes regardless of race, religion, color, national origin, gender, gender expression, sexual identity, disability, age, veteran status, and other protected status.  MITRE intends to maintain a website that is fully accessible to all individuals. If you are unable to search or apply for jobs and would like to request a reasonable accommodation for any part of MITRE’s employment process, please contact MITRE’s Recruiting Help Line at 703-983-8226 or email at recruitinghelp@mitre.org. Copyright © 1997-2021, The MITRE Corporation. All rights reserved. MITRE is a registered trademark of The MITRE Corporation. Material on this site may be copied and distributed with permission only.",data scientist
"JOB SUMMARY  The Credit Services Risk Management team is a large and complex critical function for company success. We are staffed with highly-skilled and motivated individuals with a large emphasis on analytical abilities & problem solving skills. The Sr. Data Analyst will provide critical analysis to enhance credit risk functions such as underwriting and/or collections. This person will be the central point of contact to drive business decisions by leveraging deep analytics.  MAJOR DUTIES AND RESPONSIBILITIES Provide recommendations for new or enhanced strategies to reduce losses and to retain customers Partner with others to build predictive models and/or to implement solutions in production processes Ensures that programming tasks are completed before the deadline and are fully tested with minimal defects Gather business requirements. This individual will need to work with leadership and business partners to identify data and reporting needs for analysis Develop/select methodologies to derive answers to business problems Analyze data to provide meaningful insights. This individual must have strong data manipulation and interpretation skills, and be able to quantitatively assess business problems Identify data sources and data attributes across and outside the company that will support the business needs Conduct analyses that drive meaningful change on key objectives established by senior Charter leadership Synthesize actionable insights by joining together large data sets from across the company, and applying appropriate analytical techniques Communicate findings clearly and concisely through narrative-driven presentations and effective data visualizations to Charter executives and decision makers Develop analytic plans and testable hypotheses for key business questions raised by partners to ensure that all important questions are addressed fully, appropriately, and accurately Perform other duties as may be requested by manager  REQUIRED QUALIFICATIONS Strong expertise in SQL Business and quantitative analysis experience using packages such as SAS/Python/R Ability to communicate orally and in writing in a clear and straightforward manner Ability to plan, prioritize and organize effectively Ability to adapt to change Detail oriented, self-motivated, proactive and results driven Highly energetic; ability to partner across business lines; a go-getter who seeks out information and does not wait for others to reach out  PREFERRED QUALIFICATIONS Experience in scripting languages such as Java/Ruby/Perl. Experience in using large databases; conducting complex analysis languages as noted above Solving business problems through deep analytics Ability to see patterns in the data where others are unable to; Desire to use large databases and complex analysis to solve problems Ability to explain complex analysis results in an easy-to-understand language Advance skills in Excel, PowerPoint and Access Excellent quantitative analysis skills Ability to create conceptual frameworks enabling the analysis of varied business problems  Education B.S. in quantitative sciences, including statistics, computer science, engineering, Business with focus on analytics. M.S. in a similar discipline preferred.  Related Work Experience 5+ years experience solving business problems through analytics (with a Bachelor’s Degree) OR, 2+ years experience solving business problems through analytics (with a Masters Degree) Industry experience in Financial services, insurance or actuarial services or medical research perferred but not required  WORKING CONDITIONS Office Environment",data scientist
"Job search is broken. Help us fix it! JobTarget is a leading company in the online job search and recruiting industry. Our team is comprised of experts in recruitment, ecommerce, and online job search. Our products are used by thousands of corporate recruiters and reach millions of job seekers. As a Data Scientist, you will assist in generating insights by working alongside our data team in conducting analysis of JobTarget's data. In the process, you will develop a deep understanding of our products, site functionality which will further strengthen your analytic skills.  Responsibilities  Own production performance for CPC Bid management system Own product performance of clustering, and recommendation models Own product performance for retargeting Develop data warehouse frameworks that collect and integrate data from disparate systems Design and develop integration patterns to cleanse data Design, develop and maintain relational, dimensional and predictive data models Perform exploratory large-scale data analysis and correlate similar data to identify trends and make predictions Analyze enterprise level data and extract useful insights to support the business in their decision making Design and develop reports and business presentations Evaluate various technologies and make recommendations  Required Skills  Strong mathematics and statistics knowledge Experience with databases like SQL Server, Redshift, Mongo DB, DynamoDB Experience with machine learning and AI preferred Programming experience with languages like R, SQL, Python ETL experience with tools like SSIS, AWS Glue, AWS Data Pipeline Reporting experience with tools like SSRS, Power BI, Tableau, Amazon QuickSight Strong Knowledge of Excel  JobTarget provides a high-energy growth environment, along with a competitive base salary and excellent benefits including PTO, medical, dental and 401(k) with match. Compensation commensurate with experience. JobTarget is an equal opportunity employer.  PI136098440",data scientist
"HENKEL IS FOR THOSE WHO STEP UP. DO YOU? At Henkel, you can make a difference and craft your career. That’s why you own your projects and take full responsibility from an early stage. Our unique brands in markets around the world open up countless opportunities to follow your convictions and explore new paths. If you have an entrepreneurial mindset that allows you to always think out of the box - take the chance and shape the digital future together with us. YOUR ROLE Align with business stakeholders to understand and define project goals Experience in performing analysis with large datasets to extract actionable insights that will help drive outcomes and decisions Understanding of database and analytical technologies in the industry Demonstrated ability to think strategically about business, products and technical challenges in an enterprise environment Communicate data-driven insights and recommendations to key stakeholders YOUR SKILLS Students currently enrolled in Master’s program in a Computer Science, Information Technology, Big Data Analytics or a related discipline, with a GPA of 3.2 Experience in Microsoft Excel and PowerPoint Proficient in Python and or R, SQL Experience with Data Visualization tools - Tableau or PowerBi Experience in Azure cloud solutions preferred Strong oral and written communication skills Ability to work as part of a DevOps Team Henkel is an equal opportunity employer. We evaluate qualified applicants without regard to race, color, religion, sex, national origin, disability, veteran status, age, sexual orientation, gender identity and expression, and other legally protected characteristics. Henkel does not accept unsolicited resumes from search firms or employment agencies. Unsolicited referrals and resumes are considered Henkel property and therefore, Henkel will not pay a fee for any placement resulting from the receipt of an unsolicited referral. At Henkel’s request only, preferred vendors may be invited to refer talent for specific open positions. In these cases, a fully-executed agreement with Henkel must be in place and current. All employees applying for an internal position must have a discussion with his/her manager about their interest in a job posting opportunity. The discussion will not preclude the employee from interviewing if their skills meet the job requirements.",data scientist
"The Data Scientist is responsible for collecting, cleaning, translating data to meet the company's needs. Every business collects data, whether it's sales figures, market research, logistics, or transportation costs. The Data Scientist will use that data and machine learning to help drive HPOne's business plans. What you'll do: Research and develop statistical learning models for data analysis Develop insights and deliver recommendations based on data analyses Work with business leaders to articulate business requirements for data analyses Implement new statistical or other mathematical methodologies for specific models or analyses Optimize joint development efforts through database use and project design Create automated reports and dashboard products, in order to display results to internal teams Develop end-customer segmentation schemes by analyzing customer behavior Perform ad hoc analyses and deliver recommendations Develop and implement predictive models like decision tree, regression using R or similar Communicate results and ideas to key decision makers Required Skills/Abilities: Master's Degree in Computer Science, Statistics, Applied Math or related field Five years' experience with SAS (or similar), ETL, data processing, database programming and data analytics Experience in data mining and statistical analysis Able to understand various data structures and common methods in data transformation Excellent pattern recognition and predictive modeling skills Experience with programming languages such as Java / Python (or ""R"") Experience conducting regression analyses Understanding of relational databases and data management as well as experience with data aggregation and normalization Advanced excel expertise (pivot tables, VLOOKUP, report filters, etc.) Ability to approach tasks strategically, while owning and mastering the details Exceptional problem solving, as well as analytical and strategic thinking skills Initiative to own projects from start to finish Strong oral and written communication skills, with ability to work well with people across the company at all levels  Preferred Skills/Abilities: Coursework in at least one of the following: mathematics, business, analytical marketing, information systems, programming/databases, statistics/statistical modeling, finance, economics, or physics Experience conducting analyses and building predictive models using SAS (or similar) Experience with business intelligence and data visualization tools preferred (like Domo or Tableau) Physical Requirements: Prolonged periods of sitting at a desk and working on a computer, typically in an office or cubicle environment (constant noise, fluorescent overhead lighting)  Due to the unprecedented situation of COVID-19, HPOne has decided to protect our current and future employees by managing our business remotely. This is inclusive of interviewing, training, and day-to-day operations. We will be returning to an office setting once we are safe to do so following the guidance of local health authorities' and the CDC. Currently all employees are working remotely. Our centers are consistent with CDC guidelines and align with local government orders pertaining to all Company physical locations in relation to COVID-19. Equal Employment Opportunity (EEO) is a fundamental principle at HPOne, where employment is based upon personal capabilities and qualifications. HPOne does not discriminate because of actual or perceived sex, sexual orientation or preference, gender identity, gender, transgender, race, color, religion, national origin, creed, citizenship status, ancestry, age, marital status, pregnancy, childbirth or related medical conditions, medical conditions including genetic characteristics, mental or physical disability, military and veteran status, or any other protected characteristic as established by law. HPOne requires the necessary drug testing and background checks as part of our pre-employment practices. If you need assistance or an accommodation due to a disability, please contact us to request accommodation at accommodations@hpone.com  #ZR",data scientist
"Job Description  Important Note: During the application process, ensure your contact information (email and phone number) is up to date and upload your current resume when submitting your application for consideration. To participate in some selection activities you will need to respond to an invitation. The invitation can be sent by both email and text message. In order to receive text message invitations, your profile must include a mobile phone number designated as “Personal Cell” or “Cellular” in the contact information of your application. At Wells Fargo, we are looking for talented people who will put our customers at the center of everything we do. We are seeking candidates who embrace diversity, equity and inclusion in a workplace where everyone feels valued and inspired. Help us build a better Wells Fargo. It all begins with outstanding talent. It all begins with you. Technology sets IT strategy; enhances the design, development, and operations of our systems; optimizes the Wells Fargo infrastructure; provides information security; and enables Wells Fargo global customers to have 24 hours a day, 7 days a week banking access through in-branch, online, ATMs, and other channels. Our mission is to deliver stable, secure, scalable, and innovative services at speeds that delight and satisfy our customers and unleash the skills potential of our employees. The Info Sec Principal Engineer - Sr Data Scientist will be responsible for managing Identity and Access management data, repositories and controls along with infrastructure, data hygiene, and analytical tool development and implementation. This role is responsible for working with other engineering team members within Identity and Access Management Build Engineering, to develop and implement innovative solutions and analytical tools for the IAM Portfolio. Provide the highest technical expertise for the planning, analysis, design, implementation, maintenance, and control of the organization's server-class databases, engaging with DBA teams, architecture, Scrum Master, QA, BSA, Product and supporting teams to create efficient and consistent solutions. Assure successful sprint and release planning following agile development methodology. Lead the most complex or critical data/ database management initiatives that typically involve multiple disciplines and multiple business groups, including database architecture, other Core Engineering teams, design, integration, and/or data modeling. Provide highest level of expertise in complex databases troubleshooting and problem resolution and drive continuous process improvement as preventive actions. Recommend improvements to web application processing issues and design. As the recognized technical expert, consult extensively with multiple client groups to provide strategic solutions, influencing long-range internal and enterprise-level data/ database architecture and management strategies. Design and certify next generation database technologies and provide technical leadership and recommendation into the future direction of database technology. Able to handle multiple/conflicting projects and deadlines; able to work on call and provide 24/7 production support. Demonstrate proficient communication skills with management, application teams, vendors, and systems administrators. Interact with customers (internal / external) to meet process deliverables. Has competency in business language skills. Document and present to the technical and non-technical audience database related information. Consult or develop EDM best practices & SOP and promote these standards across the team. Mentor/Train DBA operations team in the installation, configuration, and maintenance of databases and/or database related products, lead educational sessions on continuing basis within our EDM community. Areas of responsibility will include, but not limited to, data source identification, data modeling and assessment, analytical model (machine learning) development and management, code development and testing for tools. 7+ years of database (DB) technologies experience 3+ years of Logical + Physical Data Modeling experience 7+ years of experience in supporting software development life cycle for large-scale distributed technology projects and migrations Telecommute is an option for this position.  Required Qualifications  10+ years of engineering experience; or 10+ years of experience in a technical management role 3+ years of design, implementation and governance experience with Artificial Intelligence, Natural Language Processing or Machine Learning architecture 4+ years of experience with databases such as Oracle, DB2, SQL server, or Teradata 5+ years of experience delivering ETL, data warehouse and data analytics capabilities on big-data architecture such as Hadoop  Desired Qualifications  A Masters degree or higher in computer science or finance Strong verbal, written, and interpersonal communication skills 3+ years of experience with end-to-end design and delivery of data warehouse applications Knowledge and understanding of IAM (Identity and Access Management) Data modeling experience Information security experience  Other Desired Qualifications 3+ years experience with Data science, Machine learning, optimization models, exploratory data analysis (EDA) 3+ years experience with Agile development or DevOps methodologies. Ability to assess issues, make quick decisions, implement solutions, and influence change Strong customer relationship management skills 3+ years in data science related field  Salary Information  To be determined  Street Address  NC-Charlotte: 300 S Brevard St - Charlotte, NC MN-Saint Louis Park: 300 Highway 169 S - Saint Louis Park, MN TX-Irving: 2975 Regent Blvd - Irving, TX AZ-Chandler: 2600 S Price Rd - Chandler, AZ IA-Des Moines: 800 Walnut St - Des Moines, IA IA-West Des Moines: 7001 Westown Pkwy - West Des Moines, IA MN-Minneapolis: 550 South 4th St - Minneapolis, MN NY-New York: 150 E 42nd St - New York, NY PA-Philadelphia: 101 N Independence Mall E - Philadelphia, PA NC-Raleigh: 1100 Corporate Center Dr - Raleigh, NC MO-Saint Louis: 1 N Jefferson Ave - Saint Louis, MO MA-Boston: 125 High Street - Boston, MA IL-Chicago: 10 S Wacker Drive - Chicago, IL CA-SF-Financial District: 333 Market St - San Francisco, CA",data scientist
