JobDesc,JobTitle
"Abbott is a global healthcare leader that helps people live more fully at all stages of life. Our portfolio of life-changing technologies spans the spectrum of healthcare, with leading businesses and products in diagnostics, medical devices, nutritionals, and branded generic medicines. Our 109,000 colleagues serve people in more than 160 countries. About Abbott Our nutrition business develops science-based nutrition products for people of all ages, from helping babies and children grow, to keeping adult bodies strong and active. Millions of people around the world count on our leading brands – including Similac®, PediaSure®, Pedialyte®, Ensure®, Glucerna® and ZonePerfect® – to help get the nutrients they need to live their healthiest life. Our location in Columbus, OH, currently has an opportunity for a Senior Manager, Data Scientist. WHAT YOU’LL DO Leads strategic planning for longer term or large data science/analytics programs that may have an organization-wide impact. Develops and implements effective knowledge sharing processes, ensuring that team members maintain a high level of technical expertise. Oversee and manage data quality assessment, data cleaning and data processing practices Coaches and mentors analysts in data preparation approaches Drives leadership conversations around analytic resources and tools necessary to deliver on the needs of the business with the urgency required in the long run Ensures that the organization maintains optimal up-to-date toolset Designs organizational strategy in data science ensuring that the organization maintains an optimal, up-to-date big data toolset Uses in-depth knowledge of organizational data capability to provide leadership and direction across strategic and highly technical projects ensuring maximal leverage of internal data assets and external data. Has a high level of awareness of wide range of the best-practice big data storage and distribution systems and relevant software tools, their constraints, advantages and disadvantages. Designs process improvements to data management processes using multiple data management tools Proactively identifies and implements solutions and process improvements through an understanding and continuous learning of data management principles, data management tools, and data sources EDUCATION AND EXPERIENCE YOU’LL BRING Required BS in Business Analytics, Data Science, Computer Science, Math, Statistics, or related field 10+ years' experience in data mining, modeling, forecasting, or other analytics Experience in coordination and management of data science/analytics programs, including applying and improving established approaches and techniques as well as introducing innovative methods. Experience in applying data exploration and data science knowledge to new domains and leading the research and implementation of innovative approaches Experience with tools such as PowerBI or Tableau as well as SAS, R and/or Python Excellent communication skills, both oral and written, and the ability to communicate technical analysis and findings clearly to senior leaders and non-technical audiences Exceptional organization and time management skills, including the ability to adapt to changing priorities Preferred MS degree in Business Analytics, Data Science, Computer Science, Math, Statistics, or related field Experience in time series and regression modeling and forecasting Experience in Healthcare analytics WHAT WE OFFER At Abbott, you can have a good job that can grow into a great career. We offer: A fast-paced work environment where your safety is our priority (Include for Manufacturing roles only) Production areas that are clean, well-lit and temperature-controlled (Include for Manufacturing roles only) Training and career development, with onboarding programs for new employees and tuition assistance Financial security through competitive compensation, incentives and retirement plans Health care and well-being programs including medical, dental, vision, wellness and occupational health programs Paid time off 401(k) retirement savings with a generous company match The stability of a company with a record of strong financial performance and history of being actively involved in local communities Learn more about our benefits that add real value to your life to help you live fully: www.abbottbenefits.com Follow your career aspirations to Abbott for diverse opportunities with a company that provides the growth and strength to build your future. Abbott is an Equal Opportunity Employer, committed to employee diversity. Connect with us at www.abbott.com, on Facebook at www.facebook.com/Abbott and on Twitter @AbbottNews and @AbbottGlobal.",data scientist
"We are in need of a highly skilled computer scientist to perform research and development in the area of High Performance Computing and/or Big Data systems. The candidate should desire to work on research and development of advanced HPC software including the optimization of large scale numerical simulations, machine learning, and graph analytics codes for emerging high performance compute architectures and future exascale systems (including multi-core, many-core, and GPU based platforms) and/or the development of tools to improve the usability of these codes and systems.  An immediate position is available for a computer science graduate (M.S. degree required, but Ph.D. preferred) to work on existing projects. The candidate is expected to have strong analytical, problem solving, multi-tasking and teamwork skills, and be able to develop ideas for future research projects in the HPC and Big Data fields. The desired candidate needs excellent written and oral communication skills in order to periodically collaborate in writing research proposals to government agencies, national laboratories and commercial partners. Knowledge, good understanding and experience with HPC or Big Data systems and their performance and scalability requirements is required. Particularly, strong understanding of one or more of the following aspects in distributed systems is required: Architectural features, such as large-scale multi/many-core, GPU and NUMA/cluster systems, distributed file/storage systems Interconnection technologies and standards, such as Ethernet and InfiniBand Software libraries and standards, such as messaging libraries, and distributed computing systems Operating systems, particularly kernel, device drivers, virtualization technologies, etc. As such, the candidate should have strong experience with programming languages, tools and libraries in HPC or Big Data systems, including one or more of the following: CUDA/OpenCL C (including embedded and cross-platform programming), C++, Fortran, and/or Java Distributed computing tools Parallel and network-based programming libraries such as socket programming, MPI, OpenMP,POSIX threads Linux shell scripting and Linux kernel programming It is also beneficial if the candidate demonstrates experience with one or more of the following: Hadoop tools, commercial storage systems, databases and filesystems, RDMA / InfiniBand. Please send copies of your curriculum vitae to careers@RNET-Tech.com.",data scientist
"Citizenship: Must be a US Citizen  Clearance Required: None to Start  Job Summary This position will provide technology, operations, and strategy support to partners in Weapon System Sustainment (WSS), a Logistics Research and Development (R&D) program under the DLA R&D Program. WSS’s strategic focus is to support business process re-engineering and systems through applied research and development of emergent and disruptive technologies, such as artificial intelligence and machine learning (AI/ML), to improve DLA’s logistics services to the military Services as well as several civilian agencies and foreign countries. WSS executes R&D projects to support DLA headquarters business units (J3, J4, J6, and J7), Major Subordinate Commands (MSCs: DLA Land and Maritime; DLA Aviation; DLA Troop Support), and the Defense Logistics Information Service (DLIS). Roles and Responsibilities This position will support the WSS Program Manager and leadership, applying knowledge in data science and analytics to a problem set that includes typical characteristics of a logistics supply chain, from a perspective of how advanced computational techniques such as AI/ML can be used to address problems and in general improve supply chain preparedness and planning. The candidate will: Apply data science and business process knowledge to assess supply chain plans and metrics, including factors such as volume, lead time, sources, risk factors, consumption schedule, transportation timing, etc. Demonstrate a solid understanding of advanced computational capabilities, specifically such as statistical / machine learning modeling processes and algorithms, and be able to assess algorithm/program capability, accuracy, and inherent risk Effectively communicate assessments, plans, and strategies to high levels of customer management on both qualitative and quantitative basis Translate business requirements and results between AI/ML researchers and business stakeholders. Support development of charters and work statements to ensure the R&D projects will address the business concern. Evaluate recommended technical solutions for artificial intelligence / machine learning (AI/ML) R&D projects. Interface with J61, J62 and J6T on technical details of IT infrastructures as it pertains to AI/ML. Additional projects and roles utilizing the candidate’s skill set may be added depending on work load balance and time availability. Additional projects/tasks may be generated by the candidate and their areas of interest, or may be developed in conjunction with corporate, team, or customer leaders. Education, Experience and Skills Must possess a bachelor or advanced degree in the following fields: engineering, operations research, mathematics, or a degree in business, business administration, science or finance. Preferred, some combination of the following: Five (5) years of experience working with artificial intelligence / machine learning algorithms in a commercial or government setting Manufacturing, supply chain, and/or logistics Support of government or DoD programs/operations Work or development of strategic plans/roadmaps Be familiar with scientific method and design of experiments Have a working knowledge of frameworks and languages (R, Python, SAS, Tensorflow, etc.); and have knowledge of IT infrastructure as it pertains to artificial intelligence / machine learning (SAP, Hadoop, Azure/AWS, etc.). Physical Requirements / Travel Normal office/computer-based work environment. This position may work at a corporate office (Dayton, OH) or be full time remote from the candidate's location. If the later, the candidate is responsible for providing a suitable working space, conducive to professional appearance during video teleconferences, and associated utilities (a computer will be provided by the company). Remote work must be done during normal business hours. Azimuth Overview Azimuth is an award-winning Woman Owned Small Business specializing in providing research and development and professional services support to the federal government. Azimuth's agility, customer driven approach and our commitment to our employees allows us to meet and exceed our client goals. Excellence, Integrity, Accountability, Community and Humility are the core values of Azimuth as we continue to strive as a recognized leader in the management consulting community that both federal agencies and industry partners value doing business with. We are an organization that offers both our employees and clients an exceptional experience; our culture will be contagious, while always maintaining a genuine reputation.  Disclaimer The above information on this description has been designed to indicate the general nature and level of work performed by employees within this classification. It is not designed to contain or be interpreted as a comprehensive inventory of all duties, responsibilities, and qualifications required of employees assigned to this job.  Azimuth Corporation does not discriminate in employment on the basis of race, color, religion, sex (including pregnancy and gender identity), national origin, political affiliation, sexual orientation, marital status, disability, genetic information, age, membership in an employee organization, retaliation, parental status, military service, or other non-merit factor.",data scientist
"JOB TITLE: Director, Medical Machine Learning (ML) & Artificial Intelligence (AI) Headquartered in Dublin, Ohio, Cardinal Health, Inc. (NYSE: CAH) is a global, integrated healthcare services and products company connecting patients, providers, payers, pharmacists and manufacturers for integrated care coordination and better patient management. Backed by nearly 100 years of experience, with more than 50,000 employees in nearly 60 countries, Cardinal Health ranks among the top 20 on the Fortune 500. Department Overview Augmented Intelligence (augIntel) builds automation, analytics and artificial intelligence solutions that drive success for Cardinal Health by creating material savings, efficiencies and revenue growth opportunities. The team drives business innovation by leveraging emerging technologies and turning them into differentiating business capabilities. Job Overview The Medical Machine Learning (ML) and Artificial Intelligence (AI) Director will be responsible for building and leading a team focused on Data Engineering, Analytics, and Machine learning solutions. The Director applies Design Thinking, Data Science, Data Ops practices to guide the team in building large-scale enterprise data & analytics platforms supporting Analytics and Machine Learning solutions leveraging Google Cloud technologies. The Director brings in a product mindset and leverages AGILE practices to craft and drive iterations to support building new capabilities, addressing gaps and drive automations for Data & Analytics Platforms and solutions. Additionally, the Director brings in a strong business subject matter expertise in areas of Commercial, Supply Chain or Revenue Management. The Director will have to work across both business and technology leadership to influence, change and build support for ML & AI driven decision making and insight generation. Accountabilities Define Machine Learning (ML) & Artificial Intelligence (AI) strategy, roadmap and strategic execution steps Identify high-value ML & AI business opportunities. Work with Business and IT stakeholders to realize business benefit Use deep subject matter / functional expertise (eg. Commercial, Supply Chain, Revenue Mgmt) and influence to help internal/external customers and stakeholders identify and meet their high priority needs while considering cultural and diversity implications Define processes for data integration, data preparation and solution delivery for ML & AI solutions Define data models, algorithm model, explainable AI practices Implement & manage the proposed solutions Drive data literacy and culture to enable more data experimentation, hypothesis validation to enable ML & AI driven business insights Drive efficiency by continuous automation and other LEAN processes Manage team of 5-10 FTE’s plus 15-20 MSA and External FTE’s Qualifications Bachelors and Advanced Degree in Software Engineering, Data & Analytics, Data Science 12+ years’ experience in related field of Data Science, Data & Analytics Prior supervisory experience preferred Demonstrated ability to set data & analytics direction and oversee successful delivery and/or support of ML & AI solutions preferred What is expected of you and others at this level Provides leadership to managers and experienced professional staff may also manage front line supervisors Manages an organizational budget Develops and implements policies and procedures to achieve organizational goals Assists in the development of functional strategy Decisions have an extended impact on work processes, outcomes, and customers Interacts with internal and/or external leaders, including senior management Persuades others into agreement in sensitive situations while maintaining positive relationships Cardinal Health is an Equal Opportunity/Affirmative Action employer. All qualified applicants will receive consideration for employment without regard to race, religion, color, national origin, ancestry, age, physical or mental disability, sex, sexual orientation, gender identity/expression, pregnancy, veteran status, marital status, creed, status with regard to public assistance, genetic status or any other status protected by federal, state or local law.",data scientist
"Screen reader users may encounter difficulty with this site. For assistance with applying, please contact hr-accessibleapplication@osu.edu . If you have questions while submitting an application, please review these frequently asked questions . Current Employees and Students: If you are currently employed or enrolled as a student at The Ohio State University, please l og in to Workday to use the internal application process. Welcome to The Ohio State University's career site. We invite you to apply to positions of interest. In order to ensure your application is complete, you must complete the following: Ensure you have all necessary documents available when starting the application process. You can review the additional job description section on postings for documents that may be required. Prior to submitting your application, please review and update (if necessary) the information in your candidate profile as it will transfer to your application. Job Title: Postdoctoral Fellow on Race and Responsible Data Science Department: Research | Translational Data Analytics Application Deadline June 15, 2021 We invite applications for a postdoctoral fellow based at the Translational Data Analytics Institute (TDAI). The postdoctoral fellow is expected to have expertise on how data analytics exacerbate racial discrimination and inequity, erode individual agency and democratic power, and influences economics and public policy. The fellow will contribute to the program on Responsible and Just Data Science at TDAI.  The postdoctoral fellowship position offers an exciting opportunity to participate in scholarly discussion and exchange that brings together the data science, and racial and ethnic justice scholarly communities at OSU. The recruiting team is committed to studying data analytics’ dependence on and impact of racial and gender inequalities in society; to engaging with ongoing discussions of data analytics in terms of responsibility, public interest, and ethics; and to investigating the manipulation of data based on prevailing world views and public policies. The community of practice includes scholars from Political Science, Anthropology, Philosophy, Linguistics, Geography, Law, Computer Science, and Integrated Systems Engineering, and we welcome applications from scholars from all of these disciplines and others in the humanities, social sciences, and engineering sciences whose scholarship is focused on understanding the operation of data analytics in relation to racial and gender inequality and other forms of social and political inequality.  The postdoctoral fellow will be mentored and supported in future career goals and will have access to an interdisciplinary mentoring team with expertise on the social, political, ethical and technical dimensions of data science, as well as to a group of stakeholders working towards justice in data sciences. This community is committed to innovate to make the informal connections and research conversations that are part of the process of mentoring work continue smoothly in the new paradigm of virtual programming and communication. Additionally, the postdoc will be integrated in the 2021-2022 cohort of Presidential Postdoctoral Fellows, where they will find a community of peers and other resources available to the members of this program. Required: We seek applicants with a Ph.D. in the social sciences, humanities, or engineering sciences who have substantive training or expertise in understanding political, societal, and ethical dimensions of data science, and who are enthusiastic to work with an interdisciplinary group to develop curriculum in this area. Their primary focus must be based on race/ethnicity. They need not have a computer science background themselves, though of course an understanding of the area as it pertains to their own research is welcome. Desired: Ideal candidates would have teaching experience, experience with interdisciplinary research or teaching, and enthusiasm about developing social, political, and ethical pedagogy for data science students. For additional information, please contact Dr. Ines Valdez ( valdezi@polisci.osu.edu ) and Dr. Mark Moritz ( Moritz.42@osu.edu ). Additional Information: The Target Hiring Range for this position is $55,000 to $60,000. We welcome applications from members of groups historically underrepresented in data science including Black, Latinx, Indigenous, women, and others who would bring additional diversity to the university’s research and teaching missions. Applicants ideally will have completed all requirements for their Ph.D. at the time of application. The term of the fellowship is for one year, and is renewable for a second year pending budgetary approval. About Columbus: The Ohio State University campus is located in Columbus, the capital city of Ohio. Columbus is the largest and fastest-growing city in Ohio, with a vibrant blend of arts and culture; inspired culinary, fashion, music and entertainment scenes; exciting collegiate and professional sports; and an open, entrepreneurial spirit. Additional information about all that the Columbus area has to offer is available at https://visit.osu.edu/experience. A complete application includes a cover letter, a curriculum vitae, a writing sample, and the names and contact information of three reference writers. The letter should describe the scholarly work that the candidate wishes to pursue and the contributions they expect to make to the research and curricular programming on the social, political, and ethical dimensions of data science. The letter should also include a reflection on the candidate’s past efforts, as well as future plans, to advance equity, diversity, and inclusion in their scholarship, teaching, and service. Review of applications will begin immediately and will continue until the position is filled. The Ohio State University is committed to establishing a culturally and intellectually vibrant and diverse environment of exceptional faculty, encouraging all members of our learning community to reach their full potential. We are responsive to dual-career families and strongly promote work-life balance to support our community members through a suite of institutionalized policies. The university is a member of the Ohio/Western Pennsylvania/West Virginia Higher Education Recruitment Consortium (HERC). The Ohio State University is an equal opportunity employer. All qualified applicants will receive consideration for employment without regard to race, color, religion, sex, sexual orientation or identity, national origin, disability status, or protected veteran status. Application Materials Required: Submit the following items: cover letter, curriculum vitae, writing sample, and the names and contact information of three reference writers to the OSU Careers website. Location: Pomerene Hall (0067) Position Type: Term (Fixed Term) Scheduled Hours: 40 Shift: First Shift Salary Grade: Negotiable Grade Profile Annual Final candidates are subject to successful completion of a background check. A drug screen or physical may be required during the post offer process. The Ohio State University Office of Human Resources | 1590 N. High St., Suite 300 | Columbus, OH 43201-2190 | For questions, please call 614-247-6947 or email HRConnection@osu.edu The Ohio State University is an equal opportunity employer. All qualified applicants will receive consideration for employment without regard to age, ancestry, color, disability, ethnicity, gender identity or expression, genetic information, HIV/AIDS status, military status, national origin, race, religion, sex, gender, sexual orientation, pregnancy, protected veteran status, or any other bases under the law. Applicants are encouraged to complete and submit the Equal Employment Identification form.",data scientist
