JobDesc,JobTitle
"Overview: National Interstate is a member of Great American Insurance Group. As one of the leading commercial transportation insurers in the nation, we offer risk financing solutions in all 50 states tailored to meet the needs of a wide variety of transportation classes. Our offerings include traditional insurance and innovative alternative risk transfer (ART) programs, including more than a dozen group captive programs catering to niche wheels markets. We are proud to be a multiple Northcoast 99 winner and Cleveland Plain Dealer Top Workplace in Northeast Ohio. It is because of our talented and dedicated team that we are able to live out our company values of integrity, transparency, fairness, accountability, empowerment and collaboration with each transaction we make. If you are ready to join an engaging and driven team such as ours, we would love to hear from you! Responsibilities: Open to Remote Constructs accurate predictive models to be used in the company’s insurance operation Determines requirements, plans projects, establishes priorities, and monitors progress Provides key expertise in statistical theory and software application (R, Python, etc.) Facilitates involvement of business areas, incorporates insurance knowledge into model development Communicates model result to executive-level audience Drives data quality initiatives for future analytics projects Maintains awareness / currency of emerging data sources and data science tools that may be useful to the company. Manages a team of analytical staff Has responsibility for performance, development and coaching of staff Evaluates project status and resource utilization and implements changes to improve the team's effectiveness. Performs other duties as assigned.  Qualifications: Education: Bachelor’s Degree or equivalent experience. Field of Study: Predictive Analytics, Information Technology, Statistics or a related discipline Experience: 3 to 5 years of hands-on modeling experience; supervisory experience preferred; exhibits leadership qualities.",data scientist
"You have a life. We like that about you. At OCLC, we believe you'll do the best work of your life when you're living the best life possible. We work hard to build the technology that connects thousands of today's libraries. But we also work hard to make a job at OCLC a meaningful part of a balanced life- not a substitute for one. The Job Details are as follows: Discover. Innovate. Collaborate. Inform. A few words we use to describe a career at OCLC. Technology with a Purpose. OCLC supports thousands of libraries in making information more accessible and more useful to people around the world. OCLC provides shared technology services, original research and community programs that help libraries meet the ever-evolving needs of their users, institutions and communities. With office locations around the globe, OCLC employees are dedicated to offering premier services and software to help libraries cut costs while keeping pace with the demands of our information-driven society. The OCLC Data Services organization is looking for a Data Scientist . This team and role will be the center of excellence for machine learning and model development throughout the organization. The right candidate should comfortable and even enthusiastic about working in a greenfield environment. We haven’t figured everything out yet, that’s why we need you! What you will do: Mine and analyze data from our multi-petabyte ecosystem of data to drive optimization and improvement of product development, marketing techniques and business strategies Assess the effectiveness and accuracy of new data sources and data gathering techniques. Develop custom data models and algorithms to apply to data sets Use predictive modeling to increase and optimize customer experiences, revenue generation, ad targeting and other business outcomes Coordinate with different functional teams to implement models and monitor outcomes Develop processes and tools to monitor and analyze model performance and data accuracy Qualifications Master’s degree in Statistics, Mathematics, Computer Science or similar field or equivalent combination of education and experience 3+ years demonstrated experience in big data, statistics, model development working with statistical packages and machine learning tools (R, Pandas, PyTorch, Tensorflow, etc.) Software development experience in Python, Java, Scala, Golang, or similar Strong problem-solving skills with an emphasis on product development Knowledge of a variety of machine learning techniques (clustering, decision tree learning, artificial neural networks, etc.) and their real-world advantages/drawbacks Knowledge of advanced statistical techniques and concepts (regression, properties of distributions, statistical tests and proper usage, etc.) and experience applying those techniques to build new product features Excellent written and verbal communication skills for coordinating across teams",data scientist
"Title: Data Scientist Location: Mayfield Heights, OH Department: Engineering Trimble Transportation, a leader in transportation technology, is expanding its data insights organization. This role requires an individual with a strong data analytics, machine learning, and programming foundation to join an exciting, high-growth environment. The Machine Learning Engineer will have the opportunity to solve complex issues in the transportation industry by applying cutting edge technology and the latest algorithms. This will require working with stakeholders to translate business problems into predictive models and optimization programs, and implementing these with professional software engineering skills. We highly value creative individuals who are strong problem solvers, continual learners, and passionate about data and analytics. If you love solving complex problems using data this will be the job for you. Position Overview: 25% Define: Work in a team and and with stakeholders to solve business problems using a data-driven approach Work with stakeholders to understand and analyze highly complex business requirements Translate business requirements into innovative, data-driven solutions that leverage Machine Learning Apply best practices to document and communicate proposed solutions Define data requirements to build complex predictive models 60% Develop: Build production-grade Machine Learning pipelines Work in a team environment to plan, coordinate, and execute project tasks Perform data analysis, visualization, data mining, and feature engineering Implement software to efficiently clean and transform large data sets Apply expertise in Machine Learning and Statistical Methods to develop predictive models and optimization programs Apply industry best practices to evaluate Machine Learning models Develop scalable, efficient, and automated Machine Learning pipelines that are ready for production 15% Deploy and Monitor: Successfully deploy models to production and ensure they maintain accuracy over time Collaborate across teams to deploy Machine Learning pipelines to production Develop tools and methods to monitor for and correct model drift Respond to production events as necessary Minimum Qualifications: Bachelor's degree in Engineering, Computer Science, Mathematics, Statistics or related field OR an equivalent combination of education, experience, knowledge, skills, and abilities Experience performing data analysis, data engineering, and Machine Learning model design and development. Experience using the Python language and the Python based machine learning stack (e.g. numpy, scikit-learn, Pandas, Jupyter). Experience with data science methodologies (particularly CRISP-DM) Fluent in Unsupervised and Supervised Machine Learning techniques including Regression, Decision Trees, Clustering, Neural Networks, and Anomaly Detection. Experience using model validation techniques and metrics (accuracy, precision, recall, etc.) Fluent in SQL Experience with SQL and NoSQL data stores (e.g. r, PostgreSQL, MongoDB,, Azure Data Explorer,) Experience with git Ability to take on a high level of responsibility, initiative, and accountability Ability to work effectively in a highly collaborative team environment Ability to manage time and workload effectively which includes planning, organizing, and prioritizing with attention to details. Excellent verbal, written, and interpersonal communication skills Continual learner with a desire and ability to learn new skills and technologies Preferred Skills: Masters degree or higher in a quantitative field (Statistics, Artificial Intelligence, etc.). Prior experience in Operations Research Prior experience in transportation, logistics, or fleet management. Experience building and deploying containerized Docker images Experience with Kubernetes Experience with pub/sub messaging systems or queues (e.g. RabbitMQ, AWS SQS) Experience using Agile development methodologies (particularly Scrum) Our Company Trimble is transforming the way the world works by delivering products and services that connect the physical and digital worlds. Core technologies in positioning, modeling, connectivity and data analytics enable customers to improve productivity, quality, safety, and sustainability. From purpose-built products to enterprise lifecycle solutions, Trimble software, hardware, and services are transforming a broad range of industries such as agriculture, construction, geospatial and transportation, and logistics. For more information about Trimble (NASDAQ: TRMB), visit www.trimble.com Trimble Inc. is proud to be an Equal Opportunity and Affirmative Action Employer and considers qualified applicants for employment without regard to race, gender, age, color, religion, national origin, marital status, disability, sexual orientation, status as a covered veteran in accordance with applicable federal, state and local laws, or any other protected factor. EOE/M/F/V/D Trimble Inc. is proud to be an Equal Opportunity and Affirmative Action Employer and considers qualified applicants for employment without regard to race, gender, age, color, religion, national origin, marital status, disability, sexual orientation, status as a covered veteran in accordance with applicable federal, state and local laws, or any other protected factor. EOE/M/F/V/D",data scientist
"Overview: National Interstate is a member of Great American Insurance Group. As one of the leading commercial transportation insurers in the nation, we offer risk financing solutions in all 50 states tailored to meet the needs of a wide variety of transportation classes. Our offerings include traditional insurance and innovative alternative risk transfer (ART) programs, including more than a dozen group captive programs catering to niche wheels markets. We are proud to be a multiple Northcoast 99 winner and Cleveland Plain Dealer Top Workplace in Northeast Ohio. It is because of our talented and dedicated team that we are able to live out our company values of integrity, transparency, fairness, accountability, empowerment and collaboration with each transaction we make. If you are ready to join an engaging and driven team such as ours, we would love to hear from you! Responsibilities: Open to Remote Constructs accurate predictive models to be used in the company’s insurance operation Determines requirements, plans projects, establishes priorities, and monitors progress Provides key expertise in statistical theory and software application (R, Python, etc.) Facilitates involvement of business areas, incorporates insurance knowledge into model development Communicates model result to executive-level audience Drives data quality initiatives for future analytics projects Maintains awareness / currency of emerging data sources and data science tools that may be useful to the company. Manages a team of analytical staff Has responsibility for performance, development and coaching of staff Evaluates project status and resource utilization and implements changes to improve the team's effectiveness. Performs other duties as assigned.  Qualifications: Education: Bachelor’s Degree or equivalent experience. Field of Study: Predictive Analytics, Information Technology, Statistics or a related discipline Experience: 3 to 5 years of hands-on modeling experience; supervisory experience preferred; exhibits leadership qualities.",data scientist
")TITLE Senior Data Scientist, FP&A LOCATION Orrville, OH (Close proximity to Cleveland/Akron) REPORTS TO Vice President FP&A & U.S. Business Finance POSITION SUMMARY The Senior Data Scientist, FP&A role is primarily responsible for developing new analytical capabilities across FP&A (and across finance), including the design of visual, predictive, and prescriptive analysis to drive business results. This role will contribute to the identification and communication of key insights utilized by leadership and the broader finance team(s) to execute our financial strategy. The development of new financial processes, models, and visualizations will be a key component of the role. Contributions from this role directly link to the Corporate Financial Strength strategic initiative and the Finance Transformation initiative. In addition, the person in this role will be expected to connect with the Finance Technology team and broader Corporate data science initiatives in order to maintain community and develop best practices in Finance. KEY RESPONSIBILITIES Apply data science techniques on disparate financial data sources to simplify processes and generate insights to execute the Company’s financial strategy and initiatives Develop financial models and predictive analytics, specifically contributing to the Company’s ability to deploy its annual plan, monthly forecast, and strategic long-range plan Work cross functionally and engage across FP&A (Corporate, SBA, and Customer Finance teams) to elevate level of data driven insigh ts an d decision-making capabilities and present findings and assumptions to key stakeholders Develop new capabilities including dashboards and flash reporting to support issue resolution, insight generation and decision making Enhance financial analytical capabilities and insights effectiveness around product innovation, product margins, cost management and customer financials Identify opportunities to leverage machine learning, text mining, driver-based planning Collaborate with finance colleagues and business partners to ideate, identify, prioritize and deliver business opportunities Identify new data sources , inclusive of external sources, to enhance results and unveil opportunities Increase the capability across the finance organization by researching and sharing new analytic techniques and tools Share analytics tools and techniques with the broader organization analytics team and business partners to enhance the organizational finance and analytics acumen Partner with finance colleagues to present findings, assumption and recommendations to key stakeholders SELECTION CRITERIA Education Bachelor's or Master’s degree in Data Analytics, Statistics, Applied Math, Computer Science, or related field Certification in Finance a plus Experience 4+ years in a Data Scientist / Statistician / Quantitative Analyst type role is required Experience/deep knowledge and use of a number of these tools: Statistical modeling/forecasting (including experience explaining statistical models and coaching on techniques) Python or R SQL PowerBI, Spotfire, or Tableau Knowledge of multiple business functional areas and financial processes Proven ability to work independently and as part of a cross-functional team required Leadership interactions Ability to influence and implement change Prior experience in financial analysis and modeling preferred Prior experience working with financial data, systems, or statements preferred Other Passionately curious Ability to “connect-the-dots” applying concepts/ideas/learnings from one project/functional group to another and/or combining ideas from several areas into a larger idea/project Demonstrated ability of balancing and prioritizing numerous requests while providing visibility to stakeholders IND123 #LI-123",data scientist
"Position Type : Full time Type Of Hire : Experienced (relevant combo of work and education) Education Desired : Master's Degree Travel Percentage : 0% Job Description Are you curious, motivated, and forward-thinking? At FIS you’ll have the opportunity to work on some of the most challenging and relevant issues in financial services and technology. Our talented people empower us, and we believe in being part of a team that is open, collaborative, entrepreneurial, passionate and above all fun. About the team: Our team of Data Scientists works on Customer Lifecycle Analytics. We have end-to-end engagement, from designing solutions with stakeholder, coding the solutions, releasing the processes, and maintaining the process through the lifetime duration. We build predictive models predicting churn, pricing algorithms, forecasts, and customer engagement touch point optimization. What you will be doing: You will be working with the team in an Agile environment. You will be a part of designing solutions, coding solutions, and production support of the finalized process. You will use R-studio, SQL (Impala/Hive), and Hadoop Distributed File System as well as Cloud Data Platforms. Employ machine learning and statistical modeling to create and enhance data driven products Analyze and extract insights from internal and external data Work with Big Data and transform complex datasets into more usable formats Work with a variety of data science tools and programming languages such as SAS, Python, R, Scala, SQL Work independently and collaborate with other groups to solve complex problems Create and present analyses Document models and write code to track and monitor models and product performance Understand the realities of model development and make pragmatic and business-aware choices when trading-off sophistication and accuracy versus implementation and performance costs Other related duties assigned as needed What you bring: The ideal candidate will have in-depth experience with predictive modelling using data science tools and languages. Knowledge of end-to-end systems development life cycles, e.g., iterative and other modern approaches to software development. Ability to clearly present complicated findings to business professionals in a language they can understand. Ability to develop and enforce best practices relating to code structure, style, and documentation. Added bonus if you have: Ability to bridge the gap between a problem and potential solutions Ability develop in an iterative manner, solving the most important and basic problems first. Taking feedback. And developing into more complex solutions. What we offer you: A multifaceted job with a high degree of responsibility and a broad spectrum of opportunities The chance to work on some of the most challenging, relevant issues in financial services & technology A work environment built on collaboration, flexibility and respect . Privacy Statement FIS is committed to protecting the privacy and security of all personal information that we process in order to provide services to our clients. For specific information on how FIS protects personal information online, please see the Online Privacy Notice. EEOC Statement FIS is an equal opportunity employer. We evaluate qualified applicants without regard to race, color, religion, sex, sexual orientation, gender identity, marital status, genetic information, national origin, disability, veteran status, and other protected characteristics. The EEO is the Law poster is available here supplement document available here  For positions located in the US, the following conditions apply. If you are made a conditional offer of employment, you will be required to undergo a drug test. ADA Disclaimer: In developing this job description care was taken to include all competencies needed to successfully perform in this position. However, for Americans with Disabilities Act (ADA) purposes, the essential functions of the job may or may not have been described for purposes of ADA reasonable accommodation. All reasonable accommodation requests will be reviewed and evaluated on a case-by-case basis. Sourcing Model Recruitment at FIS works primarily on a direct sourcing model; a relatively small portion of our hiring is through recruitment agencies. FIS does not accept resumes from recruitment agencies which are not on the preferred supplier list and is not responsible for any related fees for resumes submitted to job postings, our employees, or any other part of our company. #pridepass  This job is available in 2 locations See all Job Id JR0142453 Category Product Development Posted Date: 04/16/2021",data scientist
