JobDesc,JobTitle
"UES, Inc. is seeking a Scientist to support synchrotron X-ray scattering, morphology characterization, and real-time and in-situ measurements combined with machine learning and optimization. This role will work as a member of the Composites Branch within the Materials and Manufacturing Directorate of the Air Force Research Laboratory at Wright Patterson Air Force Base in Dayton, OH. Research will focus on in-operando and in-situ measurement data reduction and visualization techniques to accelerate understanding of scattering experiments. This will include both implementation of developed routines at a synchrotron beamline as well as X-ray equipment in-house. Expertise in materials science and technical computing languages (preferably Python) is required. Experience with scattering techniques, additive manufacturing, composite processing, polymer processing, and parallel computing is highly desired. Requirements: A PhD in Materials Science, Physics, Applied Math, Chemical Engineering, Mechanical Engineering, Electrical Engineering, or related field of study is required. Technical computer programming experience is required, preferably in Python Experience with optimization, classification, and/or machine learning methods This position is working within a government facility and requires U.S. Citizenship Additional Information UES, Inc. is an innovative science and technology company providing customers with superior research and development expertise since its inception in 1973. Our long-term success is a direct result of a strong commitment to the success of our employees. We look forward to reviewing your application. UES, Inc. is committed to hiring and retaining a diverse workforce. We are proud to be an Equal Opportunity/Affirmative Action Employer, making decisions without regard to race, color, religion, creed, sex, sexual orientation, gender identity, marital status, national origin, age, veteran status, disability, or any other protected class. U.S. Citizenship is required for most positions.  PI136097785",data scientist
"Position Type : Full time Type Of Hire : Experienced (relevant combo of work and education) Education Desired : Master's Degree Travel Percentage : 0% Job Description Are you curious, motivated, and forward-thinking? At FIS you’ll have the opportunity to work on some of the most challenging and relevant issues in financial services and technology. Our talented people empower us, and we believe in being part of a team that is open, collaborative, entrepreneurial, passionate and above all fun. About the team: Our team of Data Scientists works on Customer Lifecycle Analytics. We have end-to-end engagement, from designing solutions with stakeholder, coding the solutions, releasing the processes, and maintaining the process through the lifetime duration. We build predictive models predicting churn, pricing algorithms, forecasts, and customer engagement touch point optimization. What you will be doing: You will be working with the team in an Agile environment. You will be a part of designing solutions, coding solutions, and production support of the finalized process. You will use R-studio, SQL (Impala/Hive), and Hadoop Distributed File System as well as Cloud Data Platforms. Employ machine learning and statistical modeling to create and enhance data driven products Analyze and extract insights from internal and external data Work with Big Data and transform complex datasets into more usable formats Work with a variety of data science tools and programming languages such as SAS, Python, R, Scala, SQL Work independently and collaborate with other groups to solve complex problems Create and present analyses Document models and write code to track and monitor models and product performance Understand the realities of model development and make pragmatic and business-aware choices when trading-off sophistication and accuracy versus implementation and performance costs Other related duties assigned as needed What you bring: The ideal candidate will have in-depth experience with predictive modelling using data science tools and languages. Knowledge of end-to-end systems development life cycles, e.g., iterative and other modern approaches to software development. Ability to clearly present complicated findings to business professionals in a language they can understand. Ability to develop and enforce best practices relating to code structure, style, and documentation. Added bonus if you have: Ability to bridge the gap between a problem and potential solutions Ability develop in an iterative manner, solving the most important and basic problems first. Taking feedback. And developing into more complex solutions. What we offer you: A multifaceted job with a high degree of responsibility and a broad spectrum of opportunities The chance to work on some of the most challenging, relevant issues in financial services & technology A work environment built on collaboration, flexibility and respect . Privacy Statement FIS is committed to protecting the privacy and security of all personal information that we process in order to provide services to our clients. For specific information on how FIS protects personal information online, please see the Online Privacy Notice. EEOC Statement FIS is an equal opportunity employer. We evaluate qualified applicants without regard to race, color, religion, sex, sexual orientation, gender identity, marital status, genetic information, national origin, disability, veteran status, and other protected characteristics. The EEO is the Law poster is available here supplement document available here  For positions located in the US, the following conditions apply. If you are made a conditional offer of employment, you will be required to undergo a drug test. ADA Disclaimer: In developing this job description care was taken to include all competencies needed to successfully perform in this position. However, for Americans with Disabilities Act (ADA) purposes, the essential functions of the job may or may not have been described for purposes of ADA reasonable accommodation. All reasonable accommodation requests will be reviewed and evaluated on a case-by-case basis. Sourcing Model Recruitment at FIS works primarily on a direct sourcing model; a relatively small portion of our hiring is through recruitment agencies. FIS does not accept resumes from recruitment agencies which are not on the preferred supplier list and is not responsible for any related fees for resumes submitted to job postings, our employees, or any other part of our company. #pridepass  This job is available in 2 locations See all Job Id JR0142453 Category Product Development Posted Date: 04/16/2021",data scientist
"Battelle delivers when others can’t. We conduct research and development, manage laboratories, design and manufacture products and deliver critical services for our clients—whether they are a multi-national corporation, a small start-up or a government agency.  We recognize and appreciate the value and contributions of individuals with diverse backgrounds and experiences and welcome all qualified individuals to apply. JOB SUMMARY Battelle’s Trust and Assurance Cyber Analytics Department is seeking Data Scientist to work in our Columbus, Ohio location.  “From Silicon to Systems” - We are an elite, multi-disciplinary team, bringing together the brightest minds from physics, computer science, electrical engineering, and mathematics to develop unique embedded security solutions for government and industrial customers.  Battelle has been trusted by elite government clients to solve some of the world’s hardest security problems. We work in small agile teams to push the bounds of computing technology. Our high-powered labs include specialized software and hardware, so our engineers have everything they need to invent new Cyber solutions. Our team is casual putting results over formality. Team members can work flexible hours, and Battelle maintains a 9/80 schedule meaning employees have a chance to take every other Friday off.  We encourage new ideas with our large Internal Research and Development (IRAD) program where engineers work on projects they are passionate about. Inventors and innovators are rewarded by our industry leading IP compensation program. Our group works collaboratively with many parts of Battelle’s larger organization on projects ranging from genomics to robotics. MAJOR RESPONSIBILITIES Aid in the design and implementation of machine learning, data mining, data fusion, and data engineering techniques applied to cyber security problems Learn and become fluent in the details of security related domains in order to devise data driven solutions – this can range from software fuzzing to micro-electronic supply chain analysis Improve existing techniques and devise new techniques to solve security data problems Independently propose and develop creative solutions to unique problems, potentially leading IR&D projects Identify and articulate strengths and weaknesses of solutions, conclusions and problem approaches during technical discussions. THE FOLLOWING IS REQUIRED Bachelor’s degree in STEM field (Statistics, Physics, Computer Science, Mathematics, Electrical Engineering, or similar) with 1-5 years’ experience Demonstrated experience developing in either Python or R. Experience solving complex data problems Experience applying machine learning, statistics and/or data mining techniques Excitement about learning new technical subject areas and curiosity about cyber security problems Must be a sole US citizen with the ability to obtain and maintain a US government security clearance. THE FOLLOWING IS DESIRED Advanced degree in STEM field (Statistics, Physics, Computer Science, Mathematics, Electrical Engineering, or similar) with 0-2 years experience Experience with deep learning methods and with microelectronic design workflow Electronics bench skills such as digital and analog test & measurement Ability to generate verification test benches for simulating and validating microelectronic designs Experience in vulnerability analysis for either software or hardware Understanding of VHDL and/or Verilog hardware description languages. Familiarity with compiled languages like C, C++, or rust Familiarity with shell scripting languages like bash, zsh, or csh Active Secret or Top-Secret Clearance LEGAL DISCLAIMER The above statements are intended to describe the nature and level of work being performed by people assigned to this job. They are not intended to be an exhaustive list of all responsibilities, activities and skills required of staff members. No statement herein is intended to imply any authorities to commit Battelle unless special written permission is granted by Battelle’s Legal Department. BENEFITS Battelle’s competitive benefits program includes comprehensive medical and dental care, matching 401K, paid time off, flexible spending accounts, disability coverage, and other benefits that help provide financial protection for you and your family.  Battelle provides employment and opportunities for advancement, compensation, training, and growth according to individual merit, without regard to race, color, religion, sex (including pregnancy), national origin, sexual orientation, gender identity or expression, marital status, age, genetic information, disability, veteran-status, or any other characteristic protected under applicable Federal, state, or local law. Our goal is for each staff member to have the opportunity to grow to the limits of their abilities and to achieve personal and organizational objectives. We will support positive programs for equal treatment of all staff and full utilization of all qualified employees at all levels within Battelle.",data scientist
"Make banking a Fifth Third better®  We connect great people to great opportunities. Are you ready to take the next step? Discover a career in banking at Fifth Third Bank. GENERAL FUNCTION: The Data Scientist will perform data analysis, statistical analysis, and develop algorithms and methodologies on structured and unstructured data for on-demand and software-embedded use. Manage key analyses to drive more profitable business decisions. Focus on providing value-added analysis and recommendations to support business growth. Responsible and accountable for risk by openly exchanging ideas and opinions, elevating concerns, and personally following policies and procedures as defined. Accountable for always doing the right thing for customers and colleagues, and ensures that actions and behaviors drive a positive customer experience. While operating within the Bank's risk appetite, achieves results by consistently identifying, assessing, managing, monitoring, and reporting risks of all types. ESSENTIAL DUTIES AND RESPONSIBILITIES: Build large and complex information sets; Integrates and extracts relevant information from large amounts of both structured and unstructured data (internal and external) to enable analytical solutions. Conducts advanced analytics leveraging predictive modeling, machine learning, simulation, optimization and other techniques to deliver insights or develop analytical solutions to achieve business objectives. Develop and manage and develop analyses and algorithms that generate actionable insights and programs to improve long-term revenue and relevance. Partner with key stakeholders to understand the underlying needs of the business and formulate, communicate and create buy-in for analytics approaches and solutions. Effective communicate and translate business strategy and goals into manageable problems with well-defined measurable objectives and outcomes. Transform formulated problems into implementations plans for experiments by developing data sources, applying/creating the appropriate methods, algorithms, and tools, as well as delivering statistically valid and reliable results. Ad hoc reporting and analytics to support requests from the Bank's various lines of business. Provides input into the creation of detailed project plans, work assignments, target dates and other aspects of assigned projects. MINIMUM KNOWLEDGE, SKILLS AND ABILITIES REQUIRED: Bachelor's degree in Statistics, Economics, Analytics, Mathematics, Computer Science, Information Technology or related field. Advanced degrees preferred, but not required. Typically requires minimum of 4-5 years work experience. Database and analytical experience required. Excellent written and oral communications skills. Ability to effectively manage time. Independent and highly self-motivated. Ability to communicate effectively. Strong PC skills including Microsoft Office (Word, Excel, Access, PowerPoint). Data Scientist LOCATION - Cincinnati, Ohio 45263 Fifth Third Bank, National Association is proud to have an engaged and inclusive culture and to promote and ensure equal employment opportunity in all employment decisions regardless of race, color, gender, national origin, religion, age, disability, sexual orientation, gender identity, military status, veteran status or any other legally protected status.",data scientist
"Battelle delivers when others can’t. We conduct research and development, manage laboratories, design and manufacture products and deliver critical services for our clients—whether they are a multi-national corporation, a small start-up or a government agency.  We recognize and appreciate the value and contributions of individuals with diverse backgrounds and experiences and welcome all qualified individuals to apply. JOB SUMMARY Battelle’s Trust and Assurance Cyber Analytics Department is seeking a Senior Data Scientist to work in our Columbus, Ohio location.   “From Silicon to Systems” - We are an elite, multi-disciplinary team, bringing together the brightest minds from physics, computer science, electrical engineering, and mathematics to develop unique embedded security solutions for government and industrial customers.  Battelle has been trusted by elite government clients to solve some of the world’s hardest security problems. We work in small agile teams to push the bounds of computing technology. Our high-powered labs include specialized software and hardware, so our engineers have everything they need to invent new Cyber solutions. Our team is casual putting results over formality. Team members can work flexible hours, and Battelle maintains a 9/80 schedule meaning employees have a chance to take every other Friday off.  We encourage new ideas with our large Internal Research and Development (IRAD) program where engineers work on projects they are passionate about. Inventors and innovators are rewarded by our industry leading IP compensation program. Our group works collaboratively with many parts of Battelle’s larger organization on projects ranging from genomics to robotics. MAJOR RESPONSIBILITIES Lead the design and implementation of machine learning, data mining, data fusion, and data engineering techniques applied to cyber security problems Learn and become fluent in the details of security related domains in order to devise data driven solutions – this can range from software fuzzing to micro-electronic supply chain analysis Improve existing techniques and devise new techniques to solve security data problems Independently propose and develop creative solutions to unique problems, potentially leading IR&D projects Identify and articulate strengths and weaknesses of solutions, conclusions and problem approaches during technical discussions. THE FOLLOWING IS REQUIRED Bachelor’s degree in STEM field (Statistics, Physics, Computer Science, Mathematics, Electrical Engineering, or similar) with 8+ years’ of experience Advanced degree in STEM field (Statistics, Physics, Computer Science, Mathematics, Electrical Engineering, or similar) Demonstrated experience developing in either Python or R. Experience solving complex data problems Experience applying machine learning, statistics and/or data mining techniques Excitement about learning new technical subject areas and curiosity about cyber security problems Must be a sole US citizen with the ability to obtain and maintain a US government security clearance. THE FOLLOWING IS DESIRED Experience with deep learning methods and with microelectronic design workflow Electronics bench skills such as digital and analog test & measurement Ability to generate verification test benches for simulating and validating microelectronic designs Experience in vulnerability analysis for either software or hardware Understanding of VHDL and/or Verilog hardware description languages. Familiarity with compiled languages like C, C++, or rust Familiarity with shell scripting languages like bash, zsh, or csh Active Secret or Top-Secret Clearance LEGAL DISCLAIMER The above statements are intended to describe the nature and level of work being performed by people assigned to this job. They are not intended to be an exhaustive list of all responsibilities, activities and skills required of staff members. No statement herein is intended to imply any authorities to commit Battelle unless special written permission is granted by Battelle’s Legal Department. BENEFITS Battelle’s competitive benefits program includes comprehensive medical and dental care, matching 401K, paid time off, flexible spending accounts, disability coverage, and other benefits that help provide financial protection for you and your family.  Battelle provides employment and opportunities for advancement, compensation, training, and growth according to individual merit, without regard to race, color, religion, sex (including pregnancy), national origin, sexual orientation, gender identity or expression, marital status, age, genetic information, disability, veteran-status, or any other characteristic protected under applicable Federal, state, or local law. Our goal is for each staff member to have the opportunity to grow to the limits of their abilities and to achieve personal and organizational objectives. We will support positive programs for equal treatment of all staff and full utilization of all qualified employees at all levels within Battelle.",data scientist
