JobDesc,JobTitle
"Job Description Edwards Lifesciences has a new opening as a Principal Data Scientist supporting our Supply Chain operations. In this role, the Principal Data Scientist will be focused on advanced analytics, collecting, and curating data. They will provide expertise in the creation of Machine Learning and AI foundation for our Global Supply Chain organization. This is a new opportunity within Edwards and will play a significant role in developing an advanced analytics competency center.  Key Responsibilities: Provide technical expertise to drive appropriate use of predictive modeling and algorithms to team members to apply to data sets to drive optimization of the clinical trial experience including updating and ensuring algorithms are current. Build custom quantitative models by applying advanced statistical methods (e.g., causal and predictive modeling, forecasting, data mining, simulation, and/or optimization) Interpret results of quantitative models, identify trends and issues, and develop alternatives to support business objectives. Identify new objectives and goals to further optimize business processes and tools to develop and analyze model performance and data accuracy Identify and resolve challenging supply chain issues Partner with different internal and external stakeholders to plan implementation meetings including testing and training machine learning models while monitoring outcomes Provide dashboard reporting to leadership on the effectiveness of machine learning tools and applications to help inform and drive decision-making Identify opportunities to leverage various sources of data to drive enhanced solutions in collaboration with stakeholders throughout the business Oversee data governance as it relates to machine learning implementations Develop a procedures and guidelines to promote the future of machine learning development within assigned BU  Basic Qualifications: Bachelor's Degree in Computer Science, Engineering, Biostatistics or Scientific field, and 8 years of experience including either industry or industry/education or Master's Degree or equivalent in Computer Science, Engineering, Biostatistics or Scientific field, and 7 years of experience including either industry or industry/education Required or Ph.D. or equivalent in Computer Science, Engineering, Biostatistics or Scientific field , and 4 years of experience including either industry or industry/education Required Proven expertise in statistical techniques (e.g. distributions, statistical testing, regression, etc.) Expert knowledge and understanding of principles, theories, and concepts relevant to Artificial Intelligence (AI) and/or Machine Learning model development, and/or Control Systems  Preferred Qualifications: Experience with machine learning techniques (e.g., clustering, decision tree learning, artificial neural networks, etc.) Experience using statistical computer languages (e.g, R, Python, SQL, etc.) to manipulate large data sets Experience in data visualization tools (i.e. Qlikview, Tableau, etc.) Experience with using web services (e.g., Redshift, S3, Spark, etc.) Excellent and successful project management skills Additional Skills: Excellent documentation and communication skills Excellent interpersonal relationship skills including negotiating and relationship management skills Proven expertise on MS Office Suite (e.g., Microsoft Office Excel, PowerPoint, Word, and Access) Working knowledge in related tools and applications (e.g., Oracle, JDE, Concur, Salesforce.com) preferred Advanced problem-solving, organizational, analytical and critical thinking skills Expert understanding of processes and equipment used in assigned work Strong leadership skills and demonstrated ability to influence change Strict attention to detail Ability to interact professionally with all organizational levels Ability to manage competing priorities in a fast paced environment Represents organization as key technical contact on contracts and projects Interacts with senior external representatives on significant technical matters often requiring coordination between organizations Adhere to all EHS rules and requirements and take adequate control measures in preventing injuries to themselves and others as well as to the protection of environment and prevention of pollution under their span of influence/control E dwards is an Equal Opportunity/Affirmative Action employer including protected Veterans and individuals with disabilities.",Data Scientist
"Innovate. Collaborate. Build. Create. Solve. The KPMG Digital Lighthouse is KPMG's award-winning Analytics & AI Center of Excellence recognized by clients and leading analyst firms in the US and globally. The KPMG Lighthouse is a curation of specialized technical capabilities and domain experts working across the digital landscape: applied data science, AI, data engineering and insights, software engineering, automation, and big data. Here, you'll work with a diverse team of professionals to explore and build solutions for clients in a multiplatform environment. You'll be an important part of our high-energy, unique, fast-paced, and innovative culture that delivers with the agility of a tech startup and the backing of a leading global consulting firm. In this particular role, you'll work specifically in the AI Analytics & Engineering Community within the Digital Lighthouse, on a wide range of projects. From applied AI to optimization to big data platform engineering, your analytical and technical skills will drive real impact in the business world. At KPMG, our commitment to your career development helps to set us apart as an employer. We want to enhance your potential, both for yourself and as a contributor to our firm. That's why we provide every opportunity to expand your skills, knowledge and experiences through formal education and training programs, leadership development opportunities, and, as well as informal one-on-one coaching and mentoring from your KPMG colleagues. KPMG is currently seeking an Associate Natural Language Processing (NLP) to join our KPMG Lighthouse - Center of Excellence for Advanced Analytics. Responsibilities: Work in multi-disciplinary and cross-functional teams to translate business requirements into artificial intelligence goals and modeling approaches; rapidly iterate models and results to refine and validate approach while working across different areas (risk management, financial services, mergers and acquisitions, and public policy) Work in a fast-paced and dynamic environment with both virtual and face-to-face interactions; utilize structured approaches to solving problems, managing risks, and documenting assumptions; communicate results and educate others through insightful visualizations, reports and presentations Build ingestion processes to prepare, extract, and annotate a rich data variety of unstructured data sources (social media, news, internal/external documents, images, video, voice, emails, financial data, and operational data) Leverage a variety of tools and approaches to solve complex business objectives, from Statistical Natural Language Processing, Information Retrieval/Extraction, Machine Learning/ Deep Learning, Image Processing, Rules Engines, Knowledge Graphs, and Semantic Search Deliver on engagement milestones by following analytics processes to mitigate risks in data, modeling, validation, and delivery; Manage assumptions and risks, and work with others to clear issues Refactor deploy and validate models; work with clients iteratively to validate performance metrics, and sample output to drive towards a business-first solution; Utilize APIs, platforms, containers, multi-threading, distributed processing to achieve throughput goals Qualifications: Minimum of two years of prior experience working in teams of data & analytics professionals to deliver on business-driven analytics projects using natural language processing, machine learning on unstructured data, and/or information retrieval; Experience performing data science (data discovery, cleaning, model selection, validation, and deployment); Coding artificial intelligence methods; and restructuring, refactoring, and optimizing code for efficiency; Multidisciplinary backgrounds Master's degree from an accredited college/university in Computer Science, Engineering, or related fields. PhD from an accredited college/university is preferred Ability to apply artificial intelligence techniques to achieve concrete business goals; ability to work with the business to understand available resources and constraints around data (sources, integrity, and definitions), processing platforms, and security; Provide assistance, and resolve problems, using solid problem-solving skills, verbal/written communication Understanding of data preparation, machine learning, deep learning, natural language processing; ability to discuss mathematical formulations, alternatives, and impact on modeling approach; Understanding of development practices such as testing, code design, complexity, and code optimization Fluency in Python; Proficiency in AI related frameworks (NLTK, Spacy, Scikit-Learn, Tensorflow); and experience with platforms (Google Cloud, Azure, and AWS); Ability to pick up new languages and technologies quickly and work efficiently under Unix/Linux environment with experience with source code management systems like GIT; Ability to work with a variety of databases (SQL, ElasticSearch, Solr, Neo4j) Ability to travel up to eighty percent of the time; Applicants must be currently authorized to work in the United States without the need for visa sponsorship now or in the future KPMG LLP (the U.S. member firm of KPMG International) offers a comprehensive compensation and benefits package. KPMG is an affirmative action-equal opportunity employer. KPMG complies with all applicable federal, state and local laws regarding recruitment and hiring. All qualified applicants are considered for employment without regard to race, color, religion, sex, sexual orientation, gender identity, national origin, disability, protected veteran status, or any other category protected by applicable federal, state or local laws. The attached link contains further information regarding the firm's compliance with federal, state and local recruitment and hiring laws. No phone calls or agencies please.",Data Scientist
"This is an exciting opportunity for an exceptional {insert title} professional with the experience to join a team that is boldly designing transcatheter mitral and tricuspid therapies from the ground up. TMTT is dedicated to solving the complex challenges of mitral and tricuspid disease in order to transform treatment and significantly improve patients’ lives. The Manager, Statistical Programming will manage a team and oversee statistical programming activities within the Transcatheter Mitral & Tricuspid Therapies (TMTT) business unit. The time is now to join TMTT and shape mitral and tricuspid therapies that will transform treatment. Don’t miss your chance to be part of a dynamic, challenging, and rewarding environment that offers potential for growth and professional advancement for the right candidate.  Job Functions: Lead a team of programmers in the development of program specifications and design documents in partnership with project statistician Lead programming analysis datasets in multiple clinical trials for analysis for inclusion in clinical study reports, presentations, or select publications in collaboration with project statistician Functions as the lead statistical programmer for specific projects Develop a robust talent development plan in alignment with functional growth strategies of the department Provide programming expertise on complex ad hoc data requests in collaboration with project statistician Identify risk, develop and lead in the implementation of strategies which may include negotiations with internal and external parties Ensure analysis data and programming code meet regulatory and company standards and are consistently structured to permit efficient programming, reporting, and review Develop and revise statistical programming procedures or instructions Assist in compiling technical documents for internal and external audits Basic Qualifications: Master’s degree in Statistics Mathematics, Computer Science or related field with 8 years of experience in statistical analysis A minimum of 1 year leadership experience Proven expertise in SAS and Windows operating systems Proven expertise in graphs, figures, listing, and tables Strong experience with macros, including utility macros Preferred Qualifications: Proven successful project management leadership skills Experience with R, S-Plus, Python, etc preferred Proven expertise in MS Office Suite including Word, PowerPoint, Access, and Excel Excellent written and verbal communication skills and interpersonal relationship skills including negotiating and relationship management skills with ability to drive achievement of objectives Keeps abreast of new developments in statistics and regulatory guidance Expert understanding of clinical trial and statistical programming procedures while addressing issues with impact beyond own team based on knowledge of related disciplines Demonstrated track record in people management Expert understanding and knowledge relevant to statistical programming Expert understanding and knowledge of regulatory guidelines (e.g., GCP, ICH, FDA, ISO) relevant to in Pharmaceutical/Medical Device research setting Excellent problem-solving, organizational, analytical and critical thinking skills Demonstrated ability to manage assigned team and provide coaching and feedback, including responsibility for all employee actions including hire/fire authority and partnering with HR on all aspects of employee relations Experience in facilitating change, including collaboration with management and executive stakeholders Strict attention to detail Ability to interact professionally with all organizational levels Ability to manage competing priorities in a fast paced environment Must be able to work in a team environment, including participating and presenting at meetings, including with external representatives Frequently interacts with customers, and/or functional peer group managers, normally involving matters between cross-functional teams and the company; often leads a cooperative effort among members of a project team Participate and present at meetings with internal and external representatives E dwards is an Equal Opportunity/Affirmative Action employer including protected Veterans and individuals with disabilities.",Data Scientist
"Bachelor’s degree in a highly quantitative field (Computer Science, Machine Learning, Operational Research, Statistics, Mathematics, etc.) or equivalent professional or military experience Experience with ML fields, e.g., natural language processing, computer vision, statistical learning theory 10+ years of industry experience in predictive modeling, data science, and analysis Experience in an ML engineer or data scientist role building and deploying ML models or hands on experience developing deep learning models Experience writing code in Python, R, Scala, Java, C++ with documentation for reproducibility Experience handling terabyte size datasets, diving into data to discover hidden patterns, using data visualization tools, writing SQL, and working with GPUs to develop models Experience writing and speaking about technical concepts to business, technical, and lay audiences and giving data-driven presentations Want to help the largest global enterprises derive business value through the adoption of Artificial Intelligence (AI) and Machine Learning (ML)? Excited by using massive amounts of disparate data to develop ML models? Eager to learn to apply ML to a diverse array of enterprise use cases? Thrilled to be a part of Amazon who has been pioneering and shaping the world’s AI/ML technology for decades?  At Amazon Web Services (AWS), we are helping large enterprises build ML models on the AWS Cloud. We are applying predictive technology to large volumes of data and against a wide spectrum of problems. AWS Professional Services works together with AWS customers to address their business needs using AI solutions.  AWS Professional Services is a unique consulting team. We pride ourselves on being customer obsessed and highly focused on the AI enablement of our customers. If you have experience with AI, including building ML models, we’d like to have you join our team. You will get to work with an innovative company, with great teammates, and have a lot of fun helping our customers. A successful candidate will be a person who enjoys diving deep into data, doing analysis, discovering root causes, and designing long-term solutions.  This is a customer-facing role and you will be required to travel to client locations and deliver professional services as needed.  Major responsibilities include: Assist customers by being able to deliver a ML project from beginning to end, including understanding the business need, aggregating data, exploring data, building & validating predictive models, and deploying completed models with concept-drift monitoring and retraining to deliver business impact to the organization Use AWS AI services (e.g., Personalize), ML platforms (SageMaker), and frameworks (e.g., MXNet, TensorFlow, PyTorch, SparkML, scikit-learn) to help our customers build ML models Research and implement novel ML approaches, including hardware optimizations on platforms such as AWS Inferentia Work with our other Professional Services consultants (Big Data, IoT, HPC) to analyze, extract, normalize, and label relevant data, and with our Professional Services engineers to operationalize customers’ models after they are prototyped Mater’s degree of PhD in a highly quantitative field (Computer Science, Machine Learning, Operational Research, Statistics, Mathematics, etc.) Ability to develop strategic, baselined, data modeling processes; ability to accurately determine cause-and-effect relationships. Publications or presentations in recognized ML journals or conferences Deep technical skills, consulting experience, and business savvy to interface with all levels and disciplines within our customers’ organization Demonstrable track record of dealing well with ambiguity, prioritizing needs, and delivering results in a dynamic environment Amazon is committed to a diverse and inclusive workplace. Amazon is an equal opportunity employer and does not discriminate on the basis of race, national origin, gender, gender identity, sexual orientation, protected veteran status, disability, age, or other legally protected status. For individuals with disabilities who would like to request an accommodation, please visit https://www.amazon.jobs/en/disability/us.  Pursuant to the San Francisco Fair CHance Ordinace, we will consider for employmnet qulified applicants iwth arrest and conviction records.",Data Scientist
"Historically, the travel requirement for this position has ranged from 80-100%. The safety and well-being of our people continues to be the top priority, and our decisions around travel are informed by government COVID-19 response directives, recommendations from leading health authorities, and guidance from a number of infectious disease experts. For now, all KPMG business travel, international and domestic, is currently restricted to client-essential sales/delivery activity only. At some point in the future and with the safety of people as the critical factor, the travel requirement will likely increase, possibly to previous levels, but KPMG is committed to balancing client requirements with new delivery capabilities. Innovate. Collaborate. Build. Create. Solve. The KPMG Digital Lighthouse is KPMG's award-winning Analytics & AI Center of Excellence recognized by clients and leading analyst firms in the US and globally. The KPMG Lighthouse is a curation of specialized technical capabilities and domain experts working across the digital landscape: applied data science, AI, data engineering and insights, software engineering, automation, and big data. Here, you'll work with a diverse team of professionals to explore and build solutions for clients in a multiplatform environment. You'll be an important part of our high-energy, unique, fast-paced, and innovative culture that delivers with the agility of a tech startup and the backing of a leading global consulting firm. In this particular role, you'll work specifically in the AI Analytics & Engineering Community within the Digital Lighthouse, on a wide range of projects. From applied AI to optimization to big data platform engineering, your analytical and technical skills will drive real impact in the business world. At KPMG, our commitment to your career development helps to set us apart as an employer. We want to enhance your potential, both for yourself and as a contributor to our firm. That's why we provide every opportunity to expand your skills, knowledge and experiences through formal education and training programs, leadership development opportunities, and, as well as informal one-on-one coaching and mentoring from your KPMG colleagues. KPMG is currently seeking a Sr. Associate to join our KPMG Lighthouse - Center of Excellence for Advanced Analytics. Responsibilities: Work in multi-disciplinary and cross-functional teams to translate business requirements into artificial intelligence goals and modeling approaches Rapidly iterate models and results to refine and validate approach working across different areas (risk management, financial services, mergers and acquisitions, and public policy) Work in a fast-paced and dynamic environment with both virtual and face-to-face interactions utilizing structured approaches to solving problems, managing risks, documenting assumptions, communicating results, and educating others through insightful visualizations, reports and presentations Build ingestion processes to, prepare, extract, and annotate a rich data variety of unstructured data sources (social media, news, internal/external documents, images, video, voice, emails, financial data, and operational data) Leverage a variety of tools and approaches to solve complex business objectives, from Statistical Natural Language Processing, Information Retrieval/Extraction, Machine Learning/Deep Learning, Image Processing, Rules Engines, Knowledge Graphs, and Semantic Search Refactor deploy and validate models; work with clients iteratively to validate performance metrics, and sample output to drive towards a business-first solution; utilize APIs, platforms, containers, multi-threading, and distributed processing to achieve throughput goals Qualifications: Minimum of two years of experience leading work streams with at least two data scientists, engineers, and other data & analytics professionals, including innovation, quality management, utilizing analytics and software development processes for natural language processing, machine learning on unstructured data, and/or information retrieval; Multidisciplinary backgrounds Master’s degree from an accredited college/university in Computer Science, Engineering, or related fields. PhD from an accredited college/university is preferred Ability to apply artificial intelligence techniques to achieve concrete business goals while understanding available resources and constraints around data (sources, integrity, and definitions), processing platforms, and security; Ability to discuss mathematical formulations, alternatives, and impact on modeling approach and understanding of development practices (testing, code design, complexity, and code optimization) Solid experience performing data science from data discovery, cleaning, model selection, validation, and deployment; experience coding artificial intelligence methods using object-oriented programming in a software development process, and ability to restructure, refactor and optimize code for efficiency Fluency in Python; Proficiency in AI related frameworks (NLTK, Spacy, Scikit-Learn, and Tensorflow); Experience with platforms (Google Cloud, Azure, and AWS); Ability to pick up new languages and technologies quickly and to work efficiently under Unix/Linux environment with experience with source code management systems like GIT; Ability to work with a variety of databases (SQL, ElasticSearch, Solr, Neo4j) Ability to travel up to eighty percent of the time; Applicants must be currently authorized to work in the United States without the need for visa sponsorship now or in the future KPMG LLP (the U.S. member firm of KPMG International) offers a comprehensive compensation and benefits package. KPMG is an affirmative action-equal opportunity employer. KPMG complies with all applicable federal, state and local laws regarding recruitment and hiring. All qualified applicants are considered for employment without regard to race, color, religion, sex, sexual orientation, gender identity, national origin, disability, protected veteran status, or any other category protected by applicable federal, state or local laws. The attached link contains further information regarding the firm's compliance with federal, state and local recruitment and hiring laws. No phone calls or agencies please.",Data Scientist
