JobDesc,JobTitle
"at liberty mutual, our purpose is to help people embrace today and confidently pursue tomorrow. that’s why we provide an environment focused on openness, inclusion, trust and respect. here, you’ll discover our expansive range of roles, and a workplace where we aim to help turn your passion into a rewarding profession. liberty mutual has proudly been recognized as a “great place to work” by great place to work® us for the past several years. we were also selected as one of the “100 best places to work in it” on idg’s insider pro and computerworld’s 2020 list. for many years running, we have been named by forbes as one of america’s best employers for women and one of america’s best employers for new graduates—as well as one of america’s best employers for diversity. to learn more about our commitment to diversity and inclusion please visit: https://jobs.libertymutualgroup.com/diversity-inclusion we value your hard work, integrity and commitment to make things better, and we put people first by offering you benefits that support your life and well-being. to learn more about our benefit offerings please visit: https://lmi.co/benefits liberty mutual is an equal opportunity employer. we will not tolerate discrimination on the basis of race, color, national origin, sex, sexual orientation, gender identity, religion, age, disability, veteran’s status, pregnancy, genetic information or on any basis prohibited by federal, state or local law. senior software engineer – machine learning we deliver our customers peace of mind every day by helping them protect what they value most. our passion for placing the customer at the center of everything we do is driving a transformational shift at liberty mutual. operating as a tech startup within a fortune 100 company, we are leading a digital disruption that will redefine how people experience insurance. about the job: we are seeking an experienced senior software engineer with full stack skills to participate in software development within an agile team supporting our analytic platforms and services department. you will be working on runway, our internally developed platform for managing the deployment of ai/ml predictive models. runway makes it as fast and easy for data scientists to operationalize their python and r models while adhering to high standards for security, performance and availability. in addition to full-stack java development, this role also includes working on templates and ml operations components written in python. members of the runway team work closely with data scientists in all markets, so consulting skills and a desire to apply machine learning and artificial intelligence to high-value business challenges are critical to this role. the industry changes quickly, so we are looking for candidates who can respond to change, pick up new technologies quickly and adapt to changing requirements. we also want candidates who take pride in their work and have strong design and development expertise. we value quality code delivery and expect candidates to demonstrate competence at writing, testing and debugging java and python code. highly competitive candidates will have: familiar with python webserver and mlops libraries, such as flask, fastapi, mlflow and airflow knowledge of machine learning tools and practices data engineering skills, including sql databases, pandas and spark qualifications: bachelor's degree in technical discipline preferably computer science or software engineering 5+ years of professional development experience in java and python knowledge of it concepts, strategies, methodologies, architectures and technical standards analytical, problem solving, and communication skills familiarity with insurance functions and business operations extensive knowledge of design and development tools proficient in multiple programming languages and tools consulting, negotiation and consensus building skills strong presentation and written communication skill  bachelor's degree 16",data scientist
"the statistical programmer ii provides technical expertise for the conduct of clinical trials, and works with minimal supervision to support various programming activities related to the analysis and reporting of clinical study data. in addition, the statistical programmer ii may fill the statistical programming lead role (or part of that role) on small, non-complex projects.  qualifications qualifications: excellent analytical skills. proficiency in sas. knowledge and understanding of the programming and reporting process. knowledge of sops/guidelines, ich-gcp, and any other applicable local and international regulations such as 21 cfr part 11. ability to learn new systems and function in an evolving technical environment. ability to manage competing priorities and flexibility to change. attention to detail. ability to successfully work as part of a global team. work effectively in a quality-focused environment. effective time management in order to meet daily metrics or team objectives. show commitment to and perform consistently high quality work. business/operational skills that include customer focus, commitment to quality management, and problem solving.  knowledge and experience: competent in written and oral english. good communication skills. education: educated to degree level in a relevant discipline and/or equivalent work experience. eeo disclaimer parexel is an equal opportunity employer. qualified applicants will receive consideration for employment without regard to legally protected status, which in the us includes race, color, religion, sex, sexual orientation, gender identity, national origin, disability or protected veteran status.",data scientist
"director of predictive modeling posted: may 6, 2021 business: inari agriculture, inc. position type: full-time start date: immediate availability about the role.... as director of predictive modeling, you will be responsible for leading the team that develops and implements strategies to design step change products by leveraging our predictive and modeling capabilities. the right candidate enjoys a “start-up” atmosphere and is flexible, shows good judgment, takes initiative and is willing to take on a variety of tasks and responsibilities as needed to achieve goals and deliverables. excellent communication skills are essential for this role as part of an interdisciplinary team. this role is based out of west lafayette, indiana, and reports to the sr director of pre-commercial and product development. the responsibilities of this role includes the following: drive and build confidence in the predictive platform to accelerate product development and acceptance by internal and external partners contribute to the overall product development creation aligned with defined product concepts, including the trait strategy, and optimization of breeding programs prototype, develop and scale genetic and agronomic models to enhance germplasm use and product creation as well as commercial solutions design and validate new product performance evaluations aiming to accelerate time to market across the pipeline develop and implement germplasm and breeding strategies incorporating new technologies to guide germplasm selection, including accelerated line and hybrid development by rapid recycling of parents and genomic selection lead strategic data acquisition, data driven target discovery, and contribute to identify gene targets for the breeding pipeline. ensure uses of models capabilities beyond yield into other valuable traits bring the power of predictive modeling to various aspects across the company. closely collaborates with the product design team to integrate genetic diversity analyses into the discovery of causal sequences incorporate up-to-date scientific knowledge, data, and modeling approaches to develop and test new crop and genetic models and their deployment into pipeline risk predictions as director of predictive modeling, you will… provide technical contributions in a fast-paced products team environment to accelerate our efforts on building a data-driven pipeline leverage the latest advances in machine learning, predictive analytics and optimization algorithms to identify and drive the development and deployment of new methodologies globally be responsible for predicting and optimizing our product pipeline and improving the probability of success of our products develop sustainable, consumable, accurate, and impactful reporting on model inputs, model and observed outputs, business impact, and key performance indicators collaborate with the engineering team to co-develop digital solutions to support product development activities and increase the efficiency of the process. these include, but are not limited to: processing, storage and visualization of molecular data, haplotypes and pedigrees; generation of genomic predictions and environmental characterization; supporting organization and tracking of breeding programs and supporting databases build, manage, and lead a team of data scientists closely collaborates cross functionally across the company, partnering with the science and commercial teams frequently to ensure step change product development by applying innovative science and approaches design and prototype models that integrate artificial intelligence techniques, optimization, and statistics in order to solve challenging analytics problems influencing product developments using scalable models solve computational challenges of scaling complex ai algorithms on big data with engineer partners drive the adoption of data and predictions to guide decisions, and foster a data-driven culture throughout the company by providing tools that enable self-service analysis you bring… solid foundation in plant physiology, plant genetics/breeding, crop science or soil science with particular emphasis on commercial agriculture and current agronomic best practices phd in breeding, crop science, agronomy or similar discipline with 5 years of industry experience (preferred); or ms in breeding, crop science, agronomy or similar discipline with 10 years of experience (required) experience with modeling crop development, growth, biotic and abiotic stresses, and yield for different economically important crops programming skills in at least one data science language (python or r preferred) a strong sense of purpose and drive to develop unique, high impact solutions adaptability and enthusiasm for new challenges, innate curiosity, and a passion for learning creative and strategic thinking, willingness to be bold and take risks, and the ability to recognize and learn from failure a collaborative mindset that is open to giving and receiving ideas, perspectives, and feedback ability to work both independently and deliver on responsibilities within a highly collaborative environment ability to effectively communicate with a diverse range of individuals and audiences  for more information and to apply, go to https://grnh.se/13020ce62us",data scientist
"job description at vmware, we are preparing for the transformation of vmware to an even more customer-centric, cloud-ready company, which has resulted in a newly created and unified customer experience and success team. this has been as a result of many months of talking to our customers, as well as studying best practices in the software industry. this new organization will help to take vmware to the next level of customer satisfaction and success. this newly formed group has brought together various key functions and roles that are crucial to our customer experience. this includes customer success, global services, technical support, premier support, technical account management and professional services. our goal is to create an integrated and agile team that can deliver a best-in-class customer experience at scale, across our five solution areas. we lead with putting the customer at the center of everything we do. this new organization will be better positioned to transition to proactively and prescriptively guide our customers to value realization outcomes. we will do so through designed and reconciled winning customer experiences. our team will lead the way servicing our customers programmatically and help scale customer success to do the same. furthermore, we expect this team and with laser-focus commitment to our customers to help accelerate vmware’s evolution to a software-as-a-service company and significantly raise vmware’s net promoter score (nps). what is in it for you? you'll be a key member of the vmware team that has built a rare business environment - one of energy, creativity, collegiality and collaboration you will join an atmosphere that is fun, casual and inviting. in keeping with vmware's roots as a successful entrepreneurial, start up. you will have the opportunity deliver impactful results to the customer experience and success team while building your skillset and experience job requirements design and create models and algorithms to measure the customer experience measure and report on the impact and effectiveness of all phases of the customer journey measure and report on the impact and effectiveness of adoption and consumption campaigns leading to higher retention and customer growth leverage statistical analysis and machine learning to understand the effectiveness of vmware’s post-sale operating model partner with stakeholders on ways to improve the customer journey that enable the business to deliver value realization to vmware customers predict customer situations who will “fall out” of the journey collaborate inter and intra-departmentally on data from several different (disparate) data sources deliver customer insights and analytics to help improve on customer experience and deliver roi to customers create and deliver customer sentiment research analysis strategy and process  qualifications 6+ years of experience in solving complex business problems using advanced analytics, statistical analysis, machine learning, and algorithms that result in customer adoption, improved sentiment, and value realization 3+ years of experience in extracting, cleansing and working with structured and unstructured data sets 5+ years of experience working in agile environments with versioned or iterate development advanced python/r knowledge and hands on statistical programming comfortable working in a dynamically and changing environment comfortable working with loosely defined requirements where you exercise your creativity and analytical skills to deliver best in class solutions well versed in solving complex problems and communicating complex results to leadership and stakeholders deep experience budling nlp models excellent written and verbal communication, especially with articulating vision, planning, analysis process, and results in business terms. “this job requisition is not eligible for employment-based immigration sponsored by vmware.”  category : engineering and technology subcategory: data science experience: manager and professional full time/ part time: full time posted date: 2021-03-20  vmware company overview: at vmware, we believe that software has the power to unlock new opportunities for people and our planet. we look beyond the barriers of compromise to engineer new ways to make technologies work together seamlessly. our cloud, mobility, and security software form a flexible, consistent digital foundation for securely delivering the apps, services and experiences that are transforming business innovation around the globe. at the core of what we do are our people who deeply value execution, passion, integrity, customers, and community. shape what’s possible today at http://careers.vmware.com.  equal employment opportunity statement: vmware is an equal opportunity employer and prohibits discrimination and harassment of any kind: vmware is committed to the principle of equal employment opportunity for all employees and to providing employees with a work environment free of discrimination and harassment. all employment decisions at vmware are based on business needs, job requirements and individual qualifications, without regard to race, color, religion or belief, national, social or ethnic origin, sex (including pregnancy), age, physical, mental or sensory disability, hiv status, sexual orientation, gender identity and/or expression, marital, civil union or domestic partnership status, past or present military service, family medical history or genetic information, family or parental status, or any other status protected by the laws or regulations in the locations where we operate. vmware will not tolerate discrimination or harassment based on any of these characteristics. vmware encourages applicants of all ages. vmware will provide reasonable accommodation to employees who have protected disabilities consistent with local law.",data scientist
"at oneamerica, we deliver on promises when customers need us most. we believe the best way to serve our customers is to know that every individual, employee, family and business we work with has unique personal and financial goals. we keep our promises, so we can help them achieve their goals and realize their definition of financial success. data scientist responsible for supporting analytical projects and solutions that answer business questions. you will be responsible for organizing, modeling, interpreting, visualizing, and creating predictive and other analytical models from complex data gathered from multiple, structured, and unstructured data sources to provide oneamerica associates the insights they need. you have working experience with data-driven solution design, visualization, statistics, and predictive analytics and act as a resource for colleagues with less experience. you’re a storyteller who applies design thinking principles and data visualization to drive understanding and action. you’ll work closely with oneamerica associates in our lines of business to develop analytical solutions that finely balance explanation, precision, and recall. working knowledge in insurance and financial services industry is preferable as this would help you understand business needs more quickly and thoroughly. it would also let you design your solutions using business language and terminology well understood by those you’ll be helping. primary responsibilities: provide technical and quantitative analysis, develop, and automate predictive modeling processes that can be deployed through the organization to solve recurring analytics needs work with project managers and business analysts by providing statistical analyses, innovative research, mathematical calculations, and technical skills to help solve project needs help determine what actionable steps can be taken based on the findings. conduct exploratory data analysis and prepare data to be analyzed interpret data and identify correlations using both univariate and multivariate analysis. acts as resource for less experienced colleagues and may act as lead for analytic projects experiment with and conduct internal peer reviews for new modeling techniques to continually improve on existing methodologies communicate the relevant findings of work and provide implementation support for completed projects to insure work results are successfully deployed support and lead analytical and data mining efforts which could include but not limited to clustering, segmentation, logistic and multivariate regression, decision/cart trees, neural networks, time-series analysis, sentiment analysis, topic modeling, random forests, and bayesian analysis communicate and train users on model results required qualifications: bachelor’s degree in computer science, mathematics, statistics or other quantitative disciplines or any combination of education and experience which would provide an equivalent background 3+ years of work experience preferred qualifications: advanced degree 3+ years of work experience in the insurance or financial services field experience with tableau, alteryx, python, r, or sql related certifications salary band: 05b due to the covid-19 pandemic, the majority of oneamerica associates are currently working remotely in accordance with our safety protocols. the selected candidate will be expected to temporarily work remotely for an unspecified period of time as determined in oneamerica’s sole discretion. when normal business operations resume, the selected candidate will be expected to physically return to work in the office located in indianapolis, in. to learn more about our products, services, and the companies of oneamerica, visit oneamerica.com/companies. disclaimer: oneamerica is an equal opportunity employer and strictly prohibits unlawful discrimination based upon an individual’s race, color, religion, gender, sexual orientation, gender identity/expression, national origin/ancestry, age, mental/physical disability, medical condition, marital status, veteran status, or any other characteristic protected by law.",data scientist
"systems and statistical analyst fort wayne, in, estados unidos n.º de ped.720 27 de abril de 2021 focused on the moving services business sector, this position will manage information for the purpose of creating business process efficiencies and management, network and client reporting. it is a project-based position that requires a self-motivated, analytical individual to conceptualize abstract solutions and apply them to current business environment. strong understanding of computer programming logic structure in sql, vba, business objects, etc. and developed skill sets in the use of excel and analytic software such as access, ssrs programs and/or other reporting and analytical software is a requirement. ability to perform complex analysis in an evolving data environment, communicate with management and produce comprehensive information that effectively reflects the business situation.  essential functions/responsibilities  60(%) analyze internal business trends related to traffic flow, transit times, business product mix, corporate profitability, departmental performance, claim frequency/severity, agent /hauler performance, customer quality survey data. focus on solutions, dive into projects, quickly identify drivers in the data. complete projects that require data mining, analysis, and presentation. establish/maintain operational databases. works with internal and external customers to identify, research and resolve data integrity issues.  20(%) propose, develop and implement process efficiencies through on-line computer system enhancements and develop reporting and dashboards, identify relevant trends, do follow up analysis, prepare visualizations.  10(%) provide user level support for operations systems and pc applications. provide guidance for other associates within the systems support team.  10%) other duties as directed.  qualifications  in-depth knowledge of sirva’s on-line operational systems (vital/rsas, ats/camis, tracs/genesis, cms) strong understanding of computer programming logic structure and developed skill-sets in the use of excel and analytical software such as focus, access, etc. ability to identify trends from statistical information. ability to organize information into useful reports utilizing the microsoft office suite of products. an aptitude for problem solving and the ability to gather requirements from non-technical personnel. outros detalhes tipo de pagamento ordenado",data scientist
