JobDesc,JobTitle
"Clearwater's mission is to become the world's most trusted and comprehensive technology platform for investment accounting and analytics. We aim to do this by Empowering our clients to run efficient investment accounting operations that drive business growth Providing an auditable SaaS platform that facilitates integrated investment accounting, analytics, and reporting Creating a diverse, collaborative, innovative culture where excellence is the standard Contributing to our local communities to have a meaningful impact on our society You will help accomplish this mission by being a member of the Front Office team, which manages our core website and backing web services–the capstone that displays the output of all other development teams at Clearwater. About the role We have been succeeding at our mission over the past years, and are experiencing a rapid increase in the number of client accounts and data that need to be supported. In this role, you will Work on a team of other talented developers building Clearwater's most utilized product Implement solutions that enable an order of magnitude more data throughput Coordinate solutions with many other development teams and client stakeholders Enhance the stability of existing code and infrastructure Build your own skills through regular code reviews, training, and mentoring, as well as through free trainings on Udemy for Business About the technology We leverage a variety of technologies to support the development of quality software. Our application stack utilizes SQL Server, Java, and GWT. We also leverage Angular for new front-end projects. Our code is managed through git repositories housed in BitBucket. Application logging and monitoring is provided via Kibana, New Relic, and Grafana. We use Jenkins, Artifactory, Puppet, Google Cloud Platform, and in-house tooling to facilitate builds, deployment, infrastructure, and configuration. We're beginning to leverage Docker as well. Automated testing is facilitated by a variety of standard and in-house tools: JUnit, Cypress, Jasmine/Karma, Pact, and WireMock. We support a wide variety of communication mediums: Atlassian (Jira, Confluence), Office365 (including Microsoft Teams), and Zoom. We provide quality hardware to support development and communication on Windows or Mac. We would love to hear from you if You have at least 5 years of professional software development experience You have a knack for either front-end or back-end development You can explain basic client-server architecture to less-experienced developers You can communicate effectively with other technical teams and management to collect requirements, provide estimates, and meet production deadlines You have ever run an application on a public cloud provider About Clearwater Analytics Clearwater Analytics® is a global SaaS solution for automated investment data aggregation, reconciliation, accounting, and reporting. Clearwater helps thousands of organizations make the most of investment portfolio data with cloud-native software and client-centric servicing. Every day, investment professionals worldwide trust Clearwater to deliver timely, validated investment data and in-depth reporting. Clearwater aggregates, reconciles, and reports on more than $5 trillion in assets across many Fortune 500 clients.",software engineer
"About Clearwater Analytics® Clearwater Analytics® is a global SaaS solution for automated investment data aggregation, reconciliation, accounting, and reporting. Clearwater helps thousands of organizations make the most of investment portfolio data with cloud-native software and client-centric servicing. Every day, investment professionals worldwide trust Clearwater to deliver timely, validated investment data and in-depth reporting. Clearwater aggregates, reconciles, and reports on more than $5.5 trillion in assets across many Fortune 500 clients.  About the role We are looking for an experienced frontend engineer who shares our passion for making complex data and applications simple for our customers. You will build new features that delight our customers while keeping our trusted platform stable and scalable. As a Senior Frontend Engineer, you will play a key role in guiding the future of our web applications by bringing an aptitude for tackling engineering and development process challenges and an excitement for the impact you'll have on our customers.  What you'll be doing: Collaborate with the entire team to understand the feature requirements, design specs, use cases and customer values Leverage your knowledge of frontend best practices, design principles, and framework limitations to help the team plan new features in feasible and scalable ways Build new and efficient software features to support evolving business requirements and improve the user experience Ensure the highest code quality by writing unit and automation tests as well as developing proper test strategies and processes Mentor members of the team with your diverse insights into technical and non-technical topics Partner with key stakeholders to improve security, reliability, and performance of the Clearwater software platform  About you: Experience with modern JavaScript application frameworks, and ability to think outside the framework 5+ years of proven experience building highly available, scalable SaaS applications Understanding of client side performance optimization and how to mitigate security risks Experience in automated testing, including unit and end-to-end testing such as Jest, Karma, Jasmine, and Cypress Empathetic and outstanding communicator, both verbally and in writing Take initiative and ownership to see things through to completion and empower others to do the same Nice to have - Experience in data visualization  What we offer: Business casual atmosphere in a flexible working environment Team focused culture that promotes innovation and ownership Access to cutting edge investment reporting technology and expertise Continual learning, professional development and growth opportunities Competitive salary and benefits package; including health, vision and dental  Clearwater Analytics is an equal opportunity employer. We celebrate the diverse community our employees cultivate and are committed to creating an inclusive environment for everyone.",software engineer
"To apply for this position please go to: https://nightforceoptics.applicantpro.com/jobs/  Are you searching for an exciting career opportunity with a great company? A fast-paced, fun work environment with a full complement of benefits and some great employee perks? We are a benchmark for high-quality, high-performance products and our employees are hard-working, dedicated individuals. If you fit that mold and meet the qualifications for our position, we'd love to have you join us! EMBEDDED ELECTRICAL ENGINEER (ENTRY LEVEL): This position located in our Meridian, Idaho office, is responsible for integration of electro-mechanical and/or electro-optical systems into riflescopes, sporting optics and related accessories. Must possess the ability to apply the following: Analog and digital circuit design, PCB layout, embedded firmware, and testing/validation for project specific goals.  Required Qualifications/Skills/Experience: Bachelor's degree in Electrical Engineering required No experience required; 1-2 years experience preferred. Knowledge of signal processing, communication protocols, sensing, displays, PCB layout, programming languages, and wireless communications. Ability to prioritize workload effectively and manage a project from concept to full production. Languages: C/C++, Assembly Prototype fabrication and assembly, including surface mount and through-hole soldering, testing, and validation. Solid debugging skills and the ability to solve difficult problems. Self-motivated to resolve problems in creative ways, researching new technologies and standards. Demonstrated ability to learn new technologies and skills quickly. Dynamic and open-minded. Must have excellent written & verbal communication skills and be team-oriented. Desired Qualifications: Proficient with embedded test equipment RTOS experience including low level hardware drivers. Software: Altium Designer, Subversion, other IDEs for microcontroller development Real-time, event driven firmware programming Low power, battery operated hardware, and firmware design Protocols: USB, SPI, I2C, RS-232/485, Bluetooth, 802.15.4 (Zigbee) Graphical user interface and human interface device design is a plus. Optical and opto-mechanical experience would be considered a plus. Core Accountabilities Component selection and circuit design for position sensing, environmental sensing, data display, user interface, wired and wireless communications in battery operated systems. Assemble and validate high reliability prototypes for in-field use. Provide technical documentation and support for production, including PCB design files, bill of materials, firmware binaries, assembly/operating procedures, testing and inspection criteria, etc. Coordinate with other team members to ensure proper fit, form, and function using 3D models, drawings, etc. Work directly with prototype shops ensuring timely delivery of prototypes to verify new designs. Serve as technical correspondent to materials making sure product details are successfully communicated to vendors. Ensure vendors comply with specs and are approved prior to manufacturing according to organizational guidelines. Work with customer requests, sales vision and emerging technologies to ensure projects fulfill market demand and sales potential. Manage modifications to all design files and documentation. Task status is regularly and formally communicated to project teams Ensure changes follow the ECO process and are documented appropriately. Provide feedback to design engineers on customer problems and needs. Conduct research that tests and analyzes the feasibility, design, operation, and performance of equipment and components, and systems. Recommend design modification to eliminate quality issues. Guide product through the entire design phase, including the transfer from final design samples to implemented production. Other duties as required Process Development Define methodology and present proposals for process improvements. Detail process design improvements to relevant US standards Manage procurement of equipment and jigs and fixtures. Prepare information for quotes for new product and product parts. Plan & manage projects within outlined scope and within acceptable time frames. Contribute to cost down projects Safety Contribute to the provision of a safe work environment. Taking care to protect personal health and safety at work. Ensure not to adversely affect the health and safety of others. Identify and rectify, where possible any hazards in the workplace. Complying with all reasonable instruction and safety using equipment provided. Report any incidents or near misses which may occur. Comply with all Nightforce safety policies and procedures. Quality and Continuous Improvement Actively support and utilize the company's quality system. Continually review work practices and recommend ways that will provide continuous improvement to the organization. Continually improve internal and external customer relations by always conducting all manners of work in a professional manner. Leadership Represent the best interests of the company, through presentation, personal relations, and quality of service in all dealings. Contribute to the productive functioning of the Company through initiative, team cooperation, and quality service.  Note: All job offers are contingent on passing pre-employment requirements, including a drug screen and criminal background check. Due to the nature of our business, applicants must also be a ""US Person"" as defined by the International Traffic in Arms Regulations (ITAR). Our Company is an Equal Opportunity Employer - All qualified applicants will receive consideration for employment without regard to race/ethnicity, color, religion, sex, gender, national origin, age, sexual orientation, gender identity, protected veteran status, disability or any other category protected by law.",software engineer
"About Clearwater Analytics® Clearwater Analytics® is a global SaaS solution for automated investment data aggregation, reconciliation, accounting, and reporting. Clearwater helps thousands of organizations make the most of investment portfolio data with cloud-native software and client-centric servicing. Every day, investment professionals worldwide trust Clearwater to deliver timely, validated investment data and in-depth reporting. Clearwater aggregates, reconciles, and reports on more than $5.5 trillion in assets across many Fortune 500 clients. What you'll be doing: Working on a team alongside other talented developers creating quality software that is used by some of the world's largest technology firms, fixed income asset managers, and security traders on Wall Street Participating in Agile meetings to contribute with development strategies and product roadmap Owning critical processes that are highly available and scalable Producing tremendous feature enhancements and reacting quickly to emerging technologies Encouraging collaboration and stimulating creativity Contributing to design and architectural decisions Providing leadership and expertise to our ever-growing workforce REQUIREMENTS 8+ years professional experience in software development Expertise in designing, developing and improving: Highly scalable and distributed systems Multi tenant applications System performance, durability, and security Experience in implementing and consuming large-scale web services Experience developing public facing API's This position will be based in our Seattle Development Office.",software engineer
"Xylem |ˈzīləm| 1) The tissue in plants that brings water upward from the roots; 2) a leading global water technology company. Xylem, a leading global water technology company dedicated to solving the world’s most challenging water issues, is the leading global provider of efficient, innovative and sustainable water technologies improving the way water is used, managed, conserved and re-used. Our international team is unified in a common purpose: creating advanced technology and other trusted solutions to solve the world’s water challenges. We are committed to creating an organization of inclusion and diversity, where everyone feels involved, respected, valued and connected, and where everyone is free to bring their authentic selves and ideas. If you are excited and passionate about helping us #letssolvewater, we want to hear from you! For more information, please visit us at www.xylem.com. We Offer You More Than Just “A Job” Professional Development – To advance the capabilities of our people, we offer a wide variety of experiences to support our employees’ professional growth and continuous learning. Total Rewards – We offer comprehensive programs for compensation, benefits, recognition, learning and development, work-life integration and corporate citizenship. Watermark – Watermark is our corporate social responsibility program working to provide education and access to safe water to ensure healthy lives, gender equality, and resilient communities. Employees have the opportunity to learn and volunteer on various water-related projects. Employee Networks – Our Employee Networks provide a professional, supportive network for employees from diverse backgrounds, including Women’s, LGBT+ and Allies, Veteran’s, People of Color and Allies, Emerging Leaders, and Working Parents Networks. The Role: Sensus, a Xylem brand, seeks to hire a Principal Software Engineer (UI) who will be responsible for all technical aspects of software solutions running on the Sensus Analytics platform including architecture, design and implementation review. This position will provide technical leadership to multiple engineering teams responsible for collaboratively developing infrastructure and software applications for Sensus’ core smart grid customer facing platform. If you are excited and passionate to work on state-of-the art technology trends like AWS, Big Data platforms and modern Web development technologies, this is the role for you. Essential Duties/Principal Responsibilities: Will be a strong hands-on technical leader and contributor that is responsible for the development of patterns, practices and shared modules used by software engineering teams Is an accomplished Web Application developer that is highly skilled at designing, implementing, testing and deploying elegant reactive single-page Applications (SPA) Is up to date on new technologies and software development practices who can make appropriate tradeoffs in order to deliver high quality Web Applications as rapidly as possible Is a strong user advocate that is passionate about delivering great user experiences and exceptional value to our customers Will be delivering high quality Web Applications in environments where scale, performance, monitoring, reliability and maintainability are core requirements Will mentor Web Application development team members who are on a technical career path and are interested in becoming future technical leads and principal engineers Will provide Web Application architecture, design and implementation direction to multiple engineering teams Will provide operations support for business-critical solutions in the production environment as needed Has excellent written and verbal communication skills Enjoys working in a fast-paced agile team Participation in Xylem Watermark volunteer activities Minimum Qualifications: Education, Experience, Skills, Abilities, License/Certification: BS/MS in Computer Science or equivalent 7+ years of experience in a software development leadership role that successfully delivered several large-scale Web Application projects 5+ years of Web Application development experience building modern reactive single-page applications using technologies such as Angular, JavaScript, HTML, CSS, Node.js and other related technologies Expert level proficiency with the entire Angular eco-system that includes a thorough understanding of the component lifecycle Expert level understanding of data structures, algorithms, component design and overall best implementation practices using JavaScript Expert level understanding of HTML and other Web related standards Experience building developer automation tools to provide consistency across applications and increase productivity using technologies such as Angular Schematics Strong unit and integration testing skills Passionate about creating great software Experience managing Git repositories in continuous integration (CI) environments Preferred Qualifications: Have 2+ years of experience developing back-end services Have experience with online distributed systems and platform infrastructure design and implementation Have experience in databases, analytics, big data systems or business intelligence products Have delivered low-latency, server scale services operating in a 24x7 environment Have experience mentoring and training the engineering community on complex technical solutions Have experience collaborating with a dedicated UX team Physical Demands: (The physical demands described here are representative of those that must be met by an employee to successfully perform the essential functions of this job. Reasonable accommodations may be made to enable individuals with disabilities to perform the essential functions.) Regularly required to sit or stand, reach, bend and move about the facility Work Environment: (The work environment characteristics described here are representative of those an employee encounters while performing the essential functions of this job. Reasonable accommodations may be made to enable individuals with disabilities to perform the essential functions.) Office: Standard office equipment; work usually performed in an office setting free from any disagreeable elements. Standard weekly job hours: 40 hours Xylem is an Equal Opportunity Employer. Employment decisions are made without regard to race, color, religion, national or ethnic origin, sex, sexual orientation, gender identity or expression, age, disability, protected veteran status or other characteristics protected by law.",software engineer
"Infoblox is seeking a Senior Product Manager to join our Service Provider Product team in North America. The ideal Senior Product Manager candidate is one who is passionate about building products that delight Communication Service Providers. The Senior Product Manager will report to the Director, Service Provider Business. You will join a fun and dynamic environment and partner with cross-functional teams to design, build, and roll-out products that deliver the company’s vision and strategy. Also, you're joining a nimble team that values individuality, provides you with a voice, and allows you to determine your own success.  You will have the chance to create a significant impact on the service provider revenue stream. You will have the opportunity to develop relationships with leading Managed Service Providers and Mobile/ Fixed Broadband Carriers around the world to address some of their strategic initiatives and challenges. In this role, you will not only shape Infoblox’s product strategy but also help Service Providers build a secure and flexible network using Infoblox’s latest Security, SaaS, and Virtualization/SDN offerings. We look forward to having you join our team! Responsibilities: Manage the product line life cycle from strategic planning to tactical activities Specify product requirements for current and future products by conducting market research supported by on-going visits to customers and partners Drive a solution set cross-functionally, from market requirements, development, product pricing, positioning, and Go-to-Market Planning Assess market competition by comparing the company's product to competitors' products Provide information for management by preparing short-term and long-term product sales forecasts and special reports and analyses; answering questions and requests Requirements: 8-10 years’ experience in Product Management roles Expertise in networking technologies and architectures Knowledge of networking and security protocols Experience with Network Function Virtualization and SDN technologies Ability to multi-task in a high-pressure, fast-paced, fast-growth environment Strong Communication Skills Education: BS/MS in CS, EE, or equivalent experience It’s an exciting time to be at Infoblox. We are the market leader in technology for network control. Our success depends on bright, energetic, talented people who share a passion for excellence in building the next generation of networking technologies—and having fun along the way. Infoblox offers a fast-paced, action-oriented environment. We promote a culture that embraces innovation, change, teamwork, and strong partnerships. Join the winning Infoblox team—our future looks bright, and so will yours. To check out what it’s like to be a Bloxer, click here. #LI-ME1 #LI-Remote",software engineer
