JobDesc,JobTitle
"Why choose between doing meaningful work and having a fulfilling life? At MITRE, you can have both. That's because MITRE people are committed to tackling our nation's toughest challenges—and we're committed to the long-term well-being of our employees. MITRE is different from most technology companies. We are a not-for-profit corporation chartered to work for the public interest, with no commercial conflicts to influence what we do. The R&D centers we operate for the government create lasting impact in fields as diverse as cybersecurity, healthcare, aviation, defense, and enterprise transformation. We're making a difference every day—working for a safer, healthier, and more secure nation and world. Our workplace reflects our values. We offer competitive benefits, exceptional professional development opportunities, and a culture of innovation that embraces diversity, inclusion, flexibility, collaboration, and career growth. If this sounds like the choice you want to make, then choose MITRE—and make a difference with us. The Aviation Safety & Analysis department is individuals with interest in applying their data science skills to deep and challenging problems in the aviation domain. We have a treasure trove of data including time series, text and sensor data and challenging problems to solve. We are seeking skills in machine learning, deep learning, text mining, big data and software/application development. If Sklearn, pyTorch, Keras,TensorFlow, LSTM, LDA, anomaly detection, entity extraction, summarization mean something to you, we want to talk to you. You are not required to have skills in all of these but should have hands-on skill in at least one area and the ability to dive deep in the data, and learn the necessary skills to get the job done. The candidate will work with the FAA and international customers, leveraging one of the largest repositories of aviation data to improve the capabilities, safety, and efficiency of the aviation system. The candidate will be responsible for supporting a team of more senior AI/ML staff and Data Scientists in the following tasks: Leveraging AI/ML techniques and solutions to identify complex patterns for predicting safety hazards Increasing the efficiency and quality of the vulnerability discovery process by tightly integrating automated processes, AI/ML techniques and human SME/analyst expertise Develop and prototype AI algorithms and software tools. Enhance and maintain current analysis tools, including automation of current processes using AI/ML algorithms. Conduct quantitative data analysis using a variety of datasets, including developing retrieval, processing, fusion, analysis, and visualization of various datasets Develop techniques that make use of both digital flight data, text-based safety reporting, and a variety of other aviation data sets both in a silo and in a fused environment to identify potential safety vulnerabilities Basic Qualifications: Bachelor’s Degree in Computer Science, Mathematics, Statistics, Physics, Electrical Engineering, Computer Engineering or related fields Hands-on Software Development Skills (Python-Preferred) Experience or educational courses/projects in Machine Learning, and/or Text Mining Algorithms. Ability to work closely with Domain experts to develop tools/algorithms needed to answer research questions in their studies Excellent Communication Skills (with the abilty to explain developed tools and ML algorithms to a non-technical audience) Ability to formulate operational problems in aviation domain as technical problems that allows for reuse of leading research in the area. Proven ability to work independently to learn new technologies, techniques, processes, languages, platforms, systems Strong analytic, inferencing, critical thinking, and creative problem-solving skills Self-starter with ability to work both independently and with a team Preferred Qualifications: 1 to 2 years of relevant experience Experience with Deep Learning Frameworks such as Keras, Tensorflow, PyTorch,Mxnet etc. Ability to apply these frameworks to real problems in the ‘time -series’ domain Experience with interpretability of deep learning models Big Data Skills (Hadoop, Spark, recent deep learning platforms) Visualizations/Web Development Skills (e.g. Tableau, MEAN stack - MongoDB, ExpressJS, AngularJS, NodeJS). Practical experience with statistical analysis Experience with text mining tools and techniques including in areas of summarization , search (e.g. ELK Stack) , entity extraction, training set generation (e.g. Snorkel) and anomaly detection Expert software development skills lifecycle including developing and maintain good production quality code This requisition requires the following clearance(s): Suitability - FAA MITRE is proud to be an equal opportunity employer. MITRE recruits, employs, trains, compensates, and promotes regardless of race, religion, color, national origin, gender, gender expression, sexual identity, disability, age, veteran status, and other protected status.  MITRE intends to maintain a website that is fully accessible to all individuals. If you are unable to search or apply for jobs and would like to request a reasonable accommodation for any part of MITRE’s employment process, please contact MITRE’s Recruiting Help Line at 703-983-8226 or email at recruitinghelp@mitre.org. Copyright © 1997-2021, The MITRE Corporation. All rights reserved. MITRE is a registered trademark of The MITRE Corporation. Material on this site may be copied and distributed with permission only.",data scientist
"We’re looking for the best talent to help The General® to bring quality insurance to people who need it the most. Compensation may vary based on the job level and your geographic work location Compensation Minimum:$ 76,440 Compensation Maximum:$ 114,660 Job Description and Responsibilities: We’re looking for the best talent to help The General® to bring quality insurance to people who need it the most. Job Description and Responsibilities: The General is seeking a Associate Data Scientist to join our team! What You'll Do As an Associate Data Scientist, you will be involved first hand with actual data science projects and writing code that matters. You will combine business acumen, creative problem-solving skills, and programming knowledge to drive actionable business insights. You will be an integral team member in a fast-paced environment, handling various tasks and changing priorities, while maintaining a high attention to detail and accuracy. You will be responsible for analyzing results, and making subsequent recommendations based on your findings. Assist in creating predictive models to support business objectives throughout the enterprise. Collect, process, manipulate, and investigate large and complex datasets; preparing the datasets for modeling and exploring new attributes to determine best approaches. Engage with stakeholders to identify and answer questions critical to the business. Learn different modeling approaches and how to apply them to real-world data and capture business insights. Be a quantitative thinker with a passion for robust analytics and applying advanced mathematical and statistical analysis in problem solving. Be an internal thought leader who anticipates problems and opportunities, has the initiative to pursue solutions, and the courage to challenge the status quo. Who You Are The Associate Data Scientist will support The General® in the disciplines of data science, enabling dominance in the Non-Standard automobile insurance market. A successful candidate will be someone who values continual learning through collaborations with other team members and participating in educational opportunities. In addition, they will have: Experience in writing standalone scripts in Python. Experience with various statistical modeling techniques (GLMs, decision trees, survival analysis, hierarchical modeling, clustering). Exposure programming in the scikit-learn ML framework. Exposure setting up comparable test and control groups to evaluate the impact of a machine learning model. The ability to communicate technical subject matter and the results of their analysis to a non-technical audience, verbally and in writing. Minimal Experience At least 1-2 years’ experience in relevant field Bachelor’s degree in Mathematics, Statistics, Engineering, Computer Science, or related field. The Team You’ll Join We are data scientists and machine learning engineers with diverse backgrounds, specialties, and interests. We believe our product is our code. When combined with human intuition and our expertise in statistics, engineering, natural language processing, and economics, that code becomes key in transforming raw ideas into measurable implementations. We create software systems to provide the best possible intelligence, drive change, and dominate the non-standard auto-insurance market. Who We Are We are one of the fastest growing and most exciting companies in the insurance industry to work for today. We’re proud to say we’ve been in the insurance business for over 50 years. Because of our rapid rate of expansion, we’re looking for the best talent to help The General® bring quality insurance to people across the country. Ask any of our employees and they’ll tell you that life at The General is a challenging, fast-paced, exciting experience that offers a competitive total rewards package, healthy work/life balance, and an exciting working environment. You’ll gain crucial insights from your potential coworkers who bring different backgrounds and professional experiences to The General. You’ll also find there are plenty of opportunities for advancement, if you’ve got the ambition. The work culture at The General is one that celebrates diversity, team spirit, and innovation. When you work at The General you can expect benefits that support your physical, emotional, and financial wellbeing. You will have access to comprehensive medical, dental, vision and wellbeing benefits that enable you to take care of your health. We also offer a competitive 401(k) contribution, a pension plan, an annual incentive, and a paid-time off program. In addition, our student loan repayment program and paid-family leave are available to support our employees and their families. Interns and contingent workers are not eligible for American Family Enterprise benefits. Stay connected: Join Our Enterprise Talent Community !",data scientist
"JOB DESCRIPTION The Senior Data Scientist leads analytics or modeling projects, utilizing more than one dataset from multiple business units, identifies new data sources as needed, and presents findings to business stakeholders and process owners. The position may also review analytic models of less experienced data scientists. COMPANY OVERVIEW Nashville, Tenn.-based Bridgestone Americas, Inc. is the U.S. subsidiary of Bridgestone Corporation, the world's largest tire and rubber company. Bridgestone Americas and its subsidiaries develop, manufacture and market a wide range of Bridgestone, Firestone and associate brand tires to address the needs of a broad range of customers, including consumers, automotive and commercial vehicle original equipment manufacturers, and those in the agricultural, forestry and mining industries. The companies are also engaged in retreading operations throughout the Western Hemisphere and produce air springs, roofing materials, and industrial fibers and textiles. The Bridgestone Americas family of companies also operates the world's largest chain of automotive tire and service centers.Guided by its global corporate social responsibility (CSR), commitment 'Our Way to Serve,' Bridgestone embraces its responsibility as a global leader by striving to improve the way people move, live, work and play. RESPONSIBILITIES Job Duties: Builds and validates predictive models of a known issue with some assistance, utilizing large scale data from multiple data sources and ensures adoption of the model. Drives continuous improvement to existing models and reviews other Data Scientists' models. Uses data science techniques to create data-driven solutions for various business use-cases Develops a minimal viable product to meet business needs while resolving any issues that may arise. Analyzes and mines very large quantities of data across a small set of domains in collaboration with other data scientists to find patterns and insights utilizing statistical software. Familiar with project management principles. Writes Python code. Collaborates with other data scientists to analyze potential new data sources for availability and quality, and integrates with existing databases. Performs data cleaning and analysis. Interprets, communicates, and presents analytic results to business stakeholders and process owners. Collaborates with fellow data scientists and periodically interacts with business partners, project managers, and other domains to build analytics capabilities and drive business value. Required Qualifications: Master's degree in a quantitative field including but not limited to data science, analytics, and statistics and 2-3 years of data science experience or bachelor's degree and 3-5 years of data science experience. Experience in one or more of manufacturing, retail operations, new product development, supply chain or marketing research (incl. digital media, subscription packages, market analysis). Ability to work with large data sets from multiple data sources. Basic proficiency in Machine Learning. 2 years of programming experience in statistical software (for example Python, R, or SAS). Some Python experience preferred. Prior experience participating in projects using common project management methodologies e.g., Agile, Waterfall, Six Sigma, Lean. Able to support the building of business cases related to data science related projects. Enjoys working collaboratively with other data scientists and multiple stakeholders across the business unit and with external partners. Able to solve problems and brainstorm options to solution a given problem. Intellectual curiosity, a passion for data and a results orientation. Preferred Qualifications: Prior experience operating and deploying models in cloud environments e.g., AWS & Azure EMPLOYEE TYPE Regular : Full time",data scientist
"JOB DESCRIPTION ** This role can be a remote workforce. The Principal Data Scientist provides technical oversight of the data science department taking the lead on the most strategic and highly complex problems with no initial solution, leading use cases that cross multiple business units or domains. Leads projects from inception through to MVP delivery. Drives analytics best practices and the most up-to-date data science methodology. Provides coaching and guidance to less experienced data scientists. COMPANY OVERVIEW Nashville, Tenn.-based Bridgestone Americas, Inc. is the U.S. subsidiary of Bridgestone Corporation, the world's largest tire and rubber company. Bridgestone Americas and its subsidiaries develop, manufacture and market a wide range of Bridgestone, Firestone and associate brand tires to address the needs of a broad range of customers, including consumers, automotive and commercial vehicle original equipment manufacturers, and those in the agricultural, forestry and mining industries. The companies are also engaged in retreading operations throughout the Western Hemisphere and produce air springs, roofing materials, and industrial fibers and textiles. The Bridgestone Americas family of companies also operates the world's largest chain of automotive tire and service centers.Guided by its global corporate social responsibility (CSR), commitment 'Our Way to Serve,' Bridgestone embraces its responsibility as a global leader by striving to improve the way people move, live, work and play. RESPONSIBILITIES Job Duties: Builds and validates predictive models of high risk/reward or ambiguous problems with no initial solution utilizing large scale data from multiple data sources and methodologies. Ensures adoption of the model and reviews other Data Scientists' models. Serves as a thought leader and strategic partner to cross functional leaders in broad areas including but not limited to environmental/sustainability initiatives, new revenue model development & design of new mobility solutions Uses data science and analytical techniques to create data-driven solutions for various business use-cases Solves complex, strategic issues using data science methodologies across multiple business units or domains. Leads projects with external partners to develop a minimal viable product to meet those needs while resolving any issues that may arise. Leads the analysis and mining of very large quantities of data with expertise in several domains to find patterns and insights utilizing statistical software Adept with project management principles. Writes Python code in on prem or cloud solutions within Bridgestone’s environment. Leads the development data science standards for the department. Creates taxonomies, models, standards and processes around DS in the organization Contributes to the organization's data strategy and influences the data roadmap. Leads the efforts to find new data sources or leveraging existing data sources and works with business partners to bring them into the data stack. Interprets, communicates, and presents analytic results to C-Level executives and below Consistently collaborates with fellow data scientists and frequently interacts with business partners, project managers, cross-functional teams, key stakeholders, and other domains to generate ideas/hypotheses, test hypotheses, build analytics capabilities and drive business value. Mentors and assists in technically supervising less experienced Data Scientists. Guides the formulation of individual development plans for the Data Scientists. Leads best practice sharing opportunities and knowledge of industry trends and innovations in data science. Analyzes D&A ecosystem to highlight areas for growth and M&A opportunities. Required Qualifications: PhD degree in a quantitative field including but not limited to data science, physics, computer science, math, engineering, and statistics and 7+ years of data science experience (Or Master’s Degree with 10+ years’ experience). Experience in two or more of manufacturing, retail operations, new product development, supply chain or marketing research (incl. digital media, subscription packages, market analysis). Prior experience leading/working on large scope/macro initiatives or research such as those impacting broader sustainability/environmental and societal factors e.g., green procurement, reducing emissions, waste reduction Able to work with large data sets from multiple data sources (text, speech, images, structured, unstructured). 10 years of programming experience in statistical software (for example Python, R, or SAS) and able to demonstrate proficiency at an expert level. At least 3 years’ experience with Python within the last 5 years. Optimization and Simulation experience Experience working in large and complex projects using common project management methodologies e.g., Agile, Waterfall, Six Sigma, Lean Able to build or support the building of business cases related to data science related projects. Enjoys working collaboratively with other data scientists and multiple stakeholders across the business unit and with external partners. Confident in creating and communicating standards and best practices for data science projects and deliverables including setting project reviews and general quality assurance practices to review the work of more junior data scientists. Adept at effectively solving complex problems by breaking them down into logical steps and communicating results in a concise way to Senior Executives and able to defend/debate the results of the analyses. Intellectual curiosity, a passion for data and a results orientation. Enjoys mentoring, training and coaching other data scientists and analysts Preferred Qualifications: Expertise in Machine Learning in auto or related industries (incl. image, speech, pattern recognition & anomaly detection) – SciKit-Learn, TensorFlow or PyTorch, Pandas, NumPy Expertise operating and deploying models in cloud environments e.g., AWS, Azure, collaborating with IT, Data Engineers, ML Engineers. Experience with distributed computing (Spark/MLLib) Experience in software development processes including Dev/QA/prod, release cycles, Continuous Improvement/ Continuous Development, source control, code reviews etc. Experience in IoT and streaming data analytics EMPLOYEE TYPE Regular : Full time",data scientist
