JobDesc,JobTitle
"We are a hard-working group building SaaS products to deliver the future of cloud security and governance. We live and breathe distributed systems, horizontally scaled microservice architectures, graph data models, security-focused data analytics and data science, cloud services, and high availability designs all with integrated instrumentation and logging. We are seeking capable problem solvers and critical thinkers with growth mindsets to join our team. Our team is growing and you will have the opportunity to define your role within the team. While we have a high bar for quality and performance, we also expect our work to be balanced, fun and fulfilling.You will help identify your tasks based on project requirements and needs, and then propose and implement solutions. You will participate in design and architecture discussions. We will expect you to have opinions and/or suggestions for project direction. Your development work will include instrumentation, health checks, unit tests, documentation and end-to-end tests where appropriate. We will review your code through pull requests prior to merge within the project. We need you to be able to explain and support your implementation decisions as well as explain application and business logic based on your written code. We will grow together as a tight-knit team, celebrating our successes and learning from our failures. Your ongoing professional development is a key component of your job.Responsibilities: You will provide oversight, guidance and technical leadership for our UI team(s) You will guide the design and implementation of authentication and authorization services You will guide the design and implementation of public facing API services for UI and CLIs You will guide best practices for UI testing You will guide best practices for UI architecture, framework utilization, and code reuse In addition to leadership responsibilities, you will continue as a high impact individual contributor Requirements: Expert knowledge of Angular and Clarity frameworks Expert knowledge of Authentication protocols and services Expert knowledge of Authorization fundamentals and architectures Expert knowledge of RESTful API design and implementation Experience with horizontal scale of data services Experience writing code to interface with databases You have 10+ years experience in some or all of these programming languages: Git, Node, Go, Ruby, Python, GraphQL or Bash You have significant experience with some or all of these technologies: AWS, Azure, ElasticSearch, Mongo, Redis, Postgres, Dynam  Category : Engineering and Technology Subcategory: Software Engineering Experience: Business Leadership Full Time/ Part Time: Full Time Posted Date: 2021-02-28  VMware Company Overview: At VMware, we believe that software has the power to unlock new opportunities for people and our planet. We look beyond the barriers of compromise to engineer new ways to make technologies work together seamlessly. Our cloud, mobility, and security software form a flexible, consistent digital foundation for securely delivering the apps, services and experiences that are transforming business innovation around the globe. At the core of what we do are our people who deeply value execution, passion, integrity, customers, and community. Shape what’s possible today at http://careers.vmware.com.  Equal Employment Opportunity Statement: VMware is an Equal Opportunity Employer and Prohibits Discrimination and Harassment of Any Kind: VMware is committed to the principle of equal employment opportunity for all employees and to providing employees with a work environment free of discrimination and harassment. All employment decisions at VMware are based on business needs, job requirements and individual qualifications, without regard to race, color, religion or belief, national, social or ethnic origin, sex (including pregnancy), age, physical, mental or sensory disability, HIV Status, sexual orientation, gender identity and/or expression, marital, civil union or domestic partnership status, past or present military service, family medical history or genetic information, family or parental status, or any other status protected by the laws or regulations in the locations where we operate. VMware will not tolerate discrimination or harassment based on any of these characteristics. VMware encourages applicants of all ages. Vmware will provide reasonable accommodation to employees who have protected disabilities consistent with local law.",software engineer
"Company Overview iboss is a cloud security company that provides organizations and their employees secure access to the Internet on any device, from any location, in the cloud. This eliminates the need for traditional security appliances, which are ineffective at protecting a cloud-first and mobile world. Leveraging a purpose-built cloud architecture backed by over 190 issued and pending patents and more than 100 points of presence globally, iboss protects more than 4,000 organizations worldwide. The Company is headquartered in Boston, MA, and has operations in Orlando, San Diego, London, and the Philippines. At iboss, we believe that exceptional employees are the key to our success. Our teams are hands on, diverse, nimble, and highly empowered to drive excellence. Come be a part of the team that will transform the way cybersecurity is delivered! Job Description  As a Java Spring Developer at iboss, you will have the opportunity to work on multiple technologies. Our development scope extends from device specific driver, service, and communication protocols to cloud scalable connectivity and big data processing through third-party analytics tool integration and customer enterprise UI creation for security policy management. The pace is fast. The process is agile. This is an excellent opportunity to become a leading member of a rapidly growing software development team. There are many exciting projects on which to work. iboss software developers excel at solving tough problems, collaborating well, and working with customer teams to rapidly deploy solutions. Responsibilities Ability to design excellent, scalable, sustainable software systems, and components Quickly understand and extend engineering architectural patterns Independently solve tough software problems Document engineering designs and prioritize architectural and non-functional requirements Analyze and estimate development efforts Deliver high quality code that has been thoroughly tested Qualifications 3+ years of software development experience with modern Java stack: Java 11, Spring, Spring Boot, Hibernate ORM, JPA, JDBC, FlywayDB Strong analytical capability and record of independent contributions Must have a good sense of engineering tradeoffs, within the contexts of extendibility, scalability, performance, and maintainability Working knowledge of database technologies and SQL, especially PostgreSQL Experience with OO design and design patterns Comfortable working on a Unix environment Experience working in an Agile environment. Team player with excellent interpersonal skills and the ability to work in a fast-paced environment Demonstrate excellent oral and written communication skills with the ability to listen, articulate, facilitate and advocate Benefits Health, Vision, Dental, Chiropractic - open to domestic partners 401K with company match Paid Time Off (PTO) Company paid holidays Optimistic, supportive, and fun work environment Fantastic quarterly company events The duties and responsibilities described above are essential functions of the job. All qualified applicants will receive consideration for employment without regard to race, color, religion, sex, sexual orientation, gender identity, national origin, status as a veteran or as an individual with a disability. This position is not eligible for sponsorship of work visas",software engineer
"Job Description VMware’s Office of the CTO (OCTO) is responsible for leading research and development across VMware in order to build upon our 20 year history of innovation and disruption. The group has dual goals of ensuring VMware’s technical future as well as advancing the state of the field; focusing on both internal impact on the Company and external impact on the R&D community. OCTO operates an InnerSource Program Office which helps to promote the inner source practice within VMware to increase reusability and quality of the code, shorten projects’ time to market and drive innovation through collaboration between teams. This initiative will include outreach and community building across the company, helping to define the onboarding processes, working with teams to onboard, defining success metrics, and tracking progress on metrics. We are seeking an experienced architect with a strong development background, who will design and ensure engineering best practice for InnerSource projects.  Responsibilities: Ensure consistency and engineering best practice across all the projects. Use your open source experience on what makes a well-run and collaborative project to make InnerSource projects successful. Work with the project teams to resolve technical issues or obstacles to InnerSource their projects. Provide technical advice and support to InnerSource projects. Work with the InnerSource Program Manager and core team to evangelize and promote the InnerSource program. Work with engineering teams, managers, and executives to promote the use of InnerSource and help remove any barriers to adoption. Analyze, architect, and implement tooling necessary for onboarding and discovery of projects, along with metrics gathering to track and analyze success of the program.  Requirements BS or above in Computer Science or equivalent. 6-10+ years of industry work experience and hands-on development. Significant experience working with multiple modern languages such as Golang, Python, and Java. Familiar with common development processes, methodologies, and collaboration tools. Familiar with multiple language toolchains and ecosystems. Experience with participation in the open source community and contributing to open source projects. Leading and/or architecting experience on software development projects. Experienced in cloud native technologies such as containers and Kubernetes.  Nice to have: Experience working on internal InnerSource projects or programs. Experience working with globally distributed teams. Experienced in building and designing solutions based on VMware and advanced technology products.  Category : Engineering and Technology Subcategory: Software Engineering Experience: Business Leadership Full Time/ Part Time: Full Time Posted Date: 2021-03-04  VMware Company Overview: At VMware, we believe that software has the power to unlock new opportunities for people and our planet. We look beyond the barriers of compromise to engineer new ways to make technologies work together seamlessly. Our cloud, mobility, and security software form a flexible, consistent digital foundation for securely delivering the apps, services and experiences that are transforming business innovation around the globe. At the core of what we do are our people who deeply value execution, passion, integrity, customers, and community. Shape what’s possible today at http://careers.vmware.com.  Equal Employment Opportunity Statement: VMware is an Equal Opportunity Employer and Prohibits Discrimination and Harassment of Any Kind: VMware is committed to the principle of equal employment opportunity for all employees and to providing employees with a work environment free of discrimination and harassment. All employment decisions at VMware are based on business needs, job requirements and individual qualifications, without regard to race, color, religion or belief, national, social or ethnic origin, sex (including pregnancy), age, physical, mental or sensory disability, HIV Status, sexual orientation, gender identity and/or expression, marital, civil union or domestic partnership status, past or present military service, family medical history or genetic information, family or parental status, or any other status protected by the laws or regulations in the locations where we operate. VMware will not tolerate discrimination or harassment based on any of these characteristics. VMware encourages applicants of all ages. Vmware will provide reasonable accommodation to employees who have protected disabilities consistent with local law.",software engineer
"C# Developer duties and responsibilities Design, build, and maintain efficient and reliable C# code Ensure the best possible performance, quality, and responsiveness of applications Identify bottlenecks and bugs, and devise solutions to these problems Participate as a team member in fully agile Scrum deliveries Provide support to product implementation team Job Description: We are looking for a strong C# developer to join our team As a Developer with good understanding of C# programming language and experience in developing applications/products for client-server desktop and browser based web applications C# Developer Requirements: B.E / BTech / MCA 3 to 7 years of software development experience Proficient in C#.Net, with a good knowledge of its ecosystems Experience with HTML, JavaScript and web development frameworks (AngularJS, Bootstrap, jQuery) Familiarity with Relational Databases [SQL SERVER] and SQL Experience with Web services development (WCF, SOAP, REST) Proficient understanding of code versioning tools GIT,SVN Exposure of WPF, MVVM, MVC and Design patterns",software engineer
"What is primary need, technical challenge, and/or problem you will be responsible for? Workspace ONE is a digital workspace platform that simply and securely delivers and manages any app on any device by integrating access control, application management and multi-platform endpoint management. Our goal is to enable Workspace One platform to scale and manage billions of devices across various operating system platforms and enable seamless experiences through IT orchestration. As part of the UEM Platform team you will be involved in writing code, design and development of scalable software targeting to expanding our service capabilities across product portfolios. You will be owning engineering initiatives and champion a culture of high ownership, continuous improvement, and engineering excellence. Success in the Role: What are the performance goals over the first 6-12 months you will work toward completing? You will need to produce software and service design and implementation for distributed web systems You will be regularly evaluated on the quality of the product you create and the code you write to ensure continued advancement of your technical skills in an environment that looks to expand them. You will work collaboratively work across other teams You will contribute to the definition and enforcement of engineering standards and best practices  What type of work will I be doing? What assignments or requirements will I be performing on a regular basis? What are my deliverables? You will participate and drive processes around DevOps, Agile, and CI/CD You will contribute on Workspace ONE platform, responsible for hosting distributed microservices. You will develop applications using Kafka, micro-services, and other cloud design patterns You care and have strong RESTful API design, including API versioning, backwards compatibility, authentication and rate limiting. You will be building data and orchestration platforms that span multiple services/products. You will be engaged in design and implementation of tools/services that deploy distributed services on VMware platforms. You will design software and write code in Java/Python, with the potential need to contribute to existing services built in C# What are the benefits and perks of working at VMware? You and your loved ones will be supported with a competitive and comprehensive benefits package. Below are some highlights, or you can view the complete benefits package by visiting www.benefits.vmware.com. Employee Stock Purchase Plan Medical Coverage, Retirement, and Parental Leave Plans for All Family Types Generous Time Off Programs 40 hours of paid time to volunteer in your community Rethink’s Neurodiversity program to support parents raising children with learning or behaviour challenges, or developmental disabilities Financial contributions to your ongoing development (conference participation, trainings, course work, etc.) Healthy and local inspired snacks in all our pantries  Category : Engineering and Technology Subcategory: Software Engineering Experience: Manager and Professional Full Time/ Part Time: Full Time Posted Date: 2021-04-21  VMware Company Overview: At VMware, we believe that software has the power to unlock new opportunities for people and our planet. We look beyond the barriers of compromise to engineer new ways to make technologies work together seamlessly. Our cloud, mobility, and security software form a flexible, consistent digital foundation for securely delivering the apps, services and experiences that are transforming business innovation around the globe. At the core of what we do are our people who deeply value execution, passion, integrity, customers, and community. Shape what’s possible today at http://careers.vmware.com.  Equal Employment Opportunity Statement: VMware is an Equal Opportunity Employer and Prohibits Discrimination and Harassment of Any Kind: VMware is committed to the principle of equal employment opportunity for all employees and to providing employees with a work environment free of discrimination and harassment. All employment decisions at VMware are based on business needs, job requirements and individual qualifications, without regard to race, color, religion or belief, national, social or ethnic origin, sex (including pregnancy), age, physical, mental or sensory disability, HIV Status, sexual orientation, gender identity and/or expression, marital, civil union or domestic partnership status, past or present military service, family medical history or genetic information, family or parental status, or any other status protected by the laws or regulations in the locations where we operate. VMware will not tolerate discrimination or harassment based on any of these characteristics. VMware encourages applicants of all ages. Vmware will provide reasonable accommodation to employees who have protected disabilities consistent with local law.",software engineer
"This role is fully remote and can be done anywhere in AL, AZ, CA, CO, ID, IL, IA, KS, LA, MN, MS, MO, MT, NV, NE, ND, OK, OR, SD, TN, TX, UT, WA, WI, WY. Senior Member of Technical Staff/Software Engineer – SaaS Commerce Platform The Elevator Pitch: Why will you enjoy this new opportunity? VMware CFE Engineering team is building an industry leading SaaS commerce platform at cloud scale. This platform will be horizontally scalable, highly available, and will cater to current and future SaaS product go to market strategies. What is primary need, technical challenge, and/or problem you will be responsible for? How do you design and handle commerce transactions at high scale when you know that none of the ""textbook solutions"" will work? We are looking for someone who would be interested in staying ahead of technology and strive to learn latest cloud technologies. As a Senior Member of Technical Staff, you will design, implement and own key microservices for SaaS commerce platform. Come and help make history as we change the way an enterprise pivots to Subscription and SaaS.  Success in the Role: What are the performance goals over the first 6-12 months you will work toward completing? You will design and implement critical microservices for the commerce platform. You will own a component of product and ensure its production readiness. You will be working on cutting edge cloud technologies. What would you need to be successful in this role? 8+ years of software development experience Solid background in OOP, Object and data modeling Deep working knowledge of Java, Spring You feel comfortable writing software on one or more programming languages such as Java and Go. You are familiar with Microservices Architecture. Understanding of domain driven design. Working knowledge of NOSQL and relational database (Oracle, MYSQL) Working knowledge of software engineering principles, design patterns, and commercial product development practices Must have the ability to work in an agile development environment Use of Open-Source packages for common capabilities (e.g., log4j, Quartz, ActiveMQ) Knowledge of Spring Framework, Spring MVC, spring boot and Hibernate / JPA Knowledge of cloud foundry, Kubernetes, dockers Working knowledge on CD/CI DevOps processes Strong communication Skills You are self-starter and enthusiastic personality. You are able to work well both independently and as a team member. You will collaborate with product teams in defining product. You will collaborate with other engineers and ensure best engineering practices are followed in software development.  What are the benefits and perks of working at VMware? You and your loved ones will be supported with a competitive and comprehensive benefits package. Below are some highlights, or you can view the complete benefits package by visiting www.benefits.vmware.com. Employee Stock Purchase Plan Medical Coverage, Retirement, and Parental Leave Plans for All Family Types Generous Time Off Programs 40 hours of paid time to volunteer in your community Rethink's Neurodiversity program to support parents raising children with learning or behavior challenges, or developmental disabilities Financial contributions to your ongoing development (conference participation, trainings, course work, etc.) “This job requisition is not eligible for employment-based immigration sponsored by VMware.”  Category : Engineering and Technology Subcategory: Software Engineering Experience: Manager and Professional Full Time/ Part Time: Full Time Posted Date: 2021-04-15  VMware Company Overview: At VMware, we believe that software has the power to unlock new opportunities for people and our planet. We look beyond the barriers of compromise to engineer new ways to make technologies work together seamlessly. Our cloud, mobility, and security software form a flexible, consistent digital foundation for securely delivering the apps, services and experiences that are transforming business innovation around the globe. At the core of what we do are our people who deeply value execution, passion, integrity, customers, and community. Shape what’s possible today at http://careers.vmware.com.  Equal Employment Opportunity Statement: VMware is an Equal Opportunity Employer and Prohibits Discrimination and Harassment of Any Kind: VMware is committed to the principle of equal employment opportunity for all employees and to providing employees with a work environment free of discrimination and harassment. All employment decisions at VMware are based on business needs, job requirements and individual qualifications, without regard to race, color, religion or belief, national, social or ethnic origin, sex (including pregnancy), age, physical, mental or sensory disability, HIV Status, sexual orientation, gender identity and/or expression, marital, civil union or domestic partnership status, past or present military service, family medical history or genetic information, family or parental status, or any other status protected by the laws or regulations in the locations where we operate. VMware will not tolerate discrimination or harassment based on any of these characteristics. VMware encourages applicants of all ages. Vmware will provide reasonable accommodation to employees who have protected disabilities consistent with local law.",software engineer
