JobDesc,JobTitle
"Statistical Genetic Analyst 2104415 Job Research Primary Location TN-Nashville-2525 West End Ave Organization NP Lab 310 104439 Shift First Shift  Statistical Genetic Analyst Division of Nephrology Job Summary: Statistical analyst who will independently and/or as a member of a research team contribute to the statistical and statistical programming aspects of multiple genetic epidemiological research projects. The research seeks to identify the genomic underpinnings of common complex diseases, with an emphasis on kidney and cardiovascular disease. Department Summary: The Division of Nephrology and Hypertension at Vanderbilt University Medical Center has a long and notable history of studying the pathophysiology of and developing potential therapies for the prevention and treatment of kidney disease. With over 70 active faculty comprised of innovative, internationally recognized basic and clinical researchers and active clinicians working in state-of-the-art facilities, our contributions are validated through high-impact publications, strong federal and non-federal grant funding, and a robust clinical program that provides cutting-edge comprehensive care across the spectrum of kidney disease. View how Vanderbilt Health employees celebrate the difference they make every day: Discover Vanderbilt University Medical Center: Located in Nashville, Tennessee, and operating at a global crossroads of teaching, discovery and patient care, VUMC is a community of individuals who come to work each day with the simple aim of changing the world. It is a place where your expertise will be valued, your knowledge expanded and your abilities challenged. It is a place where your diversity — of culture, thinking, learning and leading — is sought and celebrated. It is a place where employees know they are part of something that is bigger than themselves, take exceptional pride in their work and never settle for what was good enough yesterday. Vanderbilt’s mission is to advance health and wellness through preeminent programs in patient care, education, and research. VUMC Recent Accomplishments Because we are committed to providing the best in patient care, education and research, we are proud of our recent accomplishments: US News & World Report: #1 Adult Hospital in Tennessee and metropolitan Nashville, named to the Best Hospitals Honor Roll of the top 20 adult hospitals, 10 nationally ranked adult specialty programs, with 3 specialties rated in the top 10 nationally, Monroe Carell Jr. Children’s Hospital at Vanderbilt named as one of the Best Children’s Hospital in the nation, with 10 out of 10 pediatric specialties nationally ranked. Healthcare’s Most Wired: Among the nation’s 100 “most-wired” hospitals and health systems for its efforts in innovative medical technology. Becker’s Hospital Review: named as one of the “100 Great Hospitals in America”, in the roster of 100 Hospitals and Health Systems with Great Oncology Programs and to its list of the 100 Hospitals with Great Heart Programs. The Leapfrog Group: One of only 10 children’s hospitals in the to be named at Leapfrog Top Hospital. American Association for the Advancement of Science: The School of Medicine has 112 elected fellows Magnet Recognition Program: Received our third consecutive Magnet designations. National Academy of Medicine: 22 members, elected by their peers in recognition of outstanding achievement Human Rights Campaign Healthcare Equality Index: 6th year in a row that Vanderbilt University Medical Center was a Leader in LGBTQ Healthcare Equality. Responsibilities will include: Develop and/or apply bioinformatics tools to process, analyze and interpret large genomic and phenomic datasets. Apply statistical knowledge to draw rigorous conclusions from complex data sets. Communicate findings internally and externally by describing results through graphic visualizations, drafting manuscripts and giving oral presentations. Take initiative and acquire new statistical or programming skills as needed. Additional information: This is a full-time position Salary is dependent upon education and experience  Bachelor's Degree (or equivalent experience) and < 1 year experience Strongly Preferred: Master’s degree in biostatistics, epidemiology, bioinformatics, genetics, computer science or data-science related field. Proficiency using R and modeling procedures in the Unix and Linux environments. Proficiency in creating, modifying and maintaining Unix scripts (shell/perl/python) to perform database management and statistical analysis in parallel. Familiarity with statistical genetics software packages, e.g. PLINK, LOCUSZOOM and METAL Familiarity and experience with Mendelian Randomization theory and application.   Physical Requirements/Strengths needed & Physical Demands: Movement Occasional: Sitting: Remaining in seated position Occasional: Standing: Remaining on one's feet without moving. Occasional: Walking: Moving about on foot. Occasional: Lifting under 35 lbs: Raising and lowering objects under 35 lbs from one level to another Occasional: Push/Pull: Exerting force to move objects away from or toward. Occasional: Bending/Stooping: Trunk bending downward and forward by bending spine at waist requiring full use of lower extremities and back muscles Occasional: Reaching below shoulders: Extending arms in any direction below shoulders. Occasional: Handling: Seizing, holding, grasping, turning or otherwise working with hand or hands.  Sensory Occasional: Vision: Clarity of near vision at 20 inches or less and far vision at 20 feet or more with depth perception, peripheral vision, color vision. Frequent: Noise: May include exposure to occupational noise levels which equal or exceed an 8-hr time-weighted average of 85 decibels, requiring enrollment in VUMC's Hearing Conservation Program which includes training, use of hearing protection, and periodic audiometry. Continuous: Communication: Expressing or exchanging written/verbal/electronic information.",data scientist
"Job Summary: The primary purpose of this role is to provide advanced analytical capabilities to support data science initiatives. This role builds user interfaces from the direction of senior colleagues, and builds solutions using market research. Areas of focus are: predictive modeling; personalization and recommendation algorithms; natural language processing and text mining; search recall, precision, ranking, and related problems; optimization and mathematical programming with applications in labor scheduling, inventory and capacity planning, network flows, and supply chain optimization.  Key Responsibilities: Mines and extracts data and applies statistics and algorithms necessary to derive insights for Lowe\'s and Lowe\'s Digital Supports the generation of an automated insights generation framework for Lowe\'s business partners to effectively interpret data Provides actionable insights through data science on Personalization, Search & Navigation, SEO & Promotions, Supply Chain, Services, other company priorities, etc. Tracks success of Lowe\'s through the development of dashboard reports that measure financial results, customer satisfaction, and engagement metrics Conducts deep statistical analysis, including predictive and prescriptive modeling in order to provide a competitive advantage at Lowe\'s Maintains expert-level knowledge on industry trends, emerging technologies, and new methodologies and applies it to projects as well as using it to guide team members Serves as a leading member on automation and analytical projects, collaborating across functions in Lowe\'s and Lowe\'s Digital Works with more senior level scientists on the team to translate requirements into an analytical approach; asks the right questions to understand the problem Contributes to, or builds the analytic approach to solving a business problem; helps identify the sources, methods, parameters, and procedures to be used; may also communicate with stakeholders on project scope and timelines Gathers and assimilates data according to the project plan; works with the team to discuss analysis and findings Prepares final recommendations, ensuring solutions are implementable in the business Executes plan for measuring impact based on discussions with stakeholders, partners and senior team members Executes projects with full adherence to enterprise project management practices by participating in formal and informal training Maintains knowledge of techniques, technology, industry trends, best practices, and emerging methodologies  Minimum Qualifications: Bachelor\'s degree in Mathematics, Statistics, Physics, Economics, Engineering, Computer Science, Data or Information Science, or related quantitative analytic field AND 2 years of experience in analytics AND 1 year of programming experience (Python, Java, Scala, Rust, etc.) OR Master\'s degree in Mathematics, Statistics, Physics, Economics, Engineering, Computer Science, Data or Information Science, or related quantitative analytic field AND 1 year of experience in analytics OR Ph.D. in Mathematics, Statistics, Physics, Economics, Engineering, Computer Science, Data or Information Science, or related quantitative analytic field ALSO Knowledge of SQL and various statistical modeling or machine learning techniques  Preferred Qualifications: In most cases Lowe’s will not be able to provide sponsorship for roles located in the Technology Hub Master\'s degree in Mathematics, Statistics, Physics, Economics, Engineering, Computer Science, Data or Information Science, or related quantitative analytic field Experience in performing predictive analytics in a large scale enterprise 2 years of experience in data science or advanced analytics in industry SQL Experience Programming experience (Python, Java, Scala, Rust, etc.) Experience using multiple data systems and sources (such as Hadoop, Spark, Aster, Teradata, etc.)  About Lowe’s: Lowe’s Companies, Inc. (NYSE: LOW) is a FORTUNE® 50 home improvement company serving approximately 20 million customers a week in the United States and Canada. With fiscal year 2020 sales of nearly $90 billion, Lowe’s and its related businesses operate or service more than 2,200 home improvement and hardware stores and employ over 300,000 associates. Based in Mooresville, N.C., Lowe’s supports the communities it serves through programs focused on creating safe, affordable housing and helping to develop the next generation of skilled trade experts. For more information, visit Lowes.com.  About Lowe’s in the Community: As a FORTUNE® 50 home improvement company, Lowe’s is committed to creating safe, affordable housing and helping to develop the next generation of skilled trade experts through nonprofit partnerships. Across every community we serve, Lowe’s associates donate their time and expertise through the Lowe’s Heroes volunteer program. For the latest news, visit Newsroom.Lowes.com or follow @LowesMedia on Twitter.  Lowe’s is an equal opportunity employer and administers all personnel practices without regard to race, color, religious creed, sex, gender, age, ancestry, national origin, mental or physical disability or medical condition, sexual orientation, gender identity or expression, marital status, military or veteran status, genetic information, or any other category protected under federal, state, or local law.",data scientist
"Description Introduction Do you want to join an organization that invests in you as a(an) Statistical Programmer? At Sarah Cannon, you come first. HCA Healthcare has committed up to $300 million in programs to support our incredible team members over the course of three years. Benefits At Sarah Cannon, we want to ensure your needs are met. We offer eligible colleagues an attractive benefit package that includes medical, wellbeing, dental and vision benefits along with some unique benefits including: Medical, Dental, Vision, Life Insurance and Flexible Spending Paid Time Off (PTO) and Personal Leave 401K (100% annual match - 3% to 9% of pay based on years of service) Academic Assistance and Reimbursements for Tuition and Student Loans Employee Discounts including Tickets, Retail, Mental Health Apps, Education Apps, Identity Theft Protection etc. Home, Auto, and Pet Insurance Employee Stock Purchase Program (ESPP) Short Term & Long Term Disability coverage Adoption Assistance Legal Benefits and lots more! Learn more about Employee Benefits You contribute to our success. Every role has an impact on our patients’ lives and you have the opportunity to make a difference. We are looking for a dedicated Statistical Programmer like you to be a part of our team. Job Summary and Qualifications Summary of Position: This position is responsible for statistical programming of Sarah Cannon clinical trials data. Duties and Responsibilities: You are responsible for the translation of the SAP into programming specifications for analysis data model (ADaM) datasets, creating and reviewing annotated CRF to SDTM datasets You will review and provide input on key study-related documents produced by other functions, such as case report forms, data management plans, statistical analysis plans, and TFL specifications You are responsible for the development, review, validation, and execution of SAS programs to generate standard (SDTM and ADaM) and non-standard (custom study specific) datasets as defined in specifications documents You are responsible for the development, review, validation, and execution of SAS programs to generate presentation-ready outputs (i.e., Tables, Figures, and Listings), as defined in the statistical analysis plan You will program the integration of databases from multiple studies or sources You are responsible for accuracy and reliability of results. Builds and monitors quality in every aspect of job activities For this position, you must have: Bachelor’s College Degree (4 year program) 1-3 years of statistical programming in a clinical trial environment (i.e. pharmaceutical, biotechnology, and/or contract research organization industries) Experience programming and reporting with Base SAS, SAS/Macro, SAS/STAT, SAS Language, SAS/ODS and SAS/Graph It is preferred that you have: Master’s Degree (1-2 year program) Understanding of FDA/ICH guidelines Experience with industry data standards, such as CDISC/SDTM, ADaM data models. Strong knowledge in the creation/production of tables, figures and listings (TFLs) Oncology experience Sarah Cannon is the Cancer Institute of HCA Healthcare. We offer integrated cancer services with easy access to cutting-edge therapies for communities across the United States and United Kingdom. Sarah Cannon’s cancer programs include individualized patient navigation. Our nurses are oncology-trained. More than 1,200 stem cell transplants are performed yearly within the Sarah Cannon Blood Cancer Network. Through its services, Sarah Cannon provides state-of-the-art cancer care for hundreds of thousands of patients. Our cancer experts are collaborating and sharing best practices. We address every aspect of the cancer journey, from screening and diagnosis through treatment and survivorship. HCA Healthcare has been named one of the World's Most Ethical Companies by Ethisphere Institute for over a decade. In recent years, HCA Healthcare spent an estimated $3.7 billion in cost for the delivery of charitable care, uninsured discounts, and other uncompensated expenses. ""Good people beget good people.""- Dr. Thomas Frist, Sr. HCA Healthcare Co-Founder We are a family 270,000 dedicated professionals! Our Talent Acquisition team is reviewing applications for our Statistical Programmer opening. Qualified candidates will be contacted for interviews. Submit your resume today to join our community of caring! We are an equal opportunity employer and value diversity at our company. We do not discriminate on the basis of race, religion, color, national origin, gender, sexual orientation, age, marital status, veteran status, or disability status.",data scientist
"Description: S&H Systems is a single-source, full-service systems integration company delivering dependable material handling systems, software, and post-sale support since 2002. The strategic planning department is charged with setting company priorities, focusing energy and resources to strengthen operations, ensuring employees and other stakeholders are working toward common goals, establishing agreement around intended outcomes/results, and assess and adjust the organization’s direction in response to a changing environment. We are seeking qualified candidates to effectively interpret data and turn the information into evidence that can offer ways to improve a business and guide business decisions. Successful candidates will have a background in gathering information from various sources and interpreting patterns and trends. The Data Analyst will report back what has been found in a comprehensive study to the wider business/relevant colleagues. This position will often make recommendations about the methods and ways in which a company obtains and analyses data to improve the quality and the efficiency of data systems. Other responsibilities include, but not be limited to: Collecting and interpreting data and analyzing results Reporting the results back to the relevant team members Identifying patterns and trends in data sets Working alongside coworkers within the business/management team to establish business needs Translate business requirements into data models (conceptual, logical, and physical) Work with Data Analysts to extract, track and report data Create data/analysis/decision models using best practices to ensure high data quality Optimize, update, and continually improve data models using best practices Create ad-hoc analysis/decision models to support business operations and ongoing/new projects . Requirements: BASIC QUALIFICATIONS Bachelor’s degree in either Mathematics, Computer Science, Statistics, and/or Economics Experience in data models and reporting packages Proficient in data modeling using a variety of tools and techniques (mixed-integer programming, cluster analysis, statistical modeling, etc.) Ability to analyze large datasets and write comprehensive reports Strong verbal and written communication skills An analytical mind and inclination for problem-solving as well as attention to detail PREFERED QUALIFICATIONS Experience in developing mathematical and data models and reporting packages Ability to analyze large datasets Coding skills in languages/tools such as SQL, Python, R",data scientist
"PhD or equivalent Master's Degree plus 4+ years of experience in CS, CE, ML or related field 5+ years of experience of building machine learning models for business application Experience programming in Java, C++, Python or related language Master’s degree in Statistics, Mathematics or related field, or equivalent experience. A strong ability in statistical modeling and analysis to provide rigorous solutions that address business needs. Excellent data visualization and written communication skills to translate complex models and analysis results into layman terms. Hands on development experience in C++, Java, or other OOP language. Experiencing with programming in R, MATLAB, Python or similar scripting languages. Experience with data visualization technologies, including interactive visualization (i.e. D3js, Bokeh, Matplotlib, FusionCharts, or HighCharts). Knowledge of Information Retrieval theory and practice. At Amazon, we're working to be the most customer-centric company on earth. To get there, we need exceptionally talented, bright, and driven people. If you'd like to help us build the place to find and buy anything online, this is your chance to make history  A day in the life  About the hiring group The WorkingWell team, part of Amazon’s Workplace Health and Safety (WHS) organization is changing the way we ensure safety and wellness of our field associates. And, the WorkingWell Technology team is a critical partner in enabling these initiatives. We have just started scratching the surface and are aiming to build or integrate products and programs to reinvent the way Amazon anticipates, assesses, and manages workplace wellness and associate experience. We are looking to build our Wellness tech capabilities using technologies ranging from wearable tech, AR/VR, computer vision and building personalized wellness experiences with an app. We are seeking a dynamic, organized self-starter to join the WorkingWell Technology team as a Sr. Applied Scientist.  Job responsibilities The Sr. Applied Scientist will play a critical role in solving tough ergonomics and personalization problems with machine learning, especially focused on computer vision technology. The ideal candidate would be comfortable with ambiguity, and excel at experimenting and building highly scalable machine learning solutions. The individual would also have a strong sense of ownership, urgency, drive and risk taking. This role will report to the Sr. Manager of WHS Technology, and will work closely with cross-functional senior leaders, their teams, and collaborate with other machine learning teams within Amazon to build state of the art ML solutions for the WorkingWell use cases. This is an individual role at the outset, with potential to expand your team. Strong judgment and technical skills, long-term technical and product vision, continuous focus on inventing on behalf of customers. You will have a strong delivery record and leadership experience of owning, influencing, architecting and executing machine learning solutions. You understand the business problems, risks and scaling factors while building solutions. This position will lead the machine learning development efforts for all WorkingWell Technology products and programs. To work effectively in the role, the candidate would understand the needs and restrictions of key Amazon businesses and operations, and find ways to use technology to serve associates and the strategic business direction of the WHS organization. So, if creating and implementing industry-first products and programs excites you, come join us.  Amazon is committed to a diverse and inclusive workplace. Amazon is an equal opportunity employer and does not discriminate on the basis of race, national origin, gender, gender identity, sexual orientation, protected veteran status, disability, age, or other legally protected status. For individuals with disabilities who would like to request an accommodation, please visit https://www.amazon.jobs/en/disability/us.  PhD degree with 4 years of applied research experience or a Master’s degree and 5+ years of experience of applied research experience 3+ years of experience in building production grade deep learning models for computer vision and related fields. Experience programming in Java, C++, Python or related language 3+ years of experience implementing computer vision or deep learning algorithms in C++, C, Python or equivalent programming languages Experience with conducting research in a corporate setting Excellent publication record in peer reviewed conferences and journals Proven expertise in conducting independent research and building computer vision systems.",data scientist
