JobDesc,JobTitle
"Responsibilities One of the nation’s largest and most respected providers of hospital and healthcare services, Universal Health Services, Inc. has built an impressive record of achievement and performance. Growing steadily since its inception into an esteemed Fortune 500 corporation, annual revenues were $11.4 billion in 2019. In 2020, UHS was again recognized as one of the World’s Most Admired Companies by Fortune; ranked #281 on the Fortune 500; and in 2017, listed #275 in Forbes inaugural ranking of America’s Top 500 Public Companies. Headquartered in King of Prussia, PA, UHS has 90,000 employees and through its subsidiaries operates 26 acute care hospitals, 328 behavioral health facilities, 42 outpatient facilities and ambulatory care access points, an insurance offering, a physician network and various related services located in 37 U.S. states, Washington, D.C., Puerto Rico and the United Kingdom.  The Sr. Data Analyst works with Corporate Clinical Services staff and facility staff in developing data management tools, reports and data analysis for comparative purposes across the BH Division. Creates data displays for facility and corporate leadership for decision making. Demonstrates a strong understanding of performance improvement/quality improvement principles and techniques necessary to influence change and modify systems.  Database maintenance – ensures proper functioning and data integrity. Identifies/resolves issues that arise with these systems. Provides support for clinical applications, including project task lists and implementation plans. Writes SQL queries to efficiently retrieve business data to respond to requests from VPs, Risk, and Quality staff. Works with these individuals to find solutions to meet their needs. Compiles routine reports with PI/Patient Satisfaction/Clinical Data. Develops new reports and updates existing ones as needed. Utilizes graphs, pivot charts and other mechanisms as needed Assists with administration/management of PI/Clinical Services SharePoint sites. Maintains site layout structure and content. Provides support to end users, responds to user based questions and follows-up based on variations in usage. Coordinates efforts with Division Clinical Services Department members to assure adequate report writing and data displays at a facility level. Provides ongoing communication with users, managers, corporate directors and vendors to assure support and continual understanding of current initiatives and progress within the clinical applications. Performs other duties as assigned/required. Qualifications Bachelor’s degree required, Computer science, business or clinically-oriented preferred. 3 – 5 years experience working in a Healthcare/Performance Improvement/Quality Improvement arena, with hands-on computer experience. Direct knowledge of data analysis techniques including statistical displays at a macro level and a micro level Experience of T-SQL, SSRS, SSIS, stored procedure and SQL agent job scheduling, or other reporting platforms such as Tableau or Power BI Knowledge of SQL writing queries Ability to summarize data and provide insightful reporting Experience with SharePoint administration/maintenance or web development experience preferred Knowledge of Python or R preferred Direct hands-on clinical experience within a behavioral health facility, preferred. Advanced skills with standard software packages including Excel and data analytics. A quick learner of software and information technology, and motivated to learn new applications. Demonstrates excellent interpersonal communication skills, among facility customers and team members. Demonstrates customer-oriented service excellence principles, as outlined in UHS corporate standards. Self-disciplined, able to work independently, but also able to take direction when necessary. Self motivated to identify and resolve issues, and in advancing personal knowledge. Very organized and detail-oriented  UHS is a registered trademark of UHS of Delaware, Inc., the management company for Universal Health Services, Inc. and a wholly-owned subsidiary of Universal Health Services, Inc. Universal Health Services, Inc. is a holding company and operates through its subsidiaries including its management company, UHS of Delaware, Inc. All healthcare and management operations are conducted by subsidiaries of Universal Health Services, Inc. To the extent any reference to ""UHS or UHS facilities"" on this website including any statements, articles or other publications contained herein relates to our healthcare or management operations it is referring to Universal Health Services' subsidiaries including UHS of Delaware. Further, the terms ""we,"" ""us,"" ""our"" or ""the company"" in such context similarly refer to the operations of Universal Health Services' subsidiaries including UHS of Delaware. Any employment referenced in this website is not with Universal Health Services, Inc. but solely with one of its subsidiaries including but not limited to UHS of Delaware, Inc. UHS is not accepting unsolicited assistance from search firms for this employment opportunity. Please, no phone calls or emails. All resumes submitted by search firms to any employee at UHS via-email, the Internet or in any form and/or method without a valid written search agreement in place for this position will be deemed the sole property of UHS. No fee will be paid in the event the candidate is hired by UHS as a result of the referral or through other means. EEO Statement All UHS subsidiaries are committed to providing an environment of mutual respect where equal employment opportunities are available to all applicants and teammates. UHS subsidiaries are equal opportunity employers and as such, openly support and fully commit to recruitment, selection, placement, promotion and compensation of individuals without regard to race, color, religion, age, sex (including pregnancy, gender identity, and sexual orientation), genetic information, national origin, disability status, protected veteran status or any other characteristic protected by federal, state or local laws. We believe that diversity and inclusion among our teammates is critical to our success. Notice At UHS and all subsidiaries, our Human Resources departments and recruiters are here to help prospective candidates with matching skillset and experience with the best possible career at UHS and our subsidiaries. We take pride in creating a highly efficient and best in class candidate experience. During the recruitment process, no recruiter or employee will request financial or personal information (Social Security Number, credit card or bank information, etc.) from you via email. The recruiters will not email you from a public webmail client like Hotmail, Gmail, Yahoo Mail etc. If you feel suspicious of a job posting or job-related email, let us know by contacting us at: https://uhs.alertline.com or 1-800-852-3449",data scientist
"Bachelor’s degree in a highly quantitative field (Computer Science, Machine Learning, Operational Research, Statistics, Mathematics, etc.) or equivalent professional or military experience Experience with ML fields, e.g., natural language processing, computer vision, statistical learning theory 10+ years of industry experience in predictive modeling, data science, and analysis Experience in an ML engineer or data scientist role building and deploying ML models or hands on experience developing deep learning models Experience writing code in Python, R, Scala, Java, C++ with documentation for reproducibility Experience handling terabyte size datasets, diving into data to discover hidden patterns, using data visualization tools, writing SQL, and working with GPUs to develop models Experience writing and speaking about technical concepts to business, technical, and lay audiences and giving data-driven presentations Want to help the largest global enterprises derive business value through the adoption of Artificial Intelligence (AI) and Machine Learning (ML)? Excited by using massive amounts of disparate data to develop ML models? Eager to learn to apply ML to a diverse array of enterprise use cases? Thrilled to be a part of Amazon who has been pioneering and shaping the world’s AI/ML technology for decades?  At Amazon Web Services (AWS), we are helping large enterprises build ML models on the AWS Cloud. We are applying predictive technology to large volumes of data and against a wide spectrum of problems. AWS Professional Services works together with AWS customers to address their business needs using AI solutions.  AWS Professional Services is a unique consulting team. We pride ourselves on being customer obsessed and highly focused on the AI enablement of our customers. If you have experience with AI, including building ML models, we’d like to have you join our team. You will get to work with an innovative company, with great teammates, and have a lot of fun helping our customers. A successful candidate will be a person who enjoys diving deep into data, doing analysis, discovering root causes, and designing long-term solutions.  This is a customer-facing role and you will be required to travel to client locations and deliver professional services as needed.  Major responsibilities include: Assist customers by being able to deliver a ML project from beginning to end, including understanding the business need, aggregating data, exploring data, building & validating predictive models, and deploying completed models with concept-drift monitoring and retraining to deliver business impact to the organization Use AWS AI services (e.g., Personalize), ML platforms (SageMaker), and frameworks (e.g., MXNet, TensorFlow, PyTorch, SparkML, scikit-learn) to help our customers build ML models Research and implement novel ML approaches, including hardware optimizations on platforms such as AWS Inferentia Work with our other Professional Services consultants (Big Data, IoT, HPC) to analyze, extract, normalize, and label relevant data, and with our Professional Services engineers to operationalize customers’ models after they are prototyped Mater’s degree of PhD in a highly quantitative field (Computer Science, Machine Learning, Operational Research, Statistics, Mathematics, etc.) Ability to develop strategic, baselined, data modeling processes; ability to accurately determine cause-and-effect relationships. Publications or presentations in recognized ML journals or conferences Deep technical skills, consulting experience, and business savvy to interface with all levels and disciplines within our customers’ organization Demonstrable track record of dealing well with ambiguity, prioritizing needs, and delivering results in a dynamic environment Amazon is committed to a diverse and inclusive workplace. Amazon is an equal opportunity employer and does not discriminate on the basis of race, national origin, gender, gender identity, sexual orientation, protected veteran status, disability, age, or other legally protected status. For individuals with disabilities who would like to request an accommodation, please visit https://www.amazon.jobs/en/disability/us.",data scientist
"ABOUT ITEMIZE Itemize is a leading AI company that transforms financial documents into valuable and efficient information sets for business systems. We harness AI to transform unstructured and semi-structured data in purchase documents, such as invoices and receipts, into structured data for accounts payable and accounting systems. Our intelligent document processing technology empowers financial teams to focus on higher-value activities by liberating them from laborious and costly data entry and reconciliation tasks, which remain manual processes. Itemize operations are cloud-based, with a fully remote team distributed nationwide. The company runs on an East Coast schedule. We welcome people who enjoy the challenge of a fast-paced high-growth environment on the leading edge of B2B SaaS technology.  ABOUT THE ROLE The Machine Learning Data Scientist will join a team of engineers innovating new techniques for applying Artificial Intelligence, Machine Learning, and data analytics techniques to transform unstructured images and files into financial data sets. The Machine Learning Data Scientist’s responsibilities will include: Develop machine-learning models, services, and modules for document classification and information extraction Build pipelines and processes for model development, experimentation and scaled production scoring Identify and develop new modeling techniques and/or technologies to complement existing ML processes and improve extraction rates and confidence Measure, improve, and validate confidence scores through rigorous and continuous testing Improve verification and validation functionality Apply machine learning and data science techniques and design distributed systems  SKILLS AND EXPERIENCE Bachelor’s Degree in Computer Science or Engineering 3+ years software development experience in a professional work environment Strong software engineering background with emphasis in data science and machine learning Experience in some of the following ML frameworks: Tensorflow, pandas, pytorch, xgboost, numpy, keras, scikit-learn, dask, spark Demonstrable knowledge and understanding of Statistics and Deep Learning concepts Understanding of probability and statistics and machine learning concepts such as precision, recall, optimization, hyperparameter tuning, overfitting, and interpretability Understanding of how components and processes work together and communicate with each other using library calls, RESTful APIs queueing/messaging systems and database queries Familiar with SQL, and able to create/perform basic queries Fluent in Linux based systems, Docker, and code versioning tooling (Git/CI/CD) Familiarity with AWS cloud services Strong interpersonal communications skills (verbal, presentation, and written)  WHAT WE OFFER High energy atmosphere of an AI-driven FinTech scaleup that has great traction towards global success and already serves clients across four continents, including Fortune 500 companies. And we are just getting started! We value education and professional development and encourage employees to take ownership, become subject matter experts, and bring new ideas to the table to challenge themselves and their teammates. Enjoyable working environment: A diverse international team of techies, dog lovers, globetrotters, and musicians. We offer flexible PTO and a generous benefits package, and highly value independence. Our team enjoys spending time together with fun virtual activities and we look forward to re-establishing face to face events soon!   Candidates must be authorized to work in the United States and available to work East Coast business hours. Itemize is an Equal Opportunity Employer. Itemize does not discriminate on the basis of race, religion, color, sex, gender identity, sexual orientation, age, non-disqualifying physical or mental disability, national origin, veteran status or any other basis covered by applicable law. All employment is decided on the basis of qualifications, merit, and business need.",data scientist
"We have a wide variety of problems and tasks that we solve. If you have experience in one or more of the following, we should talk: Experience building Natural Language Processing models Experience with Bayesian data analysis using MCMC or variational inference Experience with geospatial data analysis Expertise in software engineering Expertise around data science visualization and UX Familiarity with big data platforms like Spark Familiarity with cloud platforms like AWS, GCP or Azure Familiarity with Kubernetes Experience with deploying and productionizing machine learning models",data scientist
"Lead Machine Learning Engineer - Remote We’re partnered with a well know wellness brand, who believe that you deserve a job you’ll love. They also believe in building a best in class Computer vision ML Engineering team that you can be a part of. This role is fully remote in the US and we're looking for people who have worked with structured or unstructured 3D imagining data. You will fit right in if you: have a true practical knowledge of Deep Learning Have worked with 3D imaging of any kind previously Can help solve problems Have the ability to manipulate data to improve performance Are creative in your approaches Want to be part of a best in class team Help your team solve problems and improve thier skill set. Developed an AI product as a leader A bit about us: We're a growing ML team based in a larger business that has the resources to get the job done with the flexibility of a start up environment our day to day application development includes 3D data, mobile pictures and videos, plus alternative imaging devices. We're sitting on a lot of data, no end in sight levels of data. Qualifications Have you led or been part of delivering an ML Computer vision product to market previously? PhD/MS is preferred or Bachelor’s with significant industry experience. Proficient in Python. Proficient in ML frameworks - Pytorch, MXNet Tensorflow, etc. Industry experience building deep learning based computer vision algorithms in commercial products.",data scientist
"Description We are the world’s learning company with more than 21,000 employees operating in 70 countries. We combine world-class educational content and assessment, powered by services and technology, to enable more effective teaching and personalized learning at scale. We believe that wherever learning flourishes, so do people. Senior Machine Learning Engineer Preferred location: Boulder, Colorado Do you love the field of deep learning and would you love a job with expectations to keep abreast on the state-of-the art in language processing? And a job also with expectations to continuously “move the performance needle” for the business? Do you resonate with the need for reproducible research and robust data pipelines? Can you write solid, well engineered code and work in a team environment of highly capable and motivated individuals? Are you excited at the idea of helping to build our next generation of machine learning tools, analytics platforms, and language/math assessment algorithms? Working closely with a small team of experts, you will have a unique opportunity to play a leading role in migrating machine learning based solutions from R&D to product-level operational delivery. The team at Pearson offers a unique environment for extremely skilled and motivated thinkers. Our culture is highly charged with people who are passionate about a cause, using technology to enhance students’ educational experiences. Our team has been building machine learning solutions for educational markets since 2004. Boulder, Colorado has been named as the happiest place in the U.S. and it's no surprise with its year-round outdoor activities, a surfeit of sunny days, a laid-back lifestyle, natural beauty that's always within view, ultra-fresh dining and natural foods scenes, the influence of the University of Colorado Boulder, a highly active culture, and enough craft beer to put a smile on anyone's face. Pearson is an Equal Opportunity and Affirmative Action Employer and a member of E-Verify. All qualified applicants, including minorities, women, protected veterans, and individuals with disabilities are encouraged to apply. Qualifications Required Skills MS or PhD in a quantitative field (CS, EE, statistics, math, data science) required 5 years experience in the field of natural language processing (NLP) 5 years professional experience as a software engineer or data scientist Strong coding capabilities in Python and/or R Experience with Linux and AWS; Kubernetes a big plus Proven ability to build neural networking models for natural language applications 5 years experience TensorFlow, PyTorch or Keras Strong in using Jupyter notebooks for research and data analytics The anticipated starting salary range for Colorado-based individualsexpressing interestin this position is $110–$120k annually. This position is eligible to participate in an annual incentive program. Benefits available to eligible employees can be seen at: https://pearsonbenefitsus.com/ Primary Location : US-RE-Remote Other Locations : US-CO-Boulder Work Locations : US-Remote Remote Job : Research and Development Organization : Assessments School Job Type : Standard Job Level : Individual Contributor Shift : Day Job Travel : No Job Posting : May 1, 2021 Job Unposting : Ongoing Schedule: : Full-time Regular Req ID: 2105907",data scientist
