JobDesc,JobTitle
"as the world moves even more online due to the coronavirus pandemic, customers are connected and empowered like never before. customers want an immediate, personalized and consistent experience, no matter which channel they choose to engage with a brand. sprinklr helps brands meet the demands of today's customers by providing them with the insights they need to make every interaction matter. sprinklr is a customer experience management (cxm) platform for modern enterprises with 2000+ employees helping the world's most valuable enterprises make their customers happier. learn more about our culture and how we make our employees happier through the sprinklr way. new york city or east coast senior data analyst (culture & talent) as sprinklr continues to grow, one of our toughest challenges relates to talent management and workforce planning. as a senior data analyst within the hr function (known as culture & talent at sprinklr) you will be responsible for taking people analytics to the next level, by incorporating predictive analytics, ai and machine learning to our analytical reporting capabilities. you will work with a highly skilled small team of analysts who will partner with c&t business partners to identify, analyze, and operationalize outcomes that provide value to both the business and its people. we have a strong culture of data-driven decision making across the whole company; with that as sprinklr grows, this team will form the analytics function as a center of expertise and help us understand how our culture and processes impact people's performance and happiness and what we can do to keep improving it. this is an opportunity to bring industry leading techniques to sprinklr and help set the agenda for the year ahead. in order to be successful in the people analytics team, the data analyst will have demonstrable experience in research and analyses across a broad range of people-related topics such as talent acquisition, performance, learning and development, diversity, compensation, and retention. they will also have experience working closely with a number of internal stakeholders, including, finance, sales operations, the executive/senior leadership team, people leaders across business and the wider c&t community. relationship skills are essential as the analyst navigates these teams to explain findings and easily translate recommendations into the language of the business. position responsibilities: produce a range of accurate and timely people mi, reports and insight across the employee life cycle from multiple internal and external data sources work with large, complex data sets. solve difficult, non-routine analysis problems, applying advanced analytical methods conduct end-to-end analysis that includes data gathering and requirements specification, processing, analysis and ongoing deliverables understand what metrics and reporting market leading tech companies are providing, and ensure these are embedded within the wider analytics plan of work use predictive analytics to provide people trends and insights to the rest of the organization manage people analytics governance, ensuring all projects are prioritized by business value and aligned with other analytics projects in the organization ability to pull disparate data points and research together to tell compelling stories and influence leaders provide strategic frameworks for statistical data modeling of critical workforce planning measures such as attrition, retention, engagement, performance, l&d and diversity reporting requirements: ba/bs in a field that emphasizes analyzing, displaying, or reporting on data (e.g., computer science, math, engineering, economics, statistics) understanding of data visualization principles and fundamentals of probability, statistics and machine learning expertise in python/ r, ms excel, google sheets, vba and apps script experience with tools such as pycharm, mongodb, domo, workday, powerbi, sql, adp, salesforce, ms excel, g-suite and any other related programs for executing the above responsibilities strong project management skills 3+ years of experience focused on using data to uncover insights that drive action in a hr function experience with data management and having an understanding of data structures as well as data ingestion, blending, transformation and visualization techniques. practical experience with algorithms for classification, regression, clustering, text summarization, time series forecasting, survival analysis and anomaly detection skills: statistical modelling & machine learning: regression, classification, clustering, survival analysis, time series analysis, anova, predictive & prescriptive analytics, parametric and non-parametric models, supervised and unsupervised ml, nlp, text analytics, dynamic/causal model, data/text mining, adaptive decision algorithms, search algorithms, neural networks expertise in ms excel and google sheets communication skills and an ability to partner effectively across the organization able to work with a high degree of complexity and at times, uncertainty, since you will be working with multiple stakeholders, some of whom will have limited analytics exposure and understanding commercially minded and can put numbers into business perspective highest standards of accuracy and precision; highly organized articulate with excellent verbal and written communication skills ability to think creatively and solve problems; highly-driven and self-motivated demonstrated ability to roll-up sleeves and work with team members in a hands-on management capacity ability to work under tight deadlines and prioritize work to deliver projects on time why you'll love sprinklr: we offer a flexible work environment, unlimited vacation, and generous pay and benefits packages. while we have some amazing perks, at the end of the day, sprinklrites are here for the opportunity to grow, learn, and affect the industry with incredible ingenuity. #sprinklrlife we focus on our mission: we believe social technology is the future of customer-brand relations across all departments, and we seek to make each of those experiences excellent at every touchpoint. this is how we all make the world more social together. we invest in our people - sprinklrites passionately, genuinely care about seeing one another succeed in making an impact on the industry. we pride ourselves on having an honest, open environment and a supportive culture where we can take risks together. we believe in our product - sprinklr is the most complete enterprise social technology in the world, and we're not just saying that forrester wave said it for us! as such, we have many of the world's largest brands as our clients, and our employees have the opportunity to work closely alongside them.  employment policy sprinklr's policy is to provide equal employment opportunities to all applicants and employees without regard to race, color, religion, creed, gender, gender identity or expression, age, national origin or ancestry, citizenship, disability, sexual orientation, marital status, pregnancy, veteran status, membership in the uniformed services, genetic information, or any other basis protected by applicable law. sprinklr, inc. participates in the e-verify program. as a participating employer, sprinklr, inc. will provide the social security administration (ssa) and, if necessary, the department of homeland security (dhs), with information from each new employee's form i-9 to confirm work authorization. sprinklr, inc. follows all federal regulations including those set forth by the office of special counsel for immigration-related unfair employment practices (osc). the osc enforces the anti-discrimination provision (§ 274b) of the immigration and nationality act (ina), 8 u.s.c. § 1324b.  disclaimer our careers site is only for individuals seeking a position with sprinklr and its holdings companies. staffing and recruiting agencies and individuals being represented by an agency are not authorized to use this site or to submit profiles, applications, or resumes, and any such submissions will be considered unsolicited. sprinklr does not accept unsolicited resumes or applications from agencies. please do not forward resumes to our job alias, sprinklr employees, or any other company location. sprinklr is not responsible for any fees related to unsolicited resumes/applications. any offer (s) of employment are contingent upon a satisfactory background and criminal records check, which will be conducted in accordance with local legal regulations. why you'll love sprinklr: we're committed to creating the kind of culture where you feel like you belong, are happier today than yesterday, and your contributions matter. at sprinklr, our goal is to treat everyone like family and passionately, genuinely care. for full-time employees, we offer flexible paid time off and paid parental leave, medical plans, dental and vision plans, life insurance, 401(k) savings plans, employee stock options, gym and wellness discounts, plum benefits, lifemart discounts, and paid time off to invest in learning and career development. we focus on our mission: we founded sprinklr with one mission: to enable every organization on the planet to make their customers happier. our vision is to be the world's most loved enterprise software company, ever. we believe in our product: sprinklr was built from the ground up to enable a brand's digital transformation. its platform provides every customer-facing team with the ability to reach, engage and listen to customers around the world. at sprinklr, we have many of the world's largest brands as our clients, and our employees have the opportunity to work closely alongside them. we invest in our people: at sprinklr, we believe every human has the potential to be amazing. we empower each sprinklrite in the journey toward achieving their personal and professional best. for wellbeing, this includes daily meditation breaks, virtual fitness, and access to headspace. we have continuous learning opportunities available with audible for business, linkedin learning, and more. eeo - our philosophy: our goal is to ensure every employee feels like they belong and are operating in a judgement-free zone regardless of gender, race, ethnicity, age, and lifestyle preference, among others. we value and celebrate diversity and fervently believe every employee matters and should be respected and heard. we believe we are stronger when we belong because collectively, we're more innovative, creative, and successful. sprinklr is proud to be an equal opportunity workplace and is an affirmative action employer. we are committed to equal employment opportunity regardless of race, color, ancestry, religion, sex, national origin, sexual orientation, age, citizenship, marital status, disability, gender identity or veteran status. see also sprinklr's eeo policy and eeo is the law. if you have a disability or special need that requires accommodation, please let us know.",data scientist
"position purpose: serves as a senior member of the data analytics team providing data analytic support to organization management, including business, finance, and clinical teams. transforms claims and clinical data into actionable reports which support the management of risk. primary responsibilities: collaborates with cross-functional teams, including clinical, technical, business and finance teams in defining project specifications, including functional requirements and information needs. identifies and integrates data from multiple sources and builds dashboards and reports within the various platforms, and other available reporting tools that produce interactive and effective data analytics. proactively identifies data trends and outliers and provides suggestions to the causes, remedies, or process improvements. determine data visualization requirements, conduct proof of concepts, recommend appropriate tools and techniques, create and maintain data visualization outputs (e.g. reports, charts, apps). responsible for data and information compilation and analysis; developing and designing clear and concise reports for distribution to internal and external customers. conduct data exploratory analysis, identify patterns, perform predictive and prescriptive analytics, and come up with actionable business insights. creates relevant and actionable reports to identify gaps in care and assist case management staff to implement plan and monitor progress. develops meaningful cost modeling, provider contract modeling, value based contract measurements, and quality performance comparisons. designs and develops data visualization solutions to communicate results to key decision makers. analyzes trend and provides actionable insights to facilitate population health management. takes part in ad hoc reporting projects as needed, including supporting users in determining reporting options within available applications. excellent analytical and problem-solving skills with ability to assess impact on departments and recognize/communicate potential problem trends. team oriented with strong communication, interpersonal and presentation skills. analyzes information and makes recommendations to sales, medical management, operations, quality, etc. regarding cost-saving efforts within analytics. experience:â a bachelor's degree in quantitative analysis is preferred. three to five (3-5) years of professional experience within an insurance company or a managed health care environment required. highly developed problem-solving skills within a multi-function setting.â critical required skills: the financial and analytical skills necessary to interpret complex quantitative information and relationships, and distill them down to relevant and actionable reports that can be used by senior management of php or other entities. detail oriented, with effective research and problem solving skills. ability to challenge results and quickly assess the validity, completeness and accuracy of data and analytics. the written and verbal communication skills necessary to elicit, negotiate, illustrate, and present technical information. ability to pay close attention to detail, compare figures, verify calculations, and ensure reports are accurate and complete. ability to access data using information systems required to complete analysis and reporting requirements. possesses a strong understanding of healthcare data including cost of care, patient utilization metrics, provider contract concepts and population health activities. ability to understand php custom database layout, format, and information usage. organizational skills necessary to coordinate and prioritize workload and to maintain tracking systems and related information in a readily retrievable format. proficient with sas, sql server database, microsoft excel (including pivot tables), microsoft word, power bi, python, r and other tools as needed. proficient with pertinent systems and software packages necessary to access required information (e.g., claims, financials, fees). analytical abilities required to manipulate data programs used in generating descriptive reports and in their corresponding analysis. detail oriented with effective research and problem solving skills. a strong understanding of medical coding (icd, cpt) and business terminology. detailed knowledge with both medicare and commercial provider reimbursement methods (drg, rbrvs, asc, per diem, capitation, and value based reimbursement). ability to work with diverse groups of individuals in achieving required results. self-directed individual, with the ability to self-manage time and prioritize work. the interpersonal ability to efficiently interact with management, staff and outside entities. the ability to manage multiple priorities within a stressful and demanding business environment. â",data scientist
"artificial intelligence engineers are responsible for developing, programming and training neural networks. this role requires combined expertise in software development, programming, data science and data engineering. developers locate and pull data from a variety of sources, create, develop and test machine learning models and then utilize application program interface (api) calls or embedded code to build and implement ai applications. job type: full-time pay: $20.00 - $50.00 per hour benefits: 401(k) health insurance paid time off schedule: monday to friday supplemental pay: bonus pay covid-19 considerations: masks required, frequent sanitizing of workplace surfaces, quarantine and isolation for those who test positive or those who come into contact with someone that tested positive education: bachelor's (preferred) experience: a.i. software engineering: 5 years (preferred) work location: one location company's website: https://sorteraalloys.com/ benefit conditions: waiting period may apply only full-time employees eligible work remotely: no covid-19 precaution(s): personal protective equipment provided or required social distancing guidelines in place virtual meetings sanitizing, disinfecting, or cleaning procedures in place",data scientist
"at liberty mutual, our purpose is to help people embrace today and confidently pursue tomorrow. that’s why we provide an environment focused on openness, inclusion, trust and respect. here, you’ll discover our expansive range of roles, and a workplace where we aim to help turn your passion into a rewarding profession. liberty mutual has proudly been recognized as a “great place to work” by great place to work® us for the past several years. we were also selected as one of the “100 best places to work in it” on idg’s insider pro and computerworld’s 2020 list. for many years running, we have been named by forbes as one of america’s best employers for women and one of america’s best employers for new graduates—as well as one of america’s best employers for diversity. to learn more about our commitment to diversity and inclusion please visit: https://jobs.libertymutualgroup.com/diversity-inclusion we value your hard work, integrity and commitment to make things better, and we put people first by offering you benefits that support your life and well-being. to learn more about our benefit offerings please visit: https://lmi.co/benefits liberty mutual is an equal opportunity employer. we will not tolerate discrimination on the basis of race, color, national origin, sex, sexual orientation, gender identity, religion, age, disability, veteran’s status, pregnancy, genetic information or on any basis prohibited by federal, state or local law. senior software engineer – machine learning we deliver our customers peace of mind every day by helping them protect what they value most. our passion for placing the customer at the center of everything we do is driving a transformational shift at liberty mutual. operating as a tech startup within a fortune 100 company, we are leading a digital disruption that will redefine how people experience insurance. about the job: we are seeking an experienced senior software engineer with full stack skills to participate in software development within an agile team supporting our analytic platforms and services department. you will be working on runway, our internally developed platform for managing the deployment of ai/ml predictive models. runway makes it as fast and easy for data scientists to operationalize their python and r models while adhering to high standards for security, performance and availability. in addition to full-stack java development, this role also includes working on templates and ml operations components written in python. members of the runway team work closely with data scientists in all markets, so consulting skills and a desire to apply machine learning and artificial intelligence to high-value business challenges are critical to this role. the industry changes quickly, so we are looking for candidates who can respond to change, pick up new technologies quickly and adapt to changing requirements. we also want candidates who take pride in their work and have strong design and development expertise. we value quality code delivery and expect candidates to demonstrate competence at writing, testing and debugging java and python code. highly competitive candidates will have: familiar with python webserver and mlops libraries, such as flask, fastapi, mlflow and airflow knowledge of machine learning tools and practices data engineering skills, including sql databases, pandas and spark qualifications: bachelor's degree in technical discipline preferably computer science or software engineering 5+ years of professional development experience in java and python knowledge of it concepts, strategies, methodologies, architectures and technical standards analytical, problem solving, and communication skills familiarity with insurance functions and business operations extensive knowledge of design and development tools proficient in multiple programming languages and tools consulting, negotiation and consensus building skills strong presentation and written communication skill  bachelor's degree 16",data scientist
"meet medpro group. we’re an industry-leading berkshire hathaway insurance company with a passion for our clients and our team. we are hundreds of professionals with varied backgrounds and experience levels who came together to achieve one goal: protecting those who have made it their mission to serve and care for others. never considered the insurance industry before? we think you should.  in this role you will…  translate business needs, processes and procedures into a workable system, and articulate on specific data science requirements by communicating about these requirements with technology experts. participate in developing functional requirements, testing, training and implementing data science solutions. develop detailed system requirements based on business needs, utilizing standard documentation guidelines and coordinating with technical resources throughout project cycle. participate in reviewing, analyzing, and evaluating underwriting and claims' user needs. participate in project meetings, project tracking, analysis, and reporting. provide reporting analysis on key projects and delivery outcomes with the business clients. develop documents for data science applications, system specifications and test plans, according to existing standards and methodologies. support implementation of high impact, cross-functional projects aligned with strategic business initiatives under the direction of a project manager or data scientist. support small to medium size projects including project planning, requirements definition and documentation, test case definition, execution of testing, and project implementation. assist in handling post-production issues until project has been approved for release to the business. perform other duties as assigned.  we are looking for candidates with…  bachelor’s degree or equivalent project/insurance experience. 3 or more years of related project or insurance experience. strong analytical skills. ability to resolve problematic issues in an efficient manner. excellent organizational and communication skills, demonstrated ability to work across technical and non-technical resources. understanding of systems and technical design. strong pc skills including word, excel, powerpoint, and visio. demonstrated ability to work independently and as a team member. ability to handle multiple, changing priorities, and deadlines in a very fast paced working environment.  why medpro?  medpro group’s mission is built on a century-old legacy of protecting those who protect others. from our roots in our hometown of fort wayne, indiana, we've worked diligently to become the nation's premier healthcare liability coverage provider, currently insuring more than 300,000 customers. with that growth, we've built a significant presence in all 50 states. our team works across the country to provide the best strategies to mitigate risk and preserve the reputations of those who have entrusted their good name to us. that passion – built on a foundation of a culture that values uncompromised integrity, obsessive client focus, great teamwork, and a long-term mindset – makes medpro a preferred employer that many call their career home.  general: medpro group is an equal opportunity employer.",data scientist
