JobDesc,JobTitle
"Obsidian makes SaaS security simple with an innovative, data driven approach to protecting the SaaS space. The company was founded by veterans in endpoint security and is backed by Greylock, Wing, and Google Ventures. The leadership team includes innovators from AWS, Carbon Black, Cylance, and Shape Security, where they have delivered enterprise-grade products to thousands of customers. Obsidian is seeking expert researchers to tackle a variety of problems that impact the bleeding edge of machine learning and artificial intelligence, with a focus on applications in computer security. We’re developing a team by drawing from the research fields in statistics, computer science, mathematics and related fields to help us achieve these goals. At Obsidian, our research team is at the core of our business. You will be part of a highly visible and agile team working on critical problems that directly affect the company’s success. As part of the research group, you will leverage your problem-solving and analytical skills to further our capabilities, as well as publish and present new and novel research. Specifically, you’re someone who: Wants to build and develop intellectual property through the research and implementation of new applications of machine learning. Works with internal product and engineering teams to drive development of new products. Has the capability to translate and implement newly published research on specific datasets and problems to validate approaches. Has experience wrangling large data sets and applying machine learning techniques towards real product and business problems. Invests time in research including publications, and is committed to keeping up with AI trends. Develops working prototypes of algorithms and evaluates and compares metrics based on large, real-world data sets. Qualifications: MS or Ph.D. in computer science, statistics, or applied math. 2+ years of experience applying statistical/ML algorithms and techniques to real-world data. Familiar with programming languages such as Python, Scala, and Go. Designs scalable processes to collect, manipulate, present, and analyze large datasets in a production-ready environment. Experience with large volumes of data, algorithms, and prototyping. Experience with applying deep learning techniques in a production environment. Strong written and oral skills (in English). Obsidian has offices in both the Newport Beach and San Mateo, CA area. This position is open to both locations. Please only apply if you are in the United States, in the geographic areas and/or willing to relocate to the geographic areas. At Obsidian, we value diversity and freethinkers and are proud to be an equal opportunity employer. In compliance with federal law, all persons hired will be required to submit satisfactory proof of identity and legal authorization to work in the United States.  eli1Ms6QQe",Data Scientist
"When you join Verizon You’ll have the power to go beyond – doing the work that’s transforming how people, businesses and things connect with each other. Not only do we provide the fastest and most reliable network for our customers, but we were first to 5G - a quantum leap in connectivity. Our connected solutions are making communities stronger and enabling energy efficiency. Here, you’ll have the ability to make an impact and create positive change. Whether you think in code, words, pictures or numbers, join our team of the best and brightest. We offer great pay, amazing benefits and opportunity to learn and grow in every role. Together we’ll go far. What you’ll be doing... The Wireless AI Innovation @ Verizon (WAIV) Team is seeking a unique data scientist capable of technical creativity and the ability to showcase their prototype work. This role will understand the cutting-edge concepts and capabilities of AI/ML and utilize them to create innovative enhancements to engineering tools not previously envisioned. They must be a strong communicator to win over Verizon’s brightest SMEs to new thinking and also process-minded to guide their assigned projects to completion. The WAIV team is a fast-paced AI/ML team, prototyping software as operational Beta Proof of Concepts. The role will primarily be focused on data science, but will often take on all the lifecycle functions of an AI/ML prototype, from working with SMEs that translate, medium-scale data engineering, model training and testing, and installing the code into Verizon directional systems. Projects can be self-planned and executed, giving the structure and flexibility to innovate. As these projects are new inventions, the data science role will also be skilled at presenting and describing their works in written form. Publications are expected to be created in the form of internal blog posts, intellectual property, industry papers, conference presentations or collaborations with universities. Responsibilities: Envision new network (engineering) AI/ML projects and present well-formed ideas to the team. Utilize considerable creativity to merge ideation, knowledge of AI/ML model uses, insights from SMEs/translators and constraints to propose ML projects that are meaningful and actionable. Provide timelines, milestones, project plans and types of AI/ML models to be attempted for new prototype projects. Adapt and communicate needed changes as datasets, labels or models may not function as expected. Partner with team and non-team data scientists to teach complex concepts, assess project feasibility, select input features and validate project output. Envision and test for corner cases. Utilize large amounts of GPU effectively to train and attempt multiple models, documenting progress. Guide AI/ML projects with high autonomy so that they will be accepted by the business and SMEs who will use them. Pull sample data sets from NS tools and VGRID to attempt prototypes on new topics. Learn the wireless domain (5G/LTE, xLPT datasets, RF Planning, Orchestration, etc) and toolsets to better communicate and understand the needs of engineers for AI/ML automation. Publish blogs, create documentation, perform presentations, submit intellectual property write-ups and lead efforts for external publications. Present to SME groups such as the System Performance Core Team, the Assurance Core Team or Service Performance to explain, promote and request feedback on AI/ML project ideation and ongoing efforts. Support SMEs from WAIV when they present your work to engineers. What we’re looking for... You'll need to have: Bachelor’s degree in Electrical Engineering, Computer Science or four or more years of work experience. Six years of relevant work experience. Skilled in Python, Linux Shell, Sci Kit Learn, and standard AI/ML models. Even better if you have: A Degree. Masters/PhD in Statistics, Math, Economics, Engineering, Computer Science, Business Analytics, Data Science, or a related field. Broad experience in training multiple types of AI/ML models such as KNN, and XGBoost, CNN/RNN, reinforcement learning, deep learning models, GANs, etc. Knowledge of Relational databases in SQL or R. Previous experience in wireless networking is a plus. Recognized as a contributor to Software Organized Networks (SON) platforms. Experience in advanced AI/ML such as ensembles, deep learning, reinforcement learning, and NLP. Four or more trained models moved to production or completed in a research environment. Experience with Spark and Big Data deployments. Attached examples of filing IP, Published Papers or Conference Presentation titles to your resume. Willingness to travel upto 25% Equal Employment Opportunity We're proud to be an equal opportunity employer - and celebrate our employees' differences, including race, color, religion, sex, sexual orientation, gender identity, national origin, age, disability, and Veteran status. Different makes us better.",Data Scientist
"How will you make an impact? The Senior Statistical Programmer, based in San Clemente, CA will be responsible for generating tables, listings and graphs to support statistical analyses of data for clinical studies, regulatory submissions and publications. This position requires a good understanding and ability to provide datasets using current industry standards including Clinical Data Interchange Standards Consortium (CDISC) Study Data Tabulation Model (SDTM) and Analysis Data Model (ADaM). What will you do? Review key study documents produced by other functions (protocols, statistical analysis plans [SAPs], TFL shells, case report forms) and interact with statisticians and other clinical team members to ensure programming requirements are understood. Following SAPs, develop specifications and execute derivation algorithms for analysis dataset production. Following the SDTM Implementation Guide and written specifications, create programs to produce CDISC-compliant SDTM and ADaM datasets anddefine.xml files. Generate tables, figures, and listings, (TFLs) in accordance with the SAP and TFL shells to support analyses using Base SAS, SAS Macro, SAS/STAT, SAS/GRAPH, or other statistical graphics technology. Create and maintain integrated analysis datasets including closed and ongoing studies. Validate SAS programs, macros, datasets, and TFL output generated by other programmers. Develop or assist in the development of departmental processes and procedures. Other duties as assigned. How will you get here? Experience working in Pharmaceutical/ Biotechnology/CRO industry as a Statistical SAS Programmer generating TFLs is required (>= 4 years with MS degree; >=6 years with BS degree). High proficiency in SAS programming and Macro development Experience working with CDISC SDTM and ADaM compliant data sets Experience with regulatory submissions. Knowledge of statistics and the drug development process In-depth knowledge of FDA/ICH guidelines and industry/technology standard practices Knowledge of statistical terminology, clinical tests, medical terminology, and protocol designs Solid verbal and written communication skills Education: Bachelor's /Master's Degree in Statistics, Mathematics, Computer Science, or other related discipline is required; Master's degree is preferred Generous. Innovative. Leadership-driven. Family-oriented. Socially responsible. These are just a few of the terms our employees use to describe their experiences as a part of the Glaukos family. Those may seem like big aspirations, but here at Glaukos, we recognize the deep significance and profound meaning that comes from knowing that we can make a meaningful difference by helping improve eyesight of people worldwide. And because we’re a rapidly growing company with a dynamic, fast-paced culture, individual employees here are empowered with more diverse and enriching challenges than might not be possible at a larger company, and more fulfillment in knowing every person and every task is directly tied to making a difference in the life of others. We offer competitive salary (based on experience), bonus eligibility, medical/dental/vision, life insurance, stock options, 401(k) Employer Match, Employee Stock Purchase Program, generous paid time off & paid holidays as well as time-off to volunteer in the community, plus the opportunity to work for a company that is pioneering a new glaucoma treatment class! Check out our profile on The Muse to get an inside look at our company culture. Glaukos has been named one of the Top Workplaces by the Orange County Register for the past 3 years! Glaukos Corporation is an Equal Opportunity/Affirmative Action Employer. All qualified applicants will receive consideration for employment without regard to race, color, religion, sex including sexual orientation and gender identity, national origin, disability, protected Veteran Status, or any other characteristic protected by applicable federal, state, or local law. ABOUT US Founded in 1998, Glaukos Corporation is an ophthalmic medical technology and pharmaceutical company focused on novel therapies for the treatment of glaucoma, corneal disorders, and retinal diseases. Our company was the first company to bring to market Micro-Invasive Glaucoma Surgery (MIGS), the micro-invasive procedure which revolutionized the treatment and management of glaucoma. In 2012, we launched our first MIGS device—the iStent®—in the United States, followed by our next-generation iStent inject® device in September 2018 and iStent inject® W in September 2020. In November 2019, Glaukos acquired Avedro, maker of the first and only FDA-approved cross-linking technology for progressive keratoconus. And we continue to seek to leverage our platform technologies to build a comprehensive and proprietary portfolio of micro-scale surgical and pharmaceutical therapies for glaucoma, corneal health, and retinal diseases. Our company completed an initial public offering in June of 2015, and our shares are traded on the New York Stock Exchange under the ticker symbol “GKOS”. Our global headquarters is located in San Clemente, California with additional locations in Waltham and Burlington, Massachusetts. Glaukos Corporation is an Equal Opportunity/Affirmative Action Employer. All qualified applicants will receive consideration for employment without regard to race, color, religion, sex including sexual orientation and gender identity, national origin, disability, protected Veteran Status, or any other characteristic protected by applicable federal, state, or local law.",Data Scientist
"Team Name: Unannounced Project Job Title: Software Engineer, AI Requisition ID: R006143 Job Description: Blizzard Entertainment is seeking a talented and passionate AI Software Engineer to design and architect compelling AI gameplay systems for an unannounced AAA PC/Console project. As a software engineer focused on artificial intelligence, you will champion Blizzard’s core value of “Gameplay First” as you collaborate with a small team of designers, engineers, and artists to create compelling and challenging gameplay experiences. The ideal candidate will have experience working on AI features in modern 1st/3rd person AAA titles. By blending your mastery of programming with a critical eye for design, you will help architect and implement an epic gameplay experience. Our incubation teams are fast paced and mission critical. We love engineering, geeking out over new technology, and helping move the industry forward. Most importantly, we learn, grow, and ultimately enjoy success as a team, overcoming new challenges together. Responsibilities Collaborate with designers, artists, and other gameplay engineers to design, prototype, and implement polished AI-based gameplay experiences. Build and improve AI game systems, emphasizing correctness, performance, and extensibility. Function as part of a fast-paced team: collaborate with other engineers, artists, producers, and designers to achieve a unified vision for our project. Perform research to acquire new knowledge necessary to perform assigned tasks and maintain a process of technological evolution. Champion Blizzard Entertainment’s core values, especially ""Gameplay First."" Requirements Minimum of three years of experience delivering production-level code in a professional environment. Strong, proven C++ programming skills, including performance analysis and code optimization. Experience designing and implementing systems and APIs used by other programmers. Self-motivated and willing to pitch in on many areas of game development. Ability to communicate effectively with artists, designers, and other engineers. Significant AI programming contributions to at least one previously shipped AAA title. Pluses Experience with character animation, locomotion, or physics. Experience developing gameplay systems for a multiplayer (client/server) architecture. Prior experience with 1st person or 3rd person combat or open-world features. Experience with visual scripting languages such as those found in Unity or Unreal. Console development experience. Familiarity with other programming or scripting languages. Familiarity with Blizzard games. Required Application Materials Resume Cover Letter which should include: Why you are interested in working at Blizzard. What games you are currently playing. Blizzard Entertainment is a global company committed to growing our employees along with the business. We offer generous benefits and perks with an eye on providing true work/life balance. We’ve worked hard to foster an intensely collaborative and creative environment, a diverse and inclusive employee culture, and training and opportunity for professional growth. Our people are everything. Our core values are real, and our mission has never changed. We are dedicated to creating the most epic entertainment experiences…ever. Join us!",Data Scientist
"We are looking for a Senior Data Analyst with HSS Admin Aff Physicians Department at St. Joseph Heritage Healthcare. Location: Anaheim, CA Schedule: Full-time 80 Biweekly Hour Shift: 8 Hour Day Shift Job Summary: Under the direction of the Manager, Health Informatics, this position serves as a liaison between business partners and information services teams to identify effective capture, analysis and visualization of data. This role will contribute to the development, design and reporting analysis for the Affiliated Network and requires a strong knowledge of business operations in a clinical environment. Able to identify business requirements, researches optional solutions, facilitates system design and user validation testing, and advocates for productivity/process improvements. Ideal candidate is passionate about data and providing insight to others via visualization dashboards or other mediums. Skills: Understanding reporting requirements from multiple systems (e.g.: SQL, Tableau, Power BI). Highly proficient in all Microsoft Office applications (specifically, Excel, Word, Outlook, and Visio). Intermediate to advanced level of knowledge of business analytical practices and methodologies. Ability to translate technology terms into language clients can understand. Effective written and oral communication and interpersonal skills. Effective meeting facilitation and group leadership skills. Advanced analytical and problem-solving skills; strong financial/math skills. Ability to be flexible and work in a rapidly and constantly changing environment. Ability to work independently and meet deadlines. Systematic and orderly planning abilities, with a high attention to details. Excellent follow up to ensure the timeliness of deliverables that are completed with a high degree of quality, thoroughness, and accuracy. Ability to work effectively and interact with all levels of management including executive leadership. Customer-focused attitude and ability to work proactively and efficiently with an appropriate sense of urgency. Intermediate to advanced level of knowledge of project management practices and methodologies. Strong analytical skills. Position Requirements: Education: Bachelor's Degree in Healthcare, Information Systems, or related field. Or equivalent educ/experience Experience: 3 years Hands-on experience with ambulatory information systems and/or analytic systems (practice management, claims management, or electronic health record system). License and Certificate: Valid CA Driver's License Preferred Position Requirements: Experience: 3 years Healthcare information systems experience applying analytical methodologies, with specific experience utilizing business and/or clinical applications. Customer support experience. Experience with system integration and electronic data interchange. St. Joseph Health - Mission Heritage Medical Group is one of California's most respected medical groups. With over 3,000 employees and 75 locations throughout California, including, Northern California, Orange County, High Desert and Los Angeles County, Mission Heritage Medical Group has been continually recognized as a leader in quality, customer service and information technology. This kind of success is the result of team work, a commitment to excellence and a strong adherence to the organization's mission, vision and values.St. Joseph Health - Mission Heritage Medical Group provides equal employment opportunities (EEO) to all employees and applicants for employment without regard to race, color, religion, sex, national origin, age, disability or genetics. In addition to federal law requirements, Mission Heritage Medical Group complies with applicable state and local laws governing nondiscrimination in employment in every location in which the company has facilities. This policy applies to all terms and conditions of employment, including recruiting, hiring, placement, promotion, termination, layoff, recall, transfer, leaves of absence, compensation and training. Company: Heritage Healthcare Category: Analytics/ Business Intelligence Req ID: R319975",Data Scientist
"About Specright Specright is on a mission to become the go-to software tool for packaging, procurement, and supply chain professionals. We are the first specification data management platform built around a modern tech stack. We help consumer goods and manufacturing companies manage their supply chains, providing a web-based app that improves the way packaging, ingredient, and product data is shared, analyzed, and audited. About the role As a Senior Machine Learning Engineer, you will Work with other team members to investigate design approaches, prototype new technology and evaluate technical feasibility. Optimize and automate model training and testing for experimentation, development, and production. Combine several different machine learning algorithms with domain knowledge into sophisticated ML workflows. Create web services/APIs for serving ML/AI model results. Who you are You have experience creating a working machine learning-powered project from the ground up, contributes innovative ideas and ingenious implementations to the team, and are capable of planning out scalable, maintainable data pipelines. B.S. or M.S. in Computer Science, Electrical Engineering, or related fields 5+ years of experience in Cloud/AWS Engineering/Development. Programming experience with one modern language such as Java, C++, or C# including object-oriented design. 4+ years of work in Machine Learning or Artificial Intelligence in an AWS environment. Experience with working in at least one of Python or R to conduct detailed data analysis, visualization, and modeling. Experience with deep learning methodologies in computer vision (e.g. recognition, detection, segmentation) and NLP (e.g. classification, NER, etc.). 3+ years of experience contributing to the architecture and design (architecture, design patterns, reliability and scaling) of new and current systems. Able to work both independently on ambiguous problems and in highly collaborative team environments. You are a strong team player, with a can-do attitude.",Data Scientist
