JobDesc,JobTitle
"Overview  The Data Architect will design enterprise data models and integrations to meet the organization's current and future business needs. The Data Architect will also guide project teams toward successful implementation of their designs.  Responsibilities Design efficient, flexible, and scalable data models and solutions to meet business needs for operational reporting, analytical reporting, integration, application development, and master data management Validate data model designs through performance and load testing Analyze data residing in source databases to establish relationships and integration points Design data mapping and transformation from source to target Create and maintain a detailed Enterprise Data Dictionary/Catalog Establish, maintain, and communicate data standards and policies to ensure data integrity, consistency, security, and privacy Ensure data quality and standards compliance by conducting technical data design reviews Evaluate software tools for data integration, data management, and reporting Assist with troubleshooting and performance tuning of SQL queries and ETL jobs Analyze data to research anomalies, identify root cause, and recommend solutions for complex problems Make decisions and set priorities consistent with the long-term interest of the organization and stakeholders  Qualifications  Qualifications: BS in computer science or equivalent education desired At least 5-7 years of relevant work experience (e.g. Data Architect, Data Modeler) with a strong data-centric background Advanced data modeling experience supporting application and reporting needs (i.e. transactional and dimensional database schemas) Advanced database skills and experience including analysis of execution plans, indexing, and stored procedure development (SQL Server preferred) Advanced knowledge of batch and real-time integration technologies Strong knowledge of data governance, data quality, and master data management Strong understanding of data visualization techniques using tools like Tableau Experience with Embarcadero ER/Studio or a comparable data modeling tool Experience with full software development life cycle Data science, artificial intelligence, and machine learning experience preferred  Skills: Ability to explain complex technical terminology, concepts, and issues in terms understandable to non-technical personnel Excellent communication (oral and written) and interpersonal skills Excellent attention to detail and commitment to product quality Strong problem solving, critical thinking, and troubleshooting skills Strong listening and questioning skills Must work well independently and in a collaborative team environment Ability to lead meetings with technical peers regarding solution designs Efficiently manage time and set priorities for multiple deadlines as well as ad hoc requests Provide timely status updates and issue escalation to appropriate levels of management  The Company is an Equal Opportunity Employer. It is our policy to afford equal employment opportunity to all employees and applicants for employment without regard to race, color, religion, sex, sexual orientation, national origin, citizenship, place of birth, age, disability, protected veteran status, gender identity or any other characteristic or status protected by applicable in accordance with federal, state and local laws.  If you'd like more information about your EEO rights as an applicant under the law, please download the available EEO is the Law document at http://www1.eeoc.gov/employers/poster.cfm.  To view our Pay Transparency Statement, please click here: Pay Transparency Statement   PI135001076",data scientist
"At Lockheed Martin, we are passionate about innovation and integrity. We believe that by applying the highest standards of business ethics and forward-thinking, everything is within our capacity – and yours as a Lockheed Martin employee. Lockheed Martin values your skills, training, education and background.  AS THE SR. ENGINEERING RECORDS AND DATA ANALYST YOU WILL: Provide support to professional engineering staff in the release of engineering drawings, job packages, and/or other technical data for a program or a technical engineering group.  Understands data organization and management, familiarity using office software including PDF conversion and editing tools, file editing and document marking, record keeping and metrics.  Tracks, statuses, and retains control of the engineering release process for assigned area.  Controls procedural checking of engineering job packages and maintains central control of engineering release.  Proficiency working with technical engineering personnel and other professionals such as Legal and management and with a variety of departments such as Manufacturing Operations, Quality, and Supply Chain.  Must have excellent communication and demonstrated professional interaction skills, and the ability to work alone and in a team environment.  In addition to the responsibilities highlighted above we offer extensive benefits to include competitive 401k and insurance. We remain an equal opportunity company. Basic Qualifications: Understands data organization and management, familiarity using office software including PDF conversion and editing tools, file editing and document marking, record keeping and metrics. Must have excellent communication and demonstrated professional interaction skills, and the ability to work alone and in a team environment. Must be flexible to work various schedules and overtime when required. May require light lifting of office supplies and boxes of documentation. Desired Skills: Ability to organize and schedule work to achieve on-time data delivery with zero errors. Proficient using Microsoft Office applications such as Word, Excel, PowerPoint, and email such as Microsoft Outlook. Proficiency working with technical engineering personnel and other professionals such as Legal and management and with a variety of departments such as Manufacturing Operations, Quality, and Supply Chain. Willingness to learn new job-related skills and share knowledge with others. BASIC QUALIFICATIONS: job.Qualifications  Lockheed Martin is an Equal Opportunity/Affirmative Action Employer. All qualified applicants will receive consideration for employment without regard to race, color, religion, sex, pregnancy, sexual orientation, gender identity, national origin, age, protected veteran status, or disability status. Join us at Lockheed Martin, where your mission is ours. Our customers tackle the hardest missions. Those that demand extraordinary amounts of courage, resilience and precision. They’re dangerous. Critical. Sometimes they even provide an opportunity to change the world and save lives. Those are the missions we care about.  As a leading technology innovation company, Lockheed Martin’s vast team works with partners around the world to bring proven performance to our customers’ toughest challenges. Lockheed Martin has employees based in many states throughout the U.S., and Internationally, with business locations in many nations and territories. EXPERIENCE LEVEL: Hourly/Non-Exempt",data scientist
"Summary Senior Data Analyst - CPG Insights  We are currently seeking a Senior Data Analyst - CPG Insights for IN Connected Marketing, a division of Advantage Solutions. IN Connected Marketing provides strategic leadership and data-driven outputs for key retailers/customers aligning with brand/business needs. This role serves as the key partner in providing insights to business climate, trends and performance marketing outcomes. The Sr. Data Analyst will be the ingenuity behind making smart business decisions and providing independent perspective on how to optimize activation results.  This role reports directly to the Sr. Director, Analytics and will work closely with our client teams.  Requirements include: 5-8 years proven success as a Category Manager, Data Science Analyst, Marketing / Business Operations Analyst, Retailer Loyalty Analyst, working with CPG insights utilizing data or systems to support marketing or agency activation programs or services Microsoft Office experience: Mastery of Excel, Word, PowerPoint Syndicated Data experience: Mastery of IRI, Nielsen, and other relevant platforms preferred Proven analytical skills with the ability to interpret data, problem solve, and translate into action-oriented recommendations and deep experience with application of shopper panel data Experience with data aggregation/BI tools is a plus (Sisense, Tableau, Google Analytics, etc.) Experience with digital media measurement is preferred Understanding and application of principles and practices of Category Management (analysis of assortment, pricing, promotion, shelving, shopper) required Ability to confidently work with client, customer, and internal leadership Excellent client presentation skills. Responsibilities The Company is one of North America’s leading sales and marketing agencies specializing in outsourced sales, merchandising, category management and marketing services to manufacturers, suppliers and producers of food products and consumer packaged goods. The Company services a variety of trade channels including grocery, mass merchandise, specialty, convenience, drug, dollar, club, hardware, consumer electronics and home centers. We bridge the gap between manufacturers and retailers, providing consumers access to the best products available in the marketplace today.  Position Summary: Sr. Data Analyst provides strategic leadership and data-driven outputs for key retailers/customers aligning with brand/business needs. This role serves as the key in-agency partner on managing inputs and outputs of our proprietary data-management system. The Sr. Data Analyst will be the ingenuity behind making smart business decisions and providing independent perspective on how to optimize activation results. The Sr. Data Analyst will be empowered to develop, create and manage a centralized data repository for all post promotion analysis, campaign results or individual tactical executions that provides dynamic search capability for these records or tactical benchmarks, feeding predictive models and plan forecasts. This position will require aggregation and synthesis of data and translation of insights free from direct manager support. Measures range from POS / Panel to tactical metrics defined by the media or tactic type (e.g., impressions, redemptions, CTR, etc.).  Essential Job Duties and Responsibilities:  Data Management/Analysis Independently develop, create and manage a centralized data repository in programming language (SQL, R, Python, etc.) or by recommending data visualization or manipulation software (Google Data Studio, Tableau, etc.) Lead the preparation of data analysis needs, developing and monitoring project progression Comprehend data process flows through various relational databases, 3rd party or proprietary Facilitate transition to new data warehousing – developing new scripts/code, optimizing process flows and on-boarding relevant users to ensure methodologies and algorithms run properly on new software and production is uninterrupted Be the champion of and provide ongoing maintenance of proprietary database which is designed to track campaign performance including vendor / supplier metrics and engagement results Promote, provide strategic thought leadership based on insights derived from trend data analysis, translate the findings into actionable recommendations for client / team usage  Client/Customer Engagement Engages in the on-going business planning process for each assigned client, focusing on shopper-based strategies and initiatives Interface with and provide data support to account, planning and creative teams Manage and deliver data support to the agency, client and creative team including competitive insights, syndicated/research data analysis, and custom client research to drive client shopper programs Interface with Agency client service (field and brand facing departments), client research departments, and outside research resources, to secure data for use in the post-program strategic analysis tool Support team by providing shopper-based rationale, requiring independent strategic thought / perspective for incremental shopper-funding requests  Presentation Development/Delivery Creates insight driven presentations with actionable tactics and strategies Develops creative presentations with an eye toward story-telling, focused on flow, visualizations, headlines, and using Branding Guidelines Provide and collaborate on support for the development of strategic data-driven frameworks, recommendations and marketing decisions as it relates to specific client projects  Supervisory Responsibilities: Direct Reports This position does not have supervisory responsibilities for direct reports Indirect Reports Does not have direct reports, but may delegate work of others and provide guidance, direction and mentoring to indirect reports  Travel and/or Driving Requirements Travel is an essential duty and function of this job. Driving is not an essential duty or function of this job. Travel up to 5%  Minimum Qualifications The following are the minimum job-related qualifications which an individual needs in order to successfully perform the essential duties and responsibilities of the job  Education Level: (Required) Bachelor's Degree or equivalent experience (Preferred) Master's Degree or equivalent experience  Field of Study/Area of Experience: Marketing/Social Sciences, Psychology or Business or equivalent job-related experience 5-8 years proven success as a Category Manager, Data Science Analyst, Marketing / Business Operations Analyst, Retailer Loyalty Analyst, etc. working with retailers and clients that utilize data or systems to support marketing or agency activation programs or services  Skills, Knowledge and Abilities Intellectually curious, eager to problem solve, and a quick learner Well-organized and strong attention to detail and accuracy Demonstrated ability to work with large data sets; appetite for numbers and analytics Equal balance of being inquisitive, curious and creative, visually articulate Deep experience with application of shopper panel data and geodemographic data sets Ability to work independently in a fast-paced environment Ability to work effectively and collaboratively as part of a team; a hunger for “winning together” Ability to confidently work with client, customer, and internal leadership Demonstrated ability to effectively prioritize business requests Creativity…. with a passion for building visually compelling presentations Good communication – written and oral – skills and strong interpersonal skills Strong work ethic and desire to succeed (often with minimal supervision) Demonstrate forward-looking, strategic thinking ability Proven analytical skills with the ability to interpret data, problem solve, and translate into action-oriented recommendations and directions. Ability to lead a client through a customer-driven, shopper-based strategic category plan. Microsoft Office experience: Mastery of Excel, Word, PowerPoint Syndicated Data experience: Mastery of IRI, Nielsen, and other relevant platforms preferred Understanding and application of principles and practices of Category Management (analysis of assortment, pricing, promotion, shelving, shopper) required Utilization of programming language: SQL, R, Python, etc. or related data systems / tools such as Google Analytics (Data Studio), Adobe Analytics, Tableau, etc. highly preffered  Environmental & Physical Requirements Office / Sedentary Requirements Incumbent must be able to perform the essential functions of the job. Work is performed primarily in an office environment. Typically requires the ability to sit for extended periods of time (66%+ each day), ability to hear the telephone, ability to enter data on a computer and may also require the ability to lift up to 10 pounds.  Additional Information Regarding Advantage Solutions Job Duties and Job Descriptions Job duties include additional responsibilities as assigned by one’s supervisor or other manager related to the position/department. This job description is meant to describe the general nature and level of work being performed; it is not intended to be construed as an exhaustive list of all responsibilities, duties and skills required for the position. The Company reserves the right at any time with or without notice to alter or change job responsibilities, reassign or transfer job position or assign additional job responsibilities, subject to applicable law. The Company shall provide reasonable accommodations of known disabilities to enable a qualified applicant or employee to apply for employment, perform the essential functions of the job, or enjoy the benefits and privileges of employment as required by the law.  Any estimate, schedule, or guideline provided to associates in this job description or elsewhere in connection with their jobs is only intended to help describe job duties and for planning purposes. Regardless of any such estimate, schedule, or guideline, associates must always record all time worked for our company (which includes but is not limited to on-site work time in an assigned store, office, or other work location; required waiting time; administrative time; and work-related travel time). Important Information The above statements are intended to describe the general nature and level of work being performed by people assigned to this position. They are not intended to be an exhaustive list of all responsibilities, duties and skills required of associates so classified. The Company is committed to providing equal opportunity in all employment practices without regard to age, race, color, national origin, sex, sexual orientation, religion, physical or mental disability, or any other category protected by law. As part of this commitment, the Company shall provide reasonable accommodations of known disabilities to enable an applicant or employee to apply for employment, perform the essential functions of the job, or enjoy the benefits and privileges of employment as required by the law.",data scientist
"Develop and maintain a state-of-the-art data management environment to enable innovative Marketing and Sales analytics for Siemens Healthineers. Design, build, optimize, monitor, and manage complex data flows. Successfully collaborate with global stakeholders from the Siemens Healthineers sales and CRM community. Collaborate with internal and external IT and business partners on establishing and managing data interfaces to operative IT systems. Define and establish data marts for global analytics use cases. Establish a data quality framework and support our data catalog initiative with the goal to ensure high quality sales and Marketing and Sales data. Support stakeholders across the world to build impactful descriptive, predictive, and prescriptive analytics use cases.  Essential Job Functions: Build meaningful business data marts by transforming data from technical data lake layer into business friendly KPIs and data marts Collaborate with various stakeholder by translating business requirements into data pipeline designs and implement those Build and manage best in class data marts by understanding, transforming, and managing complex data structures Manage, monitor and optimize data pipelines and build highly efficient and automated data lineage for analytics use cases Manage and collaborate with internal and external stakeholders such as IT vendors and local sales organizations Support implementing & innovating tools and techniques in data management, data catalogue and data quality management Design, build and integrate data pipelines for machine learning and advanced analytics use cases Successfully collaborate on eye level with stakeholders in Marketing and Sales and other cross domain (e.g. Supply Chain, Customer Service, Pricing Excellence  Critical Competencies: Proficiency in designing, managing, monitoring, and administrating data pipelines and data structures Hands-on experience and appreciation working with low code environments in data management (e.g. KNIME, Alteryx, SAS) Ability to translate complex problems into simple technical solutions Ability to abstract data problems into re-usable components/modules Lifetime willingness to learn and explore new technologies (e.g. Cloud technology, web scraping, artificial intelligence) Strong orientation towards quality and results (attention to detail and standardization) Project management capabilities and experiences in IT implementations Good presentation and communication skills Analytical and out of the box thinking Natural drive for innovation and optimization Teamwork oriented collaborative attitude  Education/Qualifications: Bachelor’s degree in computer science, math, physics, engineering, or related fields. Hands-on knowledge and experience on data pipeline modeling, data transformation and data quality management Experience working with database technologies (preferably Snowflake) Profound knowledge and hands-on experience with advanced analytics tools such as Phyton Understanding of Marketing and Sales processes Proficient English plus an additional foreign language is preferred Knowledge on data visualization such as Qlik or PowerBI is preferred Knowledge of Azure cloud environment is preferred Understanding of Agile methods Business experience in the field of medical imaging technology and diagnostics preferred. Experience in working with multinational teams and/or different countries and cultures.  This description is not intended to document all aspects of the role; other duties as assigned.  Organization: Siemens Healthineers Company: Siemens Medical Solutions USA, Inc. Experience Level: Experienced Professional Job Type: Full-time  Equal Employment Opportunity Statement Siemens is an Equal Opportunity and Affirmative Action Employer encouraging diversity in the workplace. All qualified applicants will receive consideration for employment without regard to their race, color, creed, religion, national origin, citizenship status, ancestry, sex, age, physical or mental disability unrelated to ability, marital status, family responsibilities, pregnancy, genetic information, sexual orientation, gender expression, gender identity, transgender, sex stereotyping, order of protection status, protected veteran or military status, or an unfavorable discharge from military service, and other categories protected by federal, state or local law.  EEO is the Law Applicants and employees are protected under Federal law from discrimination. To learn more, Click here.  Pay Transparency Non-Discrimination Provision Siemens follows Executive Order 11246, including the Pay Transparency Nondiscrimination Provision. To learn more, Click here.  California Privacy Notice California residents have the right to receive additional notices about their personal information. To learn more, click here.",data scientist
