JobDesc,JobTitle
"Requisition ID: 285292 Work Area: Software-Development Operations Expected Travel: 0 - 10% Career Status: Student Employment Type: Intern  COMPANY DESCRIPTION SAP started in 1972 as a team of five colleagues with a desire to do something new. Together, they changed enterprise software and reinvented how business was done. Today, as a market leader in enterprise application software, we remain true to our roots. That’s why we engineer solutions to fuel innovation, foster equality and spread opportunity for our employees and customers across borders and cultures. SAP values the entrepreneurial spirit, fostering creativity and building lasting relationships with our employees. We know that a diverse and inclusive workforce keeps us competitive and provides opportunities for all. We believe that together we can transform industries, grow economics, lift up societies and sustain our environment. Because it’s the best-run businesses that make the world run better and improve people’s lives.  About the SAP Internship Experience Program The SAP Internship Experience Program is SAP’s global, strategic, paid internship program that provides university students with opportunities to find purpose in their careers.  Three reasons to intern at SAP Culture of collaboration: meet with mentors, make new friends across the globe and create a thriving personal network. Project-driven experience: gain cross-functional skills from our virtual and in-person learning sessions, diverse subject matter experts, and project deliverables. Gain visibility: with SAP Internship Experience Program in your title, you’ll have a global network of SAP leaders, entrepreneurs and career development opportunities at your fingertips.  About the team The SAP Innovation Center at Newport Beach, California is looking for a highly motivated data science intern to join the team for an internship. This is a remote position for pacific time zone. In case the situation permits, office visits in Newport Beach, CA will be possible. In this role, you will be able to work on concrete data science projects and experiments involving machine learning, deep learning, and natural language processing.  The SAP Innovation Center is a global and diverse team with locations around the world. You will get the opportunity to build and contribute to solutions that future-proof SAP.  https://icn.sap.com/  What you’ll do: Position title: SAP Innovation Center iXp Intern – Data Scientist Location: Newport Beach, CA – please note that roles will be remote until local guidelines ensure safe office reopenings Expected start date: June 7, 2021 (flexible). Internship will be for 6 months duration  In this role, you’ll: Work though the end-to-end data science lifecycle including problem formulation, data exporation, data cleaning, model building, cross validation, and hypothesis testing. Work with state-of-the-art AI models, particularly in natural language processing, and leverage them to solve concrete data science problems. Collaborate with stakeholders to ensure the solution you design solves the problem. Gain first hand experience on dealing with real world data. Potentially advance the state-of-the-art and, if successful, produce an academic paper to be submitted to a conference (depends on project).  Who you are: We’re looking for someone who takes initiative, perseveres, and stay curious. You like to work on meaningful innovative projects and are energized by lifelong learning. Strong programming skills in Python and familiarity with ML libraries such as Numpy, Pandas, Sci-kit Learn, Tensorflow, Pytorch, etc. Understanding of machine learning fundamentals such as supervised learning, unsupervised learning, classification, and regression. Mathematical foundations in statistics and probability, optimization algorithms, and linear algebra. Currently enrolled in a master’s degree program which is applicable to the position (computer science, data science, or equivalent proven experience) Strong communication skills that include the ability to effectively articulate technical challenges and solutions. Preferred: some exposure to deep learning and/or natural language processing.  Follow @SAPiXp on Instagram and don’t miss anything about our experiences worldwide!  #LI-Remote  WHAT YOU GET FROM US Success is what you make it. At SAP, we help you make it your own. A career at SAP can open many doors for you. If you’re searching for a company that’s dedicated to your ideas and individual growth, recognizes you for your unique contributions, fills you with a strong sense of purpose, and provides a fun, flexible and inclusive work environment – apply now. SAP'S DIVERSITY COMMITMENT To harness the power of innovation, SAP invests in the development of its diverse employees. We aspire to leverage the qualities and appreciate the unique competencies that each person brings to the company. SAP is committed to the principles of Equal Employment Opportunity and to providing reasonable accommodations to applicants with physical and/or mental disabilities. If you are interested in applying for employment with SAP and are in need of accommodation or special assistance to navigate our website or to complete your application, please send an e-mail with your request to Recruiting Operations Team. (Americas:Careers.NorthAmerica@sap.com or Careers.LatinAmerica@sap.com, APJ: Careers.APJ@sap.com, EMEA: Careers@sap.com). Requests for reasonable accommodation will be considered on a case-by-case basis. Successful candidates might be required to undergo a background verification with an external vendor. EOE AA M/F/Vet/Disability: Qualified applicants will receive consideration for employment without regard to their age, race, religion, national origin, gender, sexual orientation, gender identity, protected veteran status or disability. Successful candidates might be required to undergo a background verification with an external vendor. Additional Locations: Virtual - USA",Data Scientist
"We are looking for a Data Scientist who will support our product, sales, leadership and marketing teams with insights gained from analyzing company data. The ideal candidate will be intricately involved in running analytical experiments in a methodical manner and will regularly evaluate alternate models via theoretical approaches. They must have a proven ability to drive business results with their data-based insights. Primary Responsibilities: Understanding data flow in a large, distributed system. Designing, coding and executing data investigations. Performing robust statistical analyses. Producing internal presentations, customer reports and visualizations to summarize the conclusions. Handle a diverse set of problems ranging from probabilistic interference on phone trajectories, data fusion between noisy sensors, modeling and classification of driving behavior, and data visualization. All other duties as assigned.  Qualifications: Masters or PhD in Computer Science, Mathematics, or related field. 3+ years performing data analysis on real world figures. Strong programming skills for constructing and understanding data pipelines, particularly in Python (scipy/numpy) and SQL. Experience with modern/emerging scalable computing platforms and languages (e.g.Spark). Strong computer skills including MS Office Suite, Google docs and other needed software platforms. Excellent oral, written and listening skills. Entrepreneurial spirit, desire to be part of an early stage startup. Bootstrapping mindset but obsessive about quality. Positive attitude with superior interpersonal skills. Honest and dependable. Comfortable working across every level of an organization including company executives. Team player with the ability to display sensitivity, tact and responsiveness with current and prospective employees. Self-starter who accomplishes major tasks and initiatives with little supervision. Business-to-business experience a plus. Organized proactive problem solver. Ability to handle confidential and sensitive information.  If you want to fill this role, tell us why at jobs@driveway.ai",Data Scientist
"Primary Location: 195 Technology Dr, Irvine, CA, USA Division: Cox Automotive Job Level: Individual Contributor Travel: Yes, 5 % of the Time Schedule: Full-time Shift: Day Job Requisition Number: 213730 Our data scientists are responsible for leading the development of advanced analytics models to solve our customers problems through innovative products and services; and inform internal business operations and strategy. They will work closely with product, engineering, and our business stakeholders as the subject matter expert on the application mathematical modeling across our family of leading automotive brands. The Data Scientist II works under the direction of senior data science staff and contributes to all phases of an analytics project. The scope of work includes the analysis and preparation of data, the development of specified models, and the compilation of results. The Data Scientist II works under the direction of senior data science staff and contributes to all phases of an analytics project. The scope of work includes the analysis and preparation of data, the development of specified models, and the compilation of results. PRIMARY DUTIES/KEY RESPONSIBILITES: Under the direction of senior team members, contribute to all phases of an analytics project, including formulation, research, development, implementation, testing, and maintenance. Present findings to peers and data science leadership. Maintain an awareness of trends in the field and research and suggest new methodologies. Qualifications: BS/BA with 3 years experience; MS with up to 2 years experience. Degree in Statistics, Operations Research, Applied Mathematics, Computer Science, Economics, or related quantitative field. Strong problem-solving skills. A drive to learn and master new technologies and techniques. Proven experience applying descriptive, predictive, and prescriptive statistics to real-world problems. Experience in general programming language, e.g., Python. Experience querying relational databases using SQL. An understanding of one or more of the following strongly preferred: Statistics: Generalized linear models, time series models, and forecasting techniques. Operations Research: Linear and mixed integer optimization and discrete event simulation. Machine Learning: Common supervised and unsupervised ML models, including decision trees, nearest neighbor models, and neural nets; and a standard ML library, e.g., scikit-learn, TensorFlow. Experience with product development strongly preferred. Experience creating compelling data visualizations strongly preferred. Other duties as needed or required. Requires physical ability and mental acuity to execute the duties of the position successfully within required timeframes in order to meet business requirements.  Who We Are About Cox Automotive Theres nothing ordinary about Cox Automotive. We are people of every background driven by our passion for mobility, innovation, client success and community outreach. We make buying, selling and owning (or simply using) cars easier for everyone. Touching more than 40,000 clients across five continents, we bring together the best brands and the best teams to propel the automotive industry forward. Some of those team members work for our iconic consumer brands like Autotrader and Kelley Blue Book, while others are creating the future of automotive at industry-facing brands like Dealer.com, Manheim and vAuto. About Cox We are the Cox family of businesses. Weve been making our mark since 1898 by building and evolving world-class businesses, staying true to our values, and encouraging top talent to always look for growth and impact while building a career with us. Our primary divisions - Cox Communications and Cox Automotive - are driving a new wave of innovation, powering smart cities with powerhouse broadband communications and pioneering greener, more progressive transportation alternatives for individuals and fleet operators. Were also expanding into new spaces like cleantech and healthcare to rev up our momentum toward building a better future for the next generation. Were looking for the talent today who will be our leaders tomorrow. Sound intriguing? Learn more about where we are today, where we hope youll be going with us, and the common purpose that unites us at coxenterprises.com. Cox is an Equal Employment Opportunity employer - All qualified applicants/employees will receive consideration for employment without regard to that individuals age, race, color, religion or creed, national origin or ancestry, sex (including pregnancy), sexual orientation, gender, gender identity, physical or mental disability, veteran status, genetic information, ethnicity, citizenship, or any other characteristic protected by law. Statement to ALL Third-Party Agencies and Similar Organizations: Cox accepts resumes only from agencies with which we formally engage their services. Please do not forward resumes to our applicant tracking system, Cox employees, Cox hiring manager, or send to any Cox facility. Cox is not responsible for any fees or charges associated with unsolicited resumes.",Data Scientist
"Exponent is a leading engineering and scientific consulting firm that brings together more than 90 different disciplines to solve the most pressing and complicated challenges facing stakeholders today. Our vision is to engage the brightest scientists and engineers to empower clients with solutions for a safe, healthy, sustainable and technologically complex world. We leverage over 50 years of experience in analyzing accidents and failures to advise clients as they innovate their technologically complex products and processes, ensure the safety and health of their users, and address the challenges of sustainability. We offer opportunities for you to expand your engineering or scientific knowledge amidst experts from top programs at over 500 universities. At Exponent, you will apply your experience, technical skills, and prior academic research to a fulfilling career in consulting. You will have the opportunity to develop continuously through formal and informal development programs, coaching and mentoring, and involvement in a wide array of projects. We are excited about your interest in joining our growing team! Key statistics: 1100+ Team members 900+ Consultants 550+ Ph.D.s 30+ Offices globally We are currently seeking a Data Scientist for our Data Sciences Practice in Irvine, CA. In this role, will work as part of a team to rapidly implement and iterate algorithms, databases, analyses, and visualizations to support clients in the consumer electronic, utilities, and life sciences. You will be responsible for: Building and managing databases using a wide variety of data inputs and systems Developing cloud-based storage, compute, and database pipelines including client facing visualizations of key decision metrics Providing expertise in machine learning, data analytics, and software development for a wide range of data including text, images, medical records, and sensor data Collaborating with multi-disciplinary teams to support data projects across many different industries You will have the following skills and qualifications: Ph.D. in Physics, Applied Mathematics, Statistics, Computer Science, or a related engineering/scientific field (such as Electrical Engineering, Computer Engineering, Computational Chemistry, Bioinformatics or Computational Biology) Demonstrated experience and expertise in one or more of the following areas: Data Engineering Data Analysis and Visualization Machine Learning Deep Learning Natural Language Processing Computer Vision Software Development Resource Management Distributed Systems Proficiency with the following is required: Python, SQL Experience with as many of the following is preferred: R, SAS, MATLAB, JupyterLab, Scala, Tableau, Microsoft Power BI, Qlik, TensorFlow, Keras Experience with as many of the following is preferred: Amazon Web Services (AWS), Microsoft Azure, Google Cloud Platform (GCP) Experience developing software for a range of platforms (PCs, Linux, mobile, embedded devices, etc.) is preferred The desire to work with a diverse set of clients and engage in work outside of the traditional data science field Strong practical engineering ability combined with leadership and project management skills Excellent verbal and written communication skills Ability to work independently and in multidisciplinary teams Our contracts with the United States Government for this position require proof of U.S. citizenship and the possession of or ability to obtain a DoD security clearance To learn more about life at Exponent and our impact, please visit the following links: https://info.exponent.com/our-impact www.exponent.com/careers/grad-students We value and encourage diversity and inclusivity across all facets of our firm. Having a team built of people with different backgrounds, skills and perspectives allows us to provide better value to our clients and enjoy an enriched work environment. Our firm is committed to offering a variety of programs and resources to support health and well-being. We believe that providing competitive benefits as well as compensation and recognition programs empowers our staff to do work that makes a difference. Exponent is a proud equal opportunity employer. All qualified applicants will receive consideration for employment without regard to race, color, religion, sex, national origin, veteran status, disability, sexual orientation, gender identity, or any other protected status. If you need assistance or accommodation due to a disability, you may call us at +1 (650) 688-6968 or email hr@exponent.com.",Data Scientist
"Worker Sub-Type: Regular Job Description: This position is open to remote applicants. THE POSITION We’re looking for a Senior/Principal Data Scientist to join the BlackBerry Data Science team. At BlackBerry, we develop state-of-the-art machine learning algorithms to solve long-standing problems in computer security. We discover novel ML techniques and applications, build systems to handle petabytes of extremely high dimensional data, and protect people from bad guys. With machine learning at the heart of all of BlackBerry’s cybersecurity products, the Data Science team is a critical, highly visible, and high-impact team within the company. The team brings together experts from machine learning, stats, computer science, computer security, and various applied sciences, with backgrounds including deep learning, Bayesian statistics, time-series modeling, topology, scalable data processing, and software engineering. WHAT YOU WILL DO Invent novel machine learning techniques to solve important problems in computer security Improve upon existing machine learning techniques used within BlackBerry Write code that scales to very large datasets, often with millions of dimensions and billions of rows Discover ways to strengthen machine learning models against adversarial attacks Lead research efforts and advise junior team members when needed Collaborate with product and engineering teams to turn ML prototypes into new products or features Publish papers and present research at conferences, including ML/AI/Stats conferences, as well as security conferences like Black Hat, DEFCON, and RSA Stay abreast of the latest publications and state-of-the-art techniques in relevant research communities (e.g., ML and stats) Consult with other teams within BlackBerry to help guide their use of machine learning WHAT WE ARE LOOKING FOR Extensive theoretical and hands-on knowledge of machine learning and deep learning Strong math skills, including Bayesian methods, statistics, linear algebra, and optimization Significant experience with python and at least one deep learning library (e.g., pytorch or tensorflow) Excellent oral and written communication skills Kindness and a deep willingness to help and collaborate with others 3+ years in industry with a PhD or 6+ years with a Master’s degree TECHNOLOGIES WE USE Python and libraries like pytorch, tensorflow, numpy, pandas, sklearn, and scipy Git Linux/UNIX Various AWS services including EC2 and S3 Occasional usage of other languages including SQL, PySpark/Scala, and C# ABOVE AND BEYOND Experience within cybersecurity Job Family Group Name: Product Development Scheduled Weekly Hours: 40",Data Scientist
