JobDesc,JobTitle
"Full Stack Web Developer - Awesome Culture, Exciting Growth, Great Pay! Full-Stack Developer Job Listing and Description Introduction: Gorilla Mind is a rapidly growing e-commerce company selling fitness and health supplements through various online channels. To support our continued success and growth, we seek to expand our team with another full-stack developer who can work in person at our offices in Boise, ID. Primary Responsibilities: Write efficient, reusable, and reliable code for our website and internal systems. Develop and maintain custom components for integration into Shopify theme(s) Test, troubleshoot and debug applications to optimize performance and reliability Design mock-ups and wireframes to refine project layouts before development Document code, software systems, processes, and update old documentation Identify user, system, and functional requirements for new projects and tasks Estimate and prioritize workload, set timelines, assign tasks to team members Coach, mentor, and assist junior developers across multiple projects and teams Participate in code reviews to identify potential issues and share best practices. Preferred Qualifications: Every applicant is expected to have substantial front-end and back-end development experience. Additionally, the ideal candidate for this position has the following qualifications: Prior experience working as a full-stack developer or web developer Computer science degree or equivalent experience Expertise in at least one programming language, preferably JavaScript Practiced and experienced in all phases of the software development lifecycle Strong understanding of HTML, CSS, and layout of web pages & applications Experience creating schemas, querying, updating, and managing databases Experience with creating and digesting REST (or SOAP) APIs Practiced utilizing one or more front-end frameworks (Angular, React, Vue, etc.) Experienced with programming in one or more server-side languages (Node.js, Python, PHP, Ruby, etc.) Strong understanding of security practices and protecting sensitive data Familiarity with responsive design practices and implementation Experience using Git and an understanding of the GitHub workflow Proficient in using Microsoft Office (Word, Excel, Outlook, PowerPoint) and Google Apps (Gmail, Drive, Docs, Sheets, Slides) Supplementary Qualifications: We understand that each candidate has a unique background and experience. The following qualifications are not required but can strengthen the candidacy for applicants: Experience developing Shopify theme(s), apps, and using the Themekit CLI Practiced in agile/scrum development methodology Ability to calculate computational and spatial complexity of algorithms (Big-O) Experience with search engine optimization (SEO) Familiar with web accessibility and implementation Experience creating elegant and effective user interfaces and experiences Strong familiarity and practice in using common data structures Familiarity with using network diagnostic tools Experience using user-interface prototyping tools (Adobe XD, Figma, Framer, etc.) Experience using Adobe Photoshop and Illustrator Awarded relevant industry certifications Non-Technical Qualifications: A friendly, charismatic, positive individual who enjoys working with others Excellent written and verbal communication skills Strong desire to learn and enhance existing skills Highly creative enjoys developing solutions for challenging problems Strong attention to detail, focused on creating pixel-perfect experiences Proactively identifies and resolves issues Values integrity, is a self-starter, and can be trusted to work independently (and remotely) Experience managing a team and training individuals on new skills Ability and willingness to take direction Adaptable to a rapidly changing business environment Ability to present information to peers, stakeholders, and groups of individuals Employee Compensation: Compensation is determined by experience and may be subject to a 3-month evaluation: Salary: $60,000 - $90,000 yearly Bonus: Discretionary bonuses may be awarded based on performance Employee Benefits: *Competitive salary Paid time off (PTO) 401(k) retirement plan with matching contributions Maternity & paternity leave Employee discount Additional Information: Gorilla Mind is proud to be an equal opportunity employer. All qualified applicants will be considered without regard to age, race, religion, ethnicity, gender identity, sexual orientation, national origin, disability, marital status, or any other status protected under federal, state, and local laws. Related keywords: software engineer, full stack developer, java developer, software developer, web developer Job Type: Full-time Pay: $60,000.00 - $90,000.00 per year Benefits: 401(k) 401(k) matching Employee discount Paid time off Schedule: 8 hour shift Supplemental Pay: Bonus pay Education: Bachelor's (Preferred) Experience: JavaScript: 2 years (Required) Angular: 2 years (Preferred) Work Location: One location Company's website: gorillamind.com COVID-19 Precaution(s): Personal protective equipment provided or required Social distancing guidelines in place Sanitizing, disinfecting, or cleaning procedures in place",software engineer
"Wake up in the morning inspired to make an impact. Contribute your skills and experiences to meaningful projects. Learn and grow with a high performing team. Are you a cleared software engineer ready for more MEANINGFUL and IMPACTFUL work? Well, this is the perfect time to start exploring your next opportunity. We are supporting the efforts of two world-class, IT consulting leaders looking for software engineers to ramp up immediately to meet the demands for new projects. Our clients tackle unique challenges and provide fantastic opportunities for growth and development. Requirements/Responsibilities You MUST be MASTERFUL in at least one of the following: Java Python AWS You MUST embody the following values: Mindset: You are open and willing to learn and evolve Contribution: You value your time and energy for meaningful results Candor: You value open communication and feedback You MUST be willing to learn and work across a diverse tech stack: AWS, Azure, GCP Angular.js, Node.js, React.js Jenkins, Bamboo, Chef Docker, Kubernetes, OpenShift Clojure, Django, Flask PostgresSQL, MongoDB, Cassandra GitHub, Confluence, Jira Apply Once, Choose from Multiple Projects Our diverse set of projects offers you various opportunities to choose from, ranging from developing the latest aerospace systems to a leading-edge eCommerce solution. As a Full Stack Engineer, you will: Design and develop the tech architecture that best fits the project needs Build next generation solutions that have great impacts on society Collaborate with high performing teams to design and launch new features The Talent Gravity Approach Talent Gravity is an innovative IT talent agency. We lead the way for high performers to cultivate more meaningful and challenging careers. Our unique 5 Step Talent Management Approach moves you beyond automated skills matching and avoids opaque interview processes that lead to unfulfilling work. Customized performance insights One-on-one career coaching Career profile enhancement and branding Authentic matching with top notch companies Ongoing mentoring to help keep you on track Job Type: Full-time Pay: From $123,000.00 per year Benefits: 401(k) 401(k) matching Dental insurance Flexible spending account Health insurance Health savings account Referral program Retirement plan Schedule: Monday to Friday Supplemental Pay: Bonus pay Application Question(s): Are you masterful in one or more of the following? - AWS / Java / Python Experience: hands on software development: 5 years (Preferred) Security Clearance: Top Secret (Required) Work Location: Multiple locations This Job Is Ideal for Someone Who Is: Adaptable/flexible -- enjoys doing work that requires frequent shifts in direction Achievement-oriented -- enjoys taking on challenges, even if they might fail Innovative -- prefers working in unconventional ways or on tasks that require creativity This Job Is: A job for which military experienced candidates are encouraged to apply A job for which all ages, including older job seekers, are encouraged to apply Company's website: https://www.talentgravity.com/ Work Remotely: Temporarily due to COVID-19 COVID-19 Precaution(s): Remote interview process Virtual meetings",software engineer
"Our Company We manage the online marketing and web visibility for over 15,000 professional firms. Recognized six years as one of America’s Fastest-Growing Private Companies by Inc. Magazine, Nifty is the premier online marketing solutions for doctors, dentists, lawyers and financial professionals nationwide – think of us as a next generation ad agency with 15,000+ clients. Working at Nifty The people at Nifty are passionate about their work and are driven by innovation. Each and every day we strive for excellence. Our work environment is equal parts casual and professional. We’re serious about our business and delivering the best service to our members, but we also make it a priority to keep things fun and exciting. Join the Nifty team, where innovation is the goal hard work is expected, and creativity is rewarded. The Role Nifty is looking for a Java Developer with experience in building high-performing, scalable, enterprise-grade SaaS applications. You will be part of a talented software team that works on mission-critical applications. Java Developer roles and responsibilities include managing Java/Java EE application development while providing expertise in the full software development lifecycle, from concept and design to testing. Responsibilities:  Translate application requirements and use cases into functional applications Design, build, and maintain efficient, reusable, and reliable Java code Ensure the best possible performance, quality, and responsiveness of the applications Identify bottlenecks and bugs, and devise solutions to these problems Help maintain code quality, organization, and automatization Skills: Specific proficiency in: Java, SQL, JavaScript Git, Maven, Eclipse IDE ORM (WebObjects) Front End (ReactJS, WebObjects) Solid understanding of object-oriented programming PostgreSQL DB experience a PLUS Skill for writing reusable Java libraries Strong code debugging skills Ability to work with static code analysis (SonarQube, FindBugs, PMD) Experience in unit testing and code coverage Good understanding of code profiling (visualVM and OQL) Linux command line skills (SSH, grep, psql, etc on CentOS) The best candidate will also experience with: JDBC and JOOQ PostgreSQL AWS Microservices Standalone web server (Apache) Embedded java web servers (Jetty, undertow, or vert.x) Server-side Javascript (NodeJS) GraphQL HTML5, CSS3 WebSockets  Requirements: BS degree in Computer Science, Engineering or a related subject 5 years of experience in an enterprise environment Proven hands-on Software Development experience including a working experience in Java development Object Oriented analysis and design using common design patterns.  Personal Qualities: Team Player - able to provide input into a multifunctional team Adaptable. The role requires a willingness to take on tasks outside of a narrowly defined role. Self-motivated, capable of working with limited supervision, pro-actively reporting on status and tasks. Good communicator at multiple levels and across multiple disciplines. Capable of working to both tactical and strategic timescales. Benefits: Excellent compensation and benefits package Generous vacation and paid holidays Medical, dental, life, and vision plans 401(k) plan Casual dress and frequent team building events  Physical/Mental Requirements for the Job:  Prolonged periods of seating May be requested to work overtime and weekends if deemed necessary Must be able to lift at least 20 pounds Certain management positions might be required to occasional travel",software engineer
"VMware is a global leader in cloud infrastructure and business mobility. VMware accelerates customers’ digital transformation journey by enabling enterprises to master a software-defined approach to business and IT. With VMware solutions, organizations are building extraordinary experiences by mobilizing everything. Our customers are responding faster to opportunities with modern data and apps hosted across hybrid clouds, and safeguarding customer trust with a defense-in-depth approach to cybersecurity. At the core of what we do are our people who deeply value execution, passion, integrity, customers, and community. Do you dare to do the stuff you’ve always dreamed about? Dare to explore at http://careers.vmware.com.  VeloCloud and You We are looking for engineers to join our VeloCloud SD-WAN team. VeloCloud is the only complete solution with all the key elements of a Cloud-Delivered WAN. VeloCloud dramatically simplifies the WAN by delivering virtualized services from the cloud to branch offices and mobile users everywhere. VeloCloud services deliver enterprise grade performance, visibility and control over both Internet and private networks, combining the economy of the Internet with the flexibility of the cloud. More info is available at https://www.vmware.com/solutions/sd-wan.html. You will participate in creative projects, with the authority and scope to apply your expertise in a dynamic and technically driven environment. You’ll be part of a bright engineering team that values open communication, empowerment, innovation, teamwork and customer success. Our engineering team members share a strong focused work ethic and a make-it-happen mindset.  Role Description The VeloCloud Management Plane team builds the Ochestrator that our customers use to configure and monitor their SD-WAN appliance fleet. In addition to a comprehensive GUI, customers can interact with the platform via REST APIs. We are responsible for reporting, dashboarding, and analytics around the large volumes of network and application data that we capture. We also integrate with other platforms and tools to provide a rich ecosystem of services around identity, authentication, alerting, and other such operational concerns.  Responsibilities Understanding the key requirements of the Management feature of the Velocloud product, architecting a solution and delivering a working prototype and the final product. Building a next-generation user interface for administrators managing large fleets of network appliances. Ensuring our web application stays up to date on the latest technologies, promoting excellent code quality, proposing code improvements, providing estimates and defining technical specifications. Drive development from technology selection to product delivery, collaborating with product managers and product designers all along the way to give our users the best possible experience. Required Qualifications Experience building highly available, scalable cloud applications, including server and database layers. Knowledge of the latest technologies used in building system software and applications in the cloud. Intimate familiarity with modern Javascript and UI frameworks, particularly Angular, as well as node.js, MySQL, RESTful APIs is highly desired. Experience with the full lifecycle of UI development from requirements and UX design all the way to release. Strong grounding in UI security, performance, and testability. Experience developing data storage and data access strategies for high volume online transactional systems as well as for offline data analytics Preferred Qualifications A good grasp of interaction design principles. Experience with UIs for enterprise infrastructure products such as compute, storage, and networking products. Strong sense of enterprise product usability and a desire to serve as a champion for the product’s users. Experience developing UIs for visualization of large data sets. Excellent presentation and communication skills combined with the ability to work in a team environment. VMware is an Equal Opportunity Employer and Prohibits Discrimination and Harassment of Any Kind: VMware is committed to the principle of equal employment opportunity for all employees and to providing employees with a work environment free of discrimination and harassment. All employment decisions at VMware are based on business needs, job requirements and individual qualifications, without regard to race, color, religion or belief, national, social or ethnic origin, sex (including pregnancy), age, physical, mental or sensory disability, HIV Status, sexual orientation, gender identity and/or expression, marital, civil union or domestic partnership status, past or present military service, family medical history or genetic information, family or parental status, or any other status protected by the laws or regulations in the locations where we operate. VMware will not tolerate discrimination or harassment based on any of these characteristics. VMware encourages applicants of all ages. VMware will provide reasonable accommodation to employees who have protected disabilities consistent with local law.  Category : Engineering and Technology Subcategory: Software Engineering Experience: Business Leadership Full Time/ Part Time: Full Time Posted Date: 2021-02-16  VMware Company Overview: At VMware, we believe that software has the power to unlock new opportunities for people and our planet. We look beyond the barriers of compromise to engineer new ways to make technologies work together seamlessly. Our cloud, mobility, and security software form a flexible, consistent digital foundation for securely delivering the apps, services and experiences that are transforming business innovation around the globe. At the core of what we do are our people who deeply value execution, passion, integrity, customers, and community. Shape what’s possible today at http://careers.vmware.com.  Equal Employment Opportunity Statement: VMware is an Equal Opportunity Employer and Prohibits Discrimination and Harassment of Any Kind: VMware is committed to the principle of equal employment opportunity for all employees and to providing employees with a work environment free of discrimination and harassment. All employment decisions at VMware are based on business needs, job requirements and individual qualifications, without regard to race, color, religion or belief, national, social or ethnic origin, sex (including pregnancy), age, physical, mental or sensory disability, HIV Status, sexual orientation, gender identity and/or expression, marital, civil union or domestic partnership status, past or present military service, family medical history or genetic information, family or parental status, or any other status protected by the laws or regulations in the locations where we operate. VMware will not tolerate discrimination or harassment based on any of these characteristics. VMware encourages applicants of all ages. Vmware will provide reasonable accommodation to employees who have protected disabilities consistent with local law.",software engineer
"TruckMaster is currently seeking a talented individual with experience in the Java programming language to assist in completion of our Java trucking system product. Qualified individuals will possess at least 3 years on the job experience working with Java and SQL, be self-motivated, and work well with others. Generous salary DOE, health insurance, 401k. To apply for any of these positions, please send your resume and contact details to us at: humanresources@truckmaster.com P.O. Box 501 Jerome, ID 83338 Pho (208) 324-5191 Fax (208) 324-5159",software engineer
