JobDesc,JobTitle
"We are looking for a talented Full Stack Software Engineer to join our team! Business Summary The VMware Engineering Services team ensures our internal and external customers enjoy a high-quality experience across the entire product portfolio. Our goal is to provide compelling, innovative, scalable, and seamless engineering services, which will protect VMware’s brand reputation by continually improving customer satisfaction. We bring together key R&D functions such as build, performance, security, developer tools, and more. We work hand-in-hand with development teams to focus on product innovation and industry-leading solutions. Our priorities include investing in R&D talent, sharing best practices, and driving scale and agility in VMware products. Job Role and Responsibility The VMware Engineering Services team builds web-based services, portals, and components which provide consistent experiences across VMware products. Our applications enable VMware product teams to be able to provide the best-in-class products to our VMware customers. You will apply your imagination and skillset to create experiences that delight our customers. You will join a world-class team respected for its innovation and execution. We are based in Palo Alto on the main campus with great facilities and a comfortable working environment. If you love shipping software that extends the technology frontier, then this is for you! Collaborate with a group of software engineers (local and offshore) to deliver on software projects using proven Agile development methodologies. Work with internal customers to gather requirements to deliver creative solutions that meet needs with respect to functionality, performance, scalability, reliability, and realistic implementation schedules. Work with internal teams drive high levels of customer satisfaction for engineering teams. Required Skills: Hands-on experience working with large scale web applications Expertise with JavaScript/TypeScript and at least one modern framework (Angular/React) as well as HTML/CSS3 Expertise with Java and at least one modern framework (Play/Spring Boot) Proven track record in large scale, enterprise class software development Ability to learn and apply new technologies, design practices, and usability patterns Ability to contribute to end-to-end system architecture, working with back-end engineers, the UX team, product managers, and other technical teams Interpersonal skills and proven ability to deliver on schedule Hands on experience with Container technologies (Docker and Kubernetes) Possess a good sense of performance tradeoffs and optimizations Able to guide collaborate with other engineering and product teams Demonstrate critical thinking and analytical skills Bachelor’s degree in CS, Masters preferred 1-2 years of related experience in the software industry Preferred Skills: UI/UX focused design experience (visual design, user behavioral design, user interactions design, usability, etc.) Experience with Kubernetes, containers and microservices Practical understanding of SDLC, design patterns and frameworks Relational Databases like Postgres and MySQL REST API usage and design This role is flexible and can be done from home, in an office, or a combination of the two anywhere in Arizona, California, Colorado, Nevada, New Mexico, Oregon, Texas, Utah, or Washington. For positions located in Colorado: This role has a minimum base salary which starts at $82,000. Bonus, commission, and/or equity may be eligible for this position. Additional benefits for this position can be found at https://benefits.vmware.com/. *Note: Disclosure of Colorado pay and benefits required per sb19-968.  Category : Engineering and Technology Subcategory: Software Engineering Experience: Manager and Professional Full Time/ Part Time: Full Time Posted Date: 2021-05-03  VMware Company Overview: At VMware, we believe that software has the power to unlock new opportunities for people and our planet. We look beyond the barriers of compromise to engineer new ways to make technologies work together seamlessly. Our cloud, mobility, and security software form a flexible, consistent digital foundation for securely delivering the apps, services and experiences that are transforming business innovation around the globe. At the core of what we do are our people who deeply value execution, passion, integrity, customers, and community. Shape what’s possible today at http://careers.vmware.com.  Equal Employment Opportunity Statement: VMware is an Equal Opportunity Employer and Prohibits Discrimination and Harassment of Any Kind: VMware is committed to the principle of equal employment opportunity for all employees and to providing employees with a work environment free of discrimination and harassment. All employment decisions at VMware are based on business needs, job requirements and individual qualifications, without regard to race, color, religion or belief, national, social or ethnic origin, sex (including pregnancy), age, physical, mental or sensory disability, HIV Status, sexual orientation, gender identity and/or expression, marital, civil union or domestic partnership status, past or present military service, family medical history or genetic information, family or parental status, or any other status protected by the laws or regulations in the locations where we operate. VMware will not tolerate discrimination or harassment based on any of these characteristics. VMware encourages applicants of all ages. Vmware will provide reasonable accommodation to employees who have protected disabilities consistent with local law.",software engineer
"VMware is a global leader in cloud infrastructure and business mobility. VMware accelerates customers’ digital transformation journey by enabling enterprises to master a software-defined approach to business and IT. With VMware solutions, organizations are building extraordinary experiences by mobilizing everything. Our customers are responding faster to opportunities with modern data and apps hosted across hybrid clouds, and safeguarding customer trust with a defense-in-depth approach to cybersecurity. At the core of what we do are our people who deeply value execution, passion, integrity, customers, and community. Do you dare to do the stuff you’ve always dreamed about? Dare to explore at http://careers.vmware.com.  VeloCloud and You We are looking for engineers to join our VeloCloud SD-WAN team. VeloCloud is the only complete solution with all the key elements of a Cloud-Delivered WAN. VeloCloud dramatically simplifies the WAN by delivering virtualized services from the cloud to branch offices and mobile users everywhere. VeloCloud services deliver enterprise grade performance, visibility and control over both Internet and private networks, combining the economy of the Internet with the flexibility of the cloud. More info is available at https://www.vmware.com/solutions/sd-wan.html. You will participate in creative projects, with the authority and scope to apply your expertise in a dynamic and technically driven environment. You’ll be part of a bright engineering team that values open communication, empowerment, innovation, teamwork and customer success. Our engineering team members share a strong focused work ethic and a make-it-happen mindset.  Role Description The VeloCloud Management Plane team builds the Ochestrator that our customers use to configure and monitor their SD-WAN appliance fleet. In addition to a comprehensive GUI, customers can interact with the platform via REST APIs. We are responsible for reporting, dashboarding, and analytics around the large volumes of network and application data that we capture. We also integrate with other platforms and tools to provide a rich ecosystem of services around identity, authentication, alerting, and other such operational concerns.  Responsibilities Understanding the key requirements of the Management feature of the Velocloud product, architecting a solution and delivering a working prototype and the final product. Building a next-generation user interface for administrators managing large fleets of network appliances. Ensuring our web application stays up to date on the latest technologies, promoting excellent code quality, proposing code improvements, providing estimates and defining technical specifications. Drive development from technology selection to product delivery, collaborating with product managers and product designers all along the way to give our users the best possible experience. Required Qualifications Experience building highly available, scalable cloud applications, including server and database layers. Knowledge of the latest technologies used in building system software and applications in the cloud. Intimate familiarity with modern Javascript and UI frameworks, particularly Angular, as well as node.js, MySQL, RESTful APIs is highly desired. Experience with the full lifecycle of UI development from requirements and UX design all the way to release. Strong grounding in UI security, performance, and testability. Experience developing data storage and data access strategies for high volume online transactional systems as well as for offline data analytics Preferred Qualifications A good grasp of interaction design principles. Experience with UIs for enterprise infrastructure products such as compute, storage, and networking products. Strong sense of enterprise product usability and a desire to serve as a champion for the product’s users. Experience developing UIs for visualization of large data sets. Excellent presentation and communication skills combined with the ability to work in a team environment. VMware is an Equal Opportunity Employer and Prohibits Discrimination and Harassment of Any Kind: VMware is committed to the principle of equal employment opportunity for all employees and to providing employees with a work environment free of discrimination and harassment. All employment decisions at VMware are based on business needs, job requirements and individual qualifications, without regard to race, color, religion or belief, national, social or ethnic origin, sex (including pregnancy), age, physical, mental or sensory disability, HIV Status, sexual orientation, gender identity and/or expression, marital, civil union or domestic partnership status, past or present military service, family medical history or genetic information, family or parental status, or any other status protected by the laws or regulations in the locations where we operate. VMware will not tolerate discrimination or harassment based on any of these characteristics. VMware encourages applicants of all ages. VMware will provide reasonable accommodation to employees who have protected disabilities consistent with local law.  Category : Engineering and Technology Subcategory: Software Engineering Experience: Business Leadership Full Time/ Part Time: Full Time Posted Date: 2021-02-16  VMware Company Overview: At VMware, we believe that software has the power to unlock new opportunities for people and our planet. We look beyond the barriers of compromise to engineer new ways to make technologies work together seamlessly. Our cloud, mobility, and security software form a flexible, consistent digital foundation for securely delivering the apps, services and experiences that are transforming business innovation around the globe. At the core of what we do are our people who deeply value execution, passion, integrity, customers, and community. Shape what’s possible today at http://careers.vmware.com.  Equal Employment Opportunity Statement: VMware is an Equal Opportunity Employer and Prohibits Discrimination and Harassment of Any Kind: VMware is committed to the principle of equal employment opportunity for all employees and to providing employees with a work environment free of discrimination and harassment. All employment decisions at VMware are based on business needs, job requirements and individual qualifications, without regard to race, color, religion or belief, national, social or ethnic origin, sex (including pregnancy), age, physical, mental or sensory disability, HIV Status, sexual orientation, gender identity and/or expression, marital, civil union or domestic partnership status, past or present military service, family medical history or genetic information, family or parental status, or any other status protected by the laws or regulations in the locations where we operate. VMware will not tolerate discrimination or harassment based on any of these characteristics. VMware encourages applicants of all ages. Vmware will provide reasonable accommodation to employees who have protected disabilities consistent with local law.",software engineer
"ANB Bank hires individuals who provide excellent customer service and build meaningful relationships with our customers and within our communities. ANB is committed to rewarding our team members who strengthen our company and culture. ANB offers competitive compensation and a comprehensive benefits package for this position. Hiring Pay Range - $37.00 - $40.70 / Hour Benefits package offered, subject to eligibility requirements, includes: Company subsidized Medical, Dental , and Vision Insurance available for Employee, Employee +Spouse, Employee +Child(ren), and Employee +Family Healthcare and Dependent Care Flexible Spending Account Health Savings Account and Limited Purpose Flexible Spending Account for High Deductible Health Plan (HDHP) Company Provided Employee Life, Employee AD&D, and Long-Term Disability Insurance Supplemental Life Insurance for Employee, Spouse, and Child(ren) Supplemental AD&D Insurance for Employee and Spouse Short-Term Disability Discretionary Annual Bonus and 401(k) Match Paid Vacation, Sick, and Holiday Time Employee Banking Services ANB Bank is committed to providing Equal Opportunity in Employment. The Bank is continually trying to improve recruitment, employment, development and promotional opportunities for its employees. Our selection decisions are based on job-related factors and not on the basis of age, race, sex, color, religion, national origin, disability, sexual orientation, veteran status, or any other status. ESSENTIAL DUTIES AND RESPONSIBILITIES include the following. Other duties may be assigned. Maintains a current knowledge and consistent compliance with Bank Secrecy Act (BSA) requirements. Primary Programmer Analyst for all web and server projects using C#, VB.NET in an MVC environment along with other languages including JavaScript Framework such as React/Redux to develop new features, enhancements, and maintaining current systems and new applications Database systems, including design and migration Web-based applications using .Net and HTML5 Data retrieval using SQL and third party tools Assist department managers with projects as required Estimated travel requirements for this position is 2 weeks per year Responsible for reading, understanding and adhering to ALL ANB Bank Policies Ensuring assigned daily, weekly and/or monthly reports are completed in a timely manner Ensuring senior management is made aware of critical events and situations within the department Be accountable and own the outcome for your actions and the functionality of your department Be results oriented, customer focused, and have excellent interpersonal Skills to Collaborate in a team environment Troubleshoot and identify root cause of production issues and be able to formulate a resolution plan Other functions as required EDUCATION and/or EXPERIENCE Prefer 2+ years college with computers and/or programming experience, work experience will qualify Minimum 4 years experience with Microsoft Windows operating systems Minimum 4 years experience with C#, MS SQL, Scripting, ASP, VB.NET, ASP.NET and JavaScript Minimum 3 years experience in designing and programming for web sites Experience with React and JSON Knowledge of software engineering best practices and full software development life cycle Working Knowledge with AzureDevOps, CI/CD pipeline is a plus Equal Opportunity Employer/Affirmative Action/Minorities/Female/Disabled/Veteran ANB Bank complies with the Equal Pay for Equal Work Act. ANB Bank requests that Applicant not disclose its wage rate history to ANB Bank. If ANB Bank for any reason comes into possession of Applicant’s wage rate history, ANB Bank will not rely on it in determining a wage rate.",software engineer
"Company Overview iboss is a cloud security company that provides organizations and their employees secure access to the Internet on any device, from any location, in the cloud. This eliminates the need for traditional security appliances, which are ineffective at protecting a cloud-first and mobile world. Leveraging a purpose-built cloud architecture backed by over 190 issued and pending patents and more than 100 points of presence globally, iboss protects more than 4,000 organizations worldwide. The Company is headquartered in Boston, MA, and has operations in Orlando, San Diego, London, and the Philippines. At iboss, we believe that exceptional employees are the key to our success. Our teams are hands on, diverse, nimble, and highly empowered to drive excellence. Come be a part of the team that will transform the way cybersecurity is delivered!  Job Description As a C++ Developer Networking at iboss, you will have the opportunity to work on multiple technologies at a fast growing cybersecurity company. This is an excellent opportunity to become a leading member of a rapidly growing software development team. There are many exciting projects on which to work. iboss software developers excel at solving tough problems, collaborating well, and working with customer teams to rapidly deploy solutions. Responsibilities Ability to design and develop clean and maintainable code for high-volume production applications Experience coding in C/C++ and other technologies Experience working with large data sets Experience developing distributed software product architectures Quickly understand and extend engineering architectural patterns Deep understanding of the concepts behind solid software design: Abstraction, Modularity, Design Patterns, Representation Invariants, Networking, wireless, and/or security experience or knowledge preferred Document engineering designs Strong database knowledge of SQL constructs, and data modeling Qualifications 7+ years of software development experience in large scale commercial networking-oriented applications TCP/IP protocol stack, HTTP, DNS, and other related protocols Experience developing distributed software product architectures Strong analytical capability and record of independent contributions Must have a good sense of engineering tradeoffs, within the contexts of extendibility, scalability, performance, and maintainability Working knowledge of database technologies and SQL Comfortable working on a Unix environment Experience working in an Agile environment Team player with excellent interpersonal skills and the ability to work in a fast-paced environment Demonstrate excellent oral and written communication skills with the ability to listen, articulate, facilitate and advocate Master's or Bachelor's degree in either Computer Science, Computer Engineering, Electrical Engineering or Software Engineering Benefits Health, Vision, Dental, Chiropractic - open to domestic partners 401K with company match Paid Time Off (PTO) Company paid holidays Optimistic, supportive, and fun work environment Fantastic quarterly company events The duties and responsibilities described above are essential functions of the job. All qualified applicants will receive consideration for employment without regard to race, color, religion, sex, sexual orientation, gender identity, national origin, status as a veteran or as an individual with a disability. This position is not eligible for sponsorship of work visas",software engineer
"Job Duties and Responsibilities: DISH is seeking an innovative and passionate System Engineer II to join a team that is responsible for the management and maintenance of the DISH conditional access systems. This position is an opportunity to plan, develop, and contribute to the overall engineering design of complex, real-time, mission critical environments. Design, develop, implement, and maintain on-prem Kubernetes systems & CI/CD pipelines Administer and manage various server hardware, virtualization, and OSs Manage application environments to minimize outages and service interruptions Routinely research, analyze, and troubleshoot complex problems Create and maintain technical documents and procedures Ensure that solutions adhere to defined standards and best practices and/or assist in the development of these standards and best practices Skills, Experience and Requirements: Required Qualifications: BS in Computer Science or a related technical degree, or equivalent combination of education and experience 2+ years Docker/Kubernetes Administration 3+ years working in a virtualized (VMware) Linux server environment Experience with networking, backups, monitoring, alerting, logging Hands-on experience with CI/CD tools Experience with infrastructure automation software Scripting proficiency: bash, perl, python, etc. Strong critical thinking, decision making, and problem-solving skills Strong desire to automate Excellent written and verbal communication skills Must be willing to participate in on call rotation Preferred Qualifications: Experience managing AWS environments Experience with Helm, ArgoCD, SaltStack, GitOps, Jenkins Experience in administration of Centos/Debian Linux Advanced scripting experience Experience with system performance tuning/testing Familiarization with Scaled Agile/Scrum methodologies",software engineer
"Description We are the world’s learning company with more than 21,000 employees operating in 70 countries. We combine world-class educational content and assessment, powered by services and technology, to enable more effective teaching and personalized learning at scale. We believe that wherever learning flourishes, so do people. Senior Machine Learning Engineer Preferred location: Boulder, Colorado Do you love the field of deep learning and would you love a job with expectations to keep abreast on the state-of-the art in language processing? And a job also with expectations to continuously “move the performance needle” for the business? Do you resonate with the need for reproducible research and robust data pipelines? Can you write solid, well engineered code and work in a team environment of highly capable and motivated individuals? Are you excited at the idea of helping to build our next generation of machine learning tools, analytics platforms, and language/math assessment algorithms? Working closely with a small team of experts, you will have a unique opportunity to play a leading role in migrating machine learning based solutions from R&D to product-level operational delivery. The team at Pearson offers a unique environment for extremely skilled and motivated thinkers. Our culture is highly charged with people who are passionate about a cause, using technology to enhance students’ educational experiences. Our team has been building machine learning solutions for educational markets since 2004. Boulder, Colorado has been named as the happiest place in the U.S. and it's no surprise with its year-round outdoor activities, a surfeit of sunny days, a laid-back lifestyle, natural beauty that's always within view, ultra-fresh dining and natural foods scenes, the influence of the University of Colorado Boulder, a highly active culture, and enough craft beer to put a smile on anyone's face. Pearson is an Equal Opportunity and Affirmative Action Employer and a member of E-Verify. All qualified applicants, including minorities, women, protected veterans, and individuals with disabilities are encouraged to apply. Qualifications Required Skills MS or PhD in a quantitative field (CS, EE, statistics, math, data science) required 5 years experience in the field of natural language processing (NLP) 5 years professional experience as a software engineer or data scientist Strong coding capabilities in Python and/or R Experience with Linux and AWS; Kubernetes a big plus Proven ability to build neural networking models for natural language applications 5 years experience TensorFlow, PyTorch or Keras Strong in using Jupyter notebooks for research and data analytics The anticipated starting salary range for Colorado-based individualsexpressing interestin this position is $110–$120k annually. This position is eligible to participate in an annual incentive program. Benefits available to eligible employees can be seen at: https://pearsonbenefitsus.com/ Primary Location : US-RE-Remote Other Locations : US-CO-Boulder Work Locations : US-Remote Remote Job : Research and Development Organization : Assessments School Job Type : Standard Job Level : Individual Contributor Shift : Day Job Travel : No Job Posting : May 1, 2021 Job Unposting : Ongoing Schedule: : Full-time Regular Req ID: 2105907",software engineer
